cleaned_text,topic
amount time listened non living thing crazybless masterpiece album,Pop Culture
red rock show tonight also th anniversary becoming state thus centennial state home greatest performing art venue world,Pop Culture
edie come month review captured striving toward crafted story,Pop Culture
think mantle dc zack snyder suicide squad epic brutal superhero movie time perfect blend marvel like comedy gruesomeness dc,Pop Culture
margot robbie really intricate foot stunt suicide squad flip toe backward open lock,Pop Culture
suicide squad grossed estimated internationally weekend estimated international total stand estimated global total stand,Pop Culture
latest dawn bell journal thanks,Pop Culture
surely brought album get week holiday shrink,Pop Culture
hunter thompson favourite song lou reed bob dylan like spirit sky white rabbit,Pop Culture
check album window listent spoty,Pop Culture
music fromthe homie prod platform drop comment feedback skater imdropping sunday slow roll,Pop Culture
join u online open day noon find studying,Pop Culture
latest apple music daily thanks,Pop Culture
come back lord dont wait till late edward iwantasap feel,Pop Culture
solid presave spotify apple music checking teaser clip release,Pop Culture
fresh find discover music hot talent give listen jabber jaw mocity jones follow mocity jones listen,Pop Culture
bts apple music pm kst korea top permission dance butter dynamite life go boy luv ft halsey,Pop Culture
fresh find discover music hot talent give listen tictoc mo mint follow mo mint listen,Pop Culture
fresh find discover music hot talent give listen popstar dnb remix doozy listen,Pop Culture
fresh find discover music hot talent give listen diego opty follow opty listen,Pop Culture
apple music global butter permission dance dynamite,Pop Culture
felix spoil album bit,Pop Culture
remember came one guy say album wey na sax full inside guy shey see sax blow album reach,Pop Culture
woman reach peak apple music worldwide,Pop Culture
day great music video kosame cord,Pop Culture
music share feeling song,Pop Culture
excited album come friday tweet unlock preview song preorder album,Pop Culture
question weather team drop comment facebook post ill get answered onair throughout day stay safe everyone,Pop Culture
cannot put word much love every time listen fall love song thank creating absolute masterpiece cannot wait youll future,Pop Culture
watch live sister station orleans come ashore stay safe everyone,Pop Culture
like someone help figure,Pop Culture
hat team field tracking keeping u updated praying safety,Pop Culture
