cleaned_text,topic
beat game western division final evan edward hit run hr wp josh roberson ip h r bb k,Sports
anyone know game next thursday fox thats arguably last game entire schedule id imagine fox,Sports
voted best video game,Sports
streaming game come stop join,Sports
three unanswered goal tied game,Sports
great win yesterday stay go last game season great see callum bennett impressive see u home especially youth stepping,Sports
refreshing twitter hard right gopher game,Sports
raginggirlgamer featured visit earn chance win,Sports
game better handle needed handlingcompletion good enough win match let alone play final hope build season maguire believe possible,Sports
marked mediocrity four month hotter team game right tonight emergency episode answer many question pose one tune,Sports
wondering stayed washingtoncal game,Sports
preseason fixture v third preseason game morning win last week hopefully get another good preseason result ahead season silly mistake last week,Sports
first game win black swan,Sports
wellington cowboy back first time since cowboy first grade title performance worthy occasion cowboy downed minor premier dubbo cyms spark emotional celebration,Sports
tunisia second classification game angola mean win host china classification game pm today get ball running believe guy,Sports
game day good luck tonight augsburg wish could,Sports
check smurfs race smurf village game,Sports
day one session ran safe joined like usual party two people home game dealt train heist blast invited join home game,Sports
game day wish could see suit today rest get better soon hope hear cheering wny,Sports
game day mercedesbenz stadium,Sports
still time get bite happyness game start demo today palm beach garden come,Sports
game ai show live come listen deconstruct,Sports
week book rest cusa next tom stewart game recap,Sports
photo woman nation final game salo,Sports
entire offseason plus camp prepare st game season see sad,Sports
keep going lose game penalty last min play,Sports
sunday xi dec winslet mason over drew sunday xi over final game season next sunday v welcome see autumn,Sports
game night confed v,Sports
really hope dont let dont like prior year let team back even giant come score go right back field make score game,Sports
awesome win score goal fresh triston key hard fought match colt great game around,Sports
cleaning numbani playoff game name iconic duo,Sports
drinking game tonight take drink every time talk show screen,Sports
want play cant pull ben one bad half game knew would lose,Sports
hunch circumstantial evidence allegedly attempting sway game yesterday nfl entering sketchy territory ive got come,Sports
sep softbank hawk v lotte marine game highlight yahoo dome,Sports
biggest mismatch tonight game thought game analysis,Sports
super game win thriller,Sports
soccer girl varsity game westford academy v wayland high school westford academy trustee field,Sports
hire devs nba k every year get beta game star game company putting trash every year,Sports
boom game day varsity boy girl soccer ditch v pick north game time girl boy,Sports
three game preview week v v v good stuff,Sports
girard indian v john f kennedy eagle,Sports
check olathe north v lawrence free state game highlight sept olathe north high school varsity volleyball,Sports
game area grandview height man follow follow arcadia final game sure,Sports
cardinal take field cross town rivalry game v leuzinger olympian gonna great night thedalefootball,Sports
game day three team action week sts v h pm kick reserve v reserve pm kick rds v rds pm kick best luck three team,Sports
dont think expecting physical game today,Sports
elimination game v catch live pm ready go,Sports
minnesota viking v green bay packer prediction handicapping preview vega,Sports
announced attendance v tonight third largest crowd history,Sports
loved every minute v definitely became one favorite prowrestling match ever seen life,Sports
tyson fury v otto wallin start time live stream fight prediction date card odds preview fury wallin wilder,Sports
philadelphia eagle v atlanta falcon prediction handicapping preview vega,Sports
game day v div sponsored roebuck draycott clay lower abbot bromley school,Sports
heavy downpour dharamsala ahead first,Sports
next matchup philadelphia eagle v atlanta falcon comment think win tonight sunday night game fun bfitathletics stancesocks,Sports
first round v,Sports
sooooo v yesssssss,Sports
first match cwc challenge league tomorrow morning v host cest match centre extra update feed follow match centre team toss weather,Sports
lightweight fight need make v v v,Sports
wowvito goal rusnak time surely lost footing bad luck v,Sports
know game today also know gave run last game v know ufc fight clubhouse whew let see walk plank review week,Sports
msoc time pilot hit pitch wisconsin tune live update v wisconsin madison wi mcclimon soccer complex pm pacific,Sports
antonio brown debut another dominant defensive effort gostkowski beat heat recap win dolphin watch,Sports
live chief rewind week v raider,Sports
u premier county semi final v next thursday th patrick park enniscorthy support needed one,Sports
ebfl division match highlight v watch extended highlight first two game sandhurst townmead match footage filmed watch,Sports
field hockey take vermont outofconference matchup afternoon fell short last time uconn game,Sports
clean sheet marked th league start club moving th time ahead,Sports
great road win today boyzzz let go back home get w chief also hope everything okay prayer,Sports
whether group stage final full tour option budget come support next year booking open,Sports
randy arozarena first major league home run extends cardinal lead th inning arizona,Sports
boston red sox news hit home run top th inning put red sox ahead texas staff,Sports
signed cb torry mctyer chief practice squad placed cb darius phillips reserveinjured list,Sports
need offensive strategy screen pass getting u anywhere need move field left right look another one basketball season around corner year,Sports
excellent lasagne three horse shoe wensley dl hj job ringing handbell middleham bridge getting drenched car big big puddle,Sports
great video making played masterfully treat come follow barry check show,Sports
anyone see lockdown obj yard whole game till dude yd catch garbage time yard yippee also pinned obj ground count dude couldnt move talk little boying vet day every way,Sports
check signature series jeff janis auto green bay packer,Sports
cole grab k get groundball nearly knocked correa send martin maldonado plate top lineup follow,Sports
sport w dallas cowboy v green bay packer week,Sports
im loyal cityzen im taking shot title send personalized profile picture team colour reminder whenever team playing let play choose team,Sports
abraham im proud blue fan im taking shot title send personalized profile picture team colour reminder whenever team playing let play choose team,Sports
oh come ref letting rooster lay ffs,Sports
oh commentator professional foul say sin bin coz cronkthank god ref consistent,Sports
offered nick chubb marlon mack ty hilton cmc f mclaurin singletary man ppr running back josh jacob utilized liking worth trading best work horse ride,Sports
send please could get worse,Sports
realize call go way got absolutely screwed ref week week fix officiating please,Sports
god want jerry jones win game matter much paid ref,Sports
gonna support breast cancer awareness year,Sports
repeated first inning catch time leg side amazing superman style catch fly catch saha style,Sports
morning km run breast cancer awareness central park desa parkcity,Sports
seahawks taken control game ref get right,Sports
wasnt seahawks player flagged removing helmet,Sports
sweep world series first inning barrage propels past cardinal game story clincher,Sports
might drop college see astros world series,Sports
seem like like england patriot baseball hope god win world series better yet sweep,Sports
going go one greatest astros moment history president baseball ops said walkoff run home run game send astros world series,Sports
wish attending biggest gaming convention world joining epic giveaway chance win garrison gaming table,Sports
never thought would see day would world series breaking ground constructionist stadium representing dc highest level go get ship,Sports
oh football sunday almost forgot becausethe going world series,Sports
may world go bed sunday night awe display dismantled,Sports
game day boy also rooting saint raider today gonna show world mean,Sports
thought great game today japan v south africa game really hope get referee world cup final,Sports
stafford position win fourth offensive pas interference thomas cost first next set down lion went fourth fourth playcall perfectly covered game,Sports
know world series nba season starting leading golf tournament right,Sports
bravo bravo story telling mission cut scene campaign insane actually tore feeling bravo playing kid war zone,Sports
flame fire two team winless round get board today host pm aest tune,Sports
think guy great job game love graphic love story linecampaign multiplayer amazing game year thought,Sports
escape tarkov hour stream starting patch coming soon hype real,Sports
finally escape close game win bear miss field goal closing second maybe turn season around,Sports
fred warner put another solid performance huge win finished team leading tackle,Sports
kimball volleyball headed second round playoff halloween night pm location still tbd depending tonight game nevada union liberty ranch pge power outage status,Sports
format show build character story towards dec ppv fire withhold judgement untill ppv payoff know folk used weekly wrestling show actually showing continuity working formula,Sports
throwdown ii hour away rivalry set reignite fire pit ticket available,Sports
woman basketball season start sunday exhibition game mckendree detail interesting aspect indiana hoosier ahead season,Sports
storm first period medium timeout jirousek pp goal gp,Sports
ufc daniel cormier sport world react nate diaz v jorge masvidal finish app,Sports
trump went ufc york city promptly booed building introduced crowd,Sports
surprised even year former cricketer india still dont get difference odis t acceptable odis acceptable t,Sports
football end line flhs season,Sports
yo remember said gonna switch main palutena dlc character better go terry go,Sports
big match liverpool manchester city backing remember best way back favourite club earn process prediction,Sports
bring home boiz good luck today remember matter make u proud flying flag,Sports
hero successfully saved plenty last minute remember last year said want save first plenty serie one goal great way,Sports
yes l u geaux tiger lsufootball hazelnut orleans,Sports
dont remember questionbut know answer,Sports
watching ml cup seeing sea fan elated lead kind bummer knowing long clark continue nickel dime payroll fcd never experience joy elation th team team salary,Sports
remember following abc postgame coverage party continues postgame w whole buncha folk site might tough watch supporter everyone else ought good time,Sports
look like cup killing last minute,Sports
russell wilson handful react seattle winning ml cup front home crowd,Sports
think pouncey admired coming teammate aid let hope suspension reduced course play brown two week likely want keep game,Sports
rookie te stephen carlson hoping help brown turn around record second half nfl season,Sports
podcast episode brown bandwagon nfl week season,Sports
enough talk brown next favorite topic byu,Sports
apparently garrett race card running interference team today first anyone brown heard though team mate spoken incident hope add week lying appeal hearing dont cave card,Sports
also put kibosh interview maybe going spill bean nfl put pressure brown kill,Sports
wait main event time already,Sports
fight night scorecard focus punch thrown back head judge ref need var obviously see repetitive action real time,Sports
time main event v,Sports
charger lead lobos halftime exciting second half ahead u,Sports
reflecting main event sadly reminded main event came roh miss especially everything brought light miss day,Sports
great big fight feel main event v tessa reign full excellent match adding legacy big time cool moment champ,Sports
main event coming lucas bahdi ko take victor cardozo ko villeta paraguay,Sports
added money seems follow wherever go overlay main event player love getting tougher find work kidding course great work place always honor guarantee,Sports
missing today watching war game full make woman match lit number contendership match fun heel hottt let see main event match go,Sports
bit sad see amanda farrugia call day superb leader giant real heart soul kind player say alicia eva shoe fill think fly captain,Sports
alvin kamara bested russell gage jared cook main event,Sports
idk say first half performance getting better game go lookin solid line giving time defense got stay strong dont give point,Sports
another huge day ground third consecutive game least yard rushing,Sports
congratulation great season vmhs eagle make u proud fly high,Sports
wba bout anthony joshua defeat andy ruiz jnr,Sports
anthony joshua defeat andy ruiz reclaim heavyweight crown,Sports
read anthony joshua regains heavyweight title classy point win andy ruiz jr latest live reac,Sports
anthony joshua looked amazing last night definitely strictly come dancing winner fight trade coward heart,Sports
said would correct anthony joshua speaks reclaiming heavyweight world title see photo fight,Sports
anthony joshua regain title heavyweight champion andy ruiz jr photo,Sports
ufc result petr yan high kick urijah faber highlight,Sports
ufc result amanda nunes outwrestles germaine de randamie keep belthighlights,Sports
congratulation ufc,Sports
colby covington issue statement following loss kamaru usman ufc,Sports
final result south africa zealand beat host take second title joint top standing south africa two round,Sports
great comeback win road ram knock score trailing start th quarter,Sports
monday december rd first day christmas break weight room getting workout,Sports
overwhelming positive right cane good position entering christmas break positive,Sports
first manager christmas break clash,Sports
football return enforced christmas break road search early point,Sports
nice wake another win especially jet av also losing win streak team flying great see two goal winner ot,Sports
best game decade opinion,Sports
premier league player decade ia without doubt argue ask chance remove team best player replace hazard jump opportunity,Sports
gaelic football team decade check selection,Sports
begin decade conference playing crawley beginning getting thumped plymouth let end decade year style knowledge much come,Sports
way added team decade,Sports
favorite game decade order completely random long list want leave anything rimworld minecraft assassin creed odyssey anno,Sports
tammy abraham let gooooo wake early saturday,Sports
wow way end decade win league leader importantly denied eoin doyle scoring would give shout tonight,Sports
start decade wild card team end wild card team,Sports
keown saying jorginho lucky pitch score mention fact guendouzi shouldnt pitch get fouled first place pull back tammy box yellow,Sports
keep party going wake early either way year day black n white affair v see,Sports
decade take centre stage year day edition hoop buildup ahead sale around stadium also available digitally,Sports
kurt game decade saw list loved giving go could least honorable mention keep one per year simple premise ten year choose one best game say,Sports
happy year starting decade switching sevtech,Sports
dreadful fir half ball air way much real control need find midfield without best one already injured start decade looking let see company turn around,Sports
year resolution never miss,Sports
lakers havent missed single shot year st q v phx,Sports
first game decade gonna massive year u,Sports
turned instead want watch lakers game,Sports
lakers playing lazy defense slow,Sports
remember celebrated beat cowboy like super bowl enjoyed playoff game team watch home,Sports
never stop loving thing game told bill room growth im gonna looking forward seeing,Sports
said season year away playoff year bonus good one young core group led qb give allen another year develop keep defense intact draft wr use cap space wisely set longterm success,Sports
sad sad day super bowl year mean bout another black quaterback win super bowl,Sports
dear please give u niner fan exorcise demon dont want play raven super bowl,Sports
omg finally got episode cleared death call progress hope enjoy game looking forward episode,Sports
happy year hawk looking forward seeing tomorrow white day er week principal note,Sports
saturday action wrap raven facing titan check pick prediction help bet game,Sports
everyone picking today cover seem ignore scored five time havent lost since september mvp qb titan beat collapsing team last week let overplay bet,Sports
wonder cursing vehement dismissal titan chance point shes jinxed raven,Sports
think really good titan texan chief represent super bowl year p,Sports
take note good running game sign draft rb offseason congrats titan fan making far,Sports
go get seed people still doubt dominate viking advance host nfc championship yet wake today see great titan suddenly smh,Sports
glad thing working still dolphin fan hopping titan train,Sports
texan headed second quarter going locker room chief leading team cant make difference course entire game half,Sports
everyone hotelis cheering texan way im salty cardinal fan wanted watson watson bust draft,Sports
first team history point first quarter trail halftime ht,Sports
yd td pas devante adam given lead w left first quarter green bay,Sports
cowboy mike mccarthy texan need coach hope least,Sports
watching chuck terry etim first round often see rigor mortis set half way knockout,Sports
mma v link ufc mcgregor v cowboy live stream free date saturday january,Sports
king knock cowboy second wow,Sports
sending lot luck girl take zealand first round nation cup,Sports
going break first round match rafael nadal quarter bracket best bet lineup anyone able take,Sports
irish assassin man machine,Sports
disturbing video surfaced exnba player delonte west beaten street dc aaron hernandez documentary making life hard family odin lloyd listen,Sports
score update birdville azle finished first round strong starting,Sports
week nd junior run sunday th may sign,Sports
kobe might passed away im gonna stay strong live,Sports
tell u give er defense edge weekend,Sports
xbox battle predicts er win big game defeat preview sunday showdown,Sports
er case win super bowl liv might underdog san francisco er might actually superior team heading explains,Sports
north jersey h community may leave heart san francisco week bergen county alum preparing er grad kwaun williams one,Sports
kc corner rip kobe er contain mahomes young gunnas free game podcast pull talk thing super bowl check,Sports
boy take win tonight proud guy ggs carnage,Sports
sorry win game tonight better tuesday night guy,Sports
buffed rooftop ground war seems like even rooftop camper ever amount defcon nuke im seeing ridiculous,Sports
man really hope win tonight today,Sports
taking payment leap day express saturdayi ko outside ticket officehalf time west stand bar northpost game minute outside ticket officeits per personits still sold,Sports
always love late really hope desire win overcomes fear losing,Sports
serious question plan stepping position since tenure president run company ground curious,Sports
man repeat man slow steady win fight dont guy dont let someone push stair take,Sports
learning face sam knight cage wish looked small print contract riley fighter challenge taking knight wave pro championship,Sports
niner fan take timeout party make gift help u win friendly competition mercy child kansa city honor today matchup er chief,Sports
tremendous job picking blitz jimmy pull ball extend drive foot chief dfns expecting,Sports
everyone check boy guy gonna huge,Sports
think im person kc rooting chief still fun guy kansa city missouri,Sports
beat ref ground sbliv course congratulate afl fan historian cannot go detail admire lhunt present day mahomes special anyone say otherwise moron,Sports
thats foul ref blow another call,Sports
report redskin hiring jennifer king assistant nfls first fulltime black female coach,Sports
love want know alot houston supporting proud fan world series forever grateful beautiful memory one ever take,Sports
take second place indoor world series team event thank representing south point arena equestrian center,Sports
check patrick mahomes football display case w kansa city chief engraved nameplate available,Sports
check patrick mahomes football mini helmet display case chief nameplate available,Sports
check patrick mahomes chief autograph nameplate football jersey case x available,Sports
check patrick mahomes chief engraved nameplate football jersey case x available,Sports
check vintage kansa city chief reebok field adjustable embroidered cap nwt,Sports
spt fan less minute away show time recapping super bowl start xfl season nba trade deadline playoff race tune,Sports
shout boy hell game yesterday leading victory magnificent display incredible talent true grit pure love game football xfl embodies,Sports
alum celebrates win paying animal shelter adoption fee,Sports
check added closet poshmark kansa city chief football card lot,Sports
watching nationwide sport twitter including baylor fan rally behind mike boynton questioning ref game really warmed heart move,Sports
anyone else notice xbox one controller used review booth xfl game x stand xbox,Sports
oh btw pledging allegiance xfl,Sports
jordan taamu best qb xfl thats fact,Sports
big ten like going afl nfl right position win league big ten best conference countryyou put position win conference fantastic yr,Sports
isaiah simmons guy right might best linebacker enter nfl draft last five year simmons monster tackle last year tfl athletic ability insane surprised go,Sports
im happy world series without cheating player ownership forever linked cheater rest career,Sports
delusional think lou lamoriello great job despite fact loser lou hasnt made trade since july sad nhl establishment try push fake news passionate fan,Sports
man love still pray god love president,Sports
tech sgt sang looked president melania said yes yes yes thank embodying word many fought died,Sports
v fury ii live link wilder v fury ii livefight v fury live free,Sports
get deontay wilder proven one trick pony,Sports
deontay wilder got stopped round tyson fury aj ruiz deontay talked aj like dog smh wonder change tune,Sports
really bronze bomber fury right,Sports
congrats well deserved looking forward fighting soon wilder v fury ii tyson fury hand deontay wilder first career loss,Sports
always thought would perfect fight beat wilder many including thought dismantled wilder start finish zapped life pure masterclass,Sports
apparently tyson fury went night club post fight press conference basically stopped mgm grand battered deontay wilder way night,Sports
big congrats winning state qualifier big thing come next weekend,Sports
blood streaming wilder ear hope damaged product career ruining injury bronze bomber may gotten archilles hill soft target brawler thanks gipsy king,Sports
wr alex barbour place sixth class meet qualifies state open next weekend,Sports
aubameyang perfect replacement anyone else joke,Sports
congratulation knock deontay wilder win wbc heavyweight,Sports
rryan finnerty next weekend big game v hope decided ice nothing else ask fairly reffed game put right guy charge leave decipher meaning,Sports
thought saying everyone else trash man split isnt looking good,Sports
wowsers dude nail yard fg looking good,Sports
congratulation ashburn u aa victory montgomery blue cbhl championship ashburn v piedmont virginia state championship series next weekend howard blue v montgomery blue maryland best three winner go national,Sports
ref call today celtic v lakers game outrageous team deserve better,Sports
proud whole team good clean top finish team need ricky proving great driver cant wait next weekend,Sports
already confirmed tag jedeveon clowney interested per surprising team loaded cap space clowney love impact make field injury history scare,Sports
finally flynn nagel wide open couldnt see one person mind going hit die see field man,Sports
zhang v best womens ufc fight ever greatest fight ever unbelievable thought joanna run back,Sports
proud daughter team member year team kid raising fight cancer,Sports
live look walking locker room fight,Sports
really want joke joanna face fight think making meme stupid want recover,Sports
wish best enjoy fight,Sports
dana white going hard fought like crap even said fight sucked look agree probably best way approach press conference selling million ppvs watch fight,Sports
girl power show belt two famous number front packed,Sports
game derby day v always huge game always p per goal always manchester red,Sports
happy day light saving today want thank awesome physician provide coverage team help u keep athlete best,Sports
proud cricket team played remarkably well throughout tournament bad day already made u proud reaching wc final already champion inspiring many woman,Sports
epic battle wcc quarterfinal ripped pepperdine heart crazy clutch put game away lost instant classic hour one night,Sports
man hope clipper go lakers,Sports
manchester red,Sports
icymi today coast coast reacts sport shut across america join plus hour,Sports
icymi today coast coast reacts sport shut across america dr mitchell roslin join plus hour,Sports
athlete de campus closed notice practice weight roomin addition cant show track workout workout group safe healthy update occur hear district state,Sports
