cleaned_text,topic
hope give baz green light go ref saw biased refereeing today game field bunker disgraceful annesley cant keep protecting clown,Sports
reserve team man match sponsored gorseinon kai superb win getting score sheet great goal well done kai,Sports
already confirmed tag jedeveon clowney interested per surprising team loaded cap space clowney love impact make field injury history scare,Sports
year younger fitter bodyi pretty sure bat batter virat singh abhishek sharma combined,Sports
stanley cup habs lightning preview,Sports
commentator game given job based ability alone said chelsea happy point cup game,Sports
championship game week college football alabama v florida clemson v notre dame ohio state v northwestern oklahoma v iowa state pick preview line courtesy,Sports
ufc success boxing back soon,Sports
far survivor wicketkeepers team probably read pitch closely,Sports
team royal v team clutch team royal v ark razorback one lost one came second place game lit come check u next weekend much love boy stepping ready movie coming,Sports
congratulation great season vmhs eagle make u proud fly high,Sports
know team even bothered put boot today point mayo halftime tuam embarrassing stuff pathetic defending game,Sports
yes well done true inspiration good christmas year lewis,Sports
anyone else feel like bill,Sports
admire massive effort along bring sport back day remembered turning point return live sport competition,Sports
greatest show turf wr getting separation wr getting open positioning always great gotta love,Sports
im happy world series without cheating player ownership forever linked cheater rest career,Sports
great stat game led min tied trailed game ended one score affair start fluke better team,Sports
looking forward battle florida playoff,Sports
kimball volleyball headed second round playoff halloween night pm location still tbd depending tonight game nevada union liberty ranch pge power outage status,Sports
time date december pm adam gase still head coach,Sports
going go one greatest astros moment history president baseball ops said walkoff run home run game send astros world series,Sports
celebrating th anniversary world series team one game tonight one game get put top list incredible witness almost surreal difficult season game make summer fun,Sports
read anthony joshua regains heavyweight title classy point win andy ruiz jr latest live reac,Sports
hunter renfroe dont dowith two two out popped dodger get done get run home different level offensive baseball,Sports
errol spence jr back like never left nice win errol spence v danny garcia,Sports
sep softbank hawk v lotte marine game highlight yahoo dome,Sports
great comeback win road ram knock score trailing start th quarter,Sports
everyone need watch buzzer knockout,Sports
wellington cowboy back first time since cowboy first grade title performance worthy occasion cowboy downed minor premier dubbo cyms spark emotional celebration,Sports
super sunday premier league last war pm stay tune englishpremierleaguedaily premierleague v v leicestercity,Sports
saturday action wrap raven facing titan check pick prediction help bet game,Sports
glad thing working still dolphin fan hopping titan train,Sports
tyson fury v otto wallin start time live stream fight prediction date card odds preview fury wallin wilder,Sports
halftime entertaining first minute match live goal second half,Sports
cant wait watch main event fight tonight ufc fight night presented modelo brunson v holland app,Sports
feel like amazing job season even without main pitcher got far almost made world seriesim proud astros fan thank amazing season see yall next year,Sports
jan man making final appearance today servant best centre back last twenty year alongside ledley shame get send deserves thanks memory x,Sports
seem like like england patriot baseball hope god win world series better yet sweep,Sports
requesting hall fame script go winning champion league,Sports
team shutout bhsu yellow jacket sunday afternoon click link get detail great win,Sports
check patrick mahomes football mini helmet display case chief nameplate available,Sports
watching super bowl hope winning need gift card,Sports
prediction rest card makhachev put clinic stop dober aljamain pick strap yan nunes nunes retains izzy becomes champ champ stoppage,Sports
ufc derick lewis v ciryl gane post fight reaction,Sports
prop alex fight,Sports
congratulation italy simply hurt go every single one thank,Sports
delusional think lou lamoriello great job despite fact loser lou hasnt made trade since july sad nhl establishment try push fake news passionate fan,Sports
woman basketball season start sunday exhibition game mckendree detail interesting aspect indiana hoosier ahead season,Sports
u generation coming back unimaginable disappointment missing world cup russia,Sports
sunday morning catch,Sports
really love match amazing lately know champion sooner later,Sports
always love late really hope desire win overcomes fear losing,Sports
congratss th win,Sports
watching chuck terry etim first round often see rigor mortis set half way knockout,Sports
amount vuvuzelas winning beer cup would happened saved u madness,Sports
win georgia star baseball academy sp christian mansfield ip h k b b b rbi dog take seed play tn select bright early start bracket play,Sports
dillon tate pitch th oriole strike side tor,Sports
get deontay wilder proven one trick pony,Sports
lakers advance western conference final blowout win game,Sports
missing today watching war game full make woman match lit number contendership match fun heel hottt let see main event match go,Sports
repeated first inning catch time leg side amazing superman style catch fly catch saha style,Sports
columbus crew ml champ needed,Sports
lap brings light pit road four tire fuel attempted add tape quite stick came first left first,Sports
big congrats winning state qualifier big thing come next weekend,Sports
north jersey h community may leave heart san francisco week bergen county alum preparing er grad kwaun williams one,Sports
brand facility night let get thing underway tyler reddick lead field green flag shortly,Sports
beat ref ground sbliv course congratulate afl fan historian cannot go detail admire lhunt present day mahomes special anyone say otherwise moron,Sports
cole grab k get groundball nearly knocked correa send martin maldonado plate top lineup follow,Sports
check stephen curry swingman jersey chinese year white small youth used,Sports
ccc softball championship live score oregon tech nothing going u th well head,Sports
also put kibosh interview maybe going spill bean nfl put pressure brown kill,Sports
great comeback win overtime v lake park proud guy excited senior night tomorrow v glenbard north,Sports
vamosssssssssssssssssss rafaaaaaaaaaaaaaaaaaaaa th time champion take bow warrior king longest best set roller coaster match year highest quality long live king,Sports
irvin anyone see jerry rice greatest need head examined,Sports
cut net lehgoooooooooo,Sports
overwhelming positive right cane good position entering christmas break positive,Sports
lone offensive pick saturday delivered production two year ago memphis opting rb kenny gainwell video,Sports
getting better every year,Sports
guardiolas tinkering end familiar champion league exit man city,Sports
great big fight feel main event v tessa reign full excellent match adding legacy big time cool moment champ,Sports
ufc bonus dana white open checkbook six fighter rewarded,Sports
respect sticking around congratulating winning team james harden straight locker room show type person must learnt lebron,Sports
ref call today celtic v lakers game outrageous team deserve better,Sports
keep going lose game penalty last min play,Sports
offered nick chubb marlon mack ty hilton cmc f mclaurin singletary man ppr running back josh jacob utilized liking worth trading best work horse ride,Sports
fun watch dominate semi good luck gold medal match,Sports
start calling class nfl draft class amount talent theyre compiling newest addition brandon inniss top receiver country,Sports
haha right tell go tide cut net,Sports
massive episode buntsbruises show welcome tonight logan come help preview stanley cup final breaking mlb season far electric episode tap tonight otbn cameo well,Sports
stat day scored alltime point red bull ring,Sports
wowsers dude nail yard fg looking good,Sports
game derby day v always huge game always p per goal always manchester red,Sports
ufc result petr yan high kick urijah faber highlight,Sports
anthony joshua looked amazing last night definitely strictly come dancing winner fight trade coward heart,Sports
exciting news launching competition structure ahead planned return action september includes prestigious cup wait see everyone back court competing,Sports
believe day away one best countdown yet come back show greatest mma fighter history lightweight divison arguably ever undefeated eagle blessing,Sports
world series corey seager single give dodger lead th por n con,Sports
julio jones headed big time deal get nd round pick return titan best punch,Sports
everyone hotelis cheering texan way im salty cardinal fan wanted watson watson bust draft,Sports
sunday xi dec winslet mason over drew sunday xi over final game season next sunday v welcome see autumn,Sports
gabriel jesus offer glimpse man city always hoped could,Sports
watching coverage olympic road race amateurish interview important part race get back commentary,Sports
game day mercedesbenz stadium,Sports
live look walking locker room fight,Sports
pathetic bias seen tonight favouring manu like man city last night let impartial,Sports
big shoutout tonight everyone hope first live autzen experience lived hype see tonight eugene portland tomorrow show love especially make killer trip see,Sports
loved every minute v definitely became one favorite prowrestling match ever seen life,Sports
take note good running game sign draft rb offseason congrats titan fan making far,Sports
boston red sox news hit home run top th inning put red sox ahead texas staff,Sports
everyone picking today cover seem ignore scored five time havent lost since september mvp qb titan beat collapsing team last week let overplay bet,Sports
tell u give er defense edge weekend,Sports
cleaning numbani playoff game name iconic duo,Sports
next main event let go,Sports
check patrick mahomes football display case w kansa city chief engraved nameplate available,Sports
daniel james martial rashford front three tonight matic also start,Sports
antonio brown debut another dominant defensive effort gostkowski beat heat recap win dolphin watch,Sports
reflecting main event sadly reminded main event came roh miss especially everything brought light miss day,Sports
need offensive strategy screen pass getting u anywhere need move field left right look another one basketball season around corner year,Sports
podcast ohio state football early signing day preview,Sports
take second place indoor world series team event thank representing south point arena equestrian center,Sports
finally flynn nagel wide open couldnt see one person mind going hit die see field man,Sports
yearold southampton leftback jake vokins likely leave club loan ahead next season,Sports
heat race coming next note lap top transfer top go dash,Sports
time main event v,Sports
said would correct anthony joshua speaks reclaiming heavyweight world title see photo fight,Sports
watched fa cup final last nightas every year great see lift trophywell deserved great see fan backatmospherenoise credit side fa cup always magic kid still book proof tear,Sports
epic battle wcc quarterfinal ripped pepperdine heart crazy clutch put game away lost instant classic hour one night,Sports
good back today keep going,Sports
preseason fixture v third preseason game morning win last week hopefully get another good preseason result ahead season silly mistake last week,Sports
watching ml cup seeing sea fan elated lead kind bummer knowing long clark continue nickel dime payroll fcd never experience joy elation th team team salary,Sports
end first quarter warrior lead anthony edward minnesota catch second quarter w online,Sports
oh btw pledging allegiance xfl,Sports
remainder sport radio kevin woolfe race race race race race race race race,Sports
check added closet poshmark kansa city chief football card lot,Sports
really intrigued win game think one future face league dont know got help need right would also love able talk kawhi king la another couple week,Sports
never understand newcastle went bruce benitez,Sports
winner wednesday evening fa youth cup rd qualifying round tie host winner tie st round proper,Sports
potential champion crowned tonight legacy defining day star talk morning scott foster clown shouldnt employed somehow head ref important game season clean,Sports
monday december rd first day christmas break weight room getting workout,Sports
far survivor wicket keeper team expert epadi evanga matum solunga,Sports
fred warner put another solid performance huge win finished team leading tackle,Sports
watching super bowl phone game watching commercial,Sports
watching nationwide sport twitter including baylor fan rally behind mike boynton questioning ref game really warmed heart move,Sports
wasnt seahawks player flagged removing helmet,Sports
minute player need greatest impact,Sports
proud cricket team played remarkably well throughout tournament bad day already made u proud reaching wc final already champion inspiring many woman,Sports
aye james harden hardly twitter rocket stint went net tweeting scary hour every winwill tweet go back twitterlmao,Sports
think timo werner matchwinner saturday think prove mvp night blue carry day,Sports
sorry actually really enjoyed boat race today great ouse close exciting also slightly biased cambridge race,Sports
might drop college see astros world series,Sports
night great prop bad bunny clearly committing bringing drew v lashley heavyweight classic v chef kiss future bright,Sports
cowboy mike mccarthy texan need coach hope least,Sports
podcast episode brown bandwagon nfl week season,Sports
really bronze bomber fury right,Sports
happy year hawk looking forward seeing tomorrow white day er week principal note,Sports
wait watch live sport first time month,Sports
sending lot luck girl take zealand first round nation cup,Sports
congrats go spank dodger salute build run go get em next year,Sports
cyclone chance separate pack month iowa state remaining october schedule v ttu pm bye ok state tbd kansa tbd,Sports
philadelphia eagle v atlanta falcon prediction handicapping preview vega,Sports
reaction one hardestfought win career one gave victory season opener first time since,Sports
come join u tonight pm est inside distance podcast talk thing mma breakdown fight ufc help make ton cash miss,Sports
want play cant pull ben one bad half game knew would lose,Sports
dak prescott first career reception td put halftime,Sports
really curious show next year great drive today,Sports
whether group stage final full tour option budget come support next year booking open,Sports
congratulation ashburn u aa victory montgomery blue cbhl championship ashburn v piedmont virginia state championship series next weekend howard blue v montgomery blue maryland best three winner go national,Sports
bounce went way trae klatt tipdrill td catch late th helped raider beat cpu class first round,Sports
wonder cursing vehement dismissal titan chance point shes jinxed raven,Sports
anyway hardly point used reason going amount individual error weve made season end season dvd compilation best one,Sports
sweep world series first inning barrage propels past cardinal game story clincher,Sports
next game time update v ohio state cbs sport classic cleveland oh rocket mortgage fieldhouse saturday december pm et cbs tunein,Sports
hell shakib play like playing like chasing score shakib playing like chase remove bring next year remove morgan shakib dk,Sports
idea undertaker return end every wrestlemania collect body main event loser,Sports
q john lovett tackle bear rolling,Sports
columbus crew ml cup title win seattle balknmag,Sports
blood streaming wilder ear hope damaged product career ruining injury bronze bomber may gotten archilles hill soft target brawler thanks gipsy king,Sports
hope senior get go yard tonight bring home boy give em heat,Sports
ufc ppv start minute life good,Sports
year eve make good choice stop think risk afford take affect future affect family affect teammatescoaches,Sports
flame fire two team winless round get board today host pm aest tune,Sports
jack white super bowl,Sports
didnt get catch night live watching work seeing fan cold open made legit emotional brought happy wrestling man tear eye thanks,Sports
know missed throw back last time lightning stanley cup later,Sports
ready see get w tonight make conference final first time history,Sports
like format love prime time spot think shouldve put biffles tire start car would little fair field came last lead lap cant take away local he doin great,Sports
start season started bottom,Sports
away win sunshine,Sports
wow way end decade win league leader importantly denied eoin doyle scoring would give shout tonight,Sports
love want know alot houston supporting proud fan world series forever grateful beautiful memory one ever take,Sports
prayer anyone west virginia bear today unfortunately,Sports
massive congratulation watching documentary bloke absolute inspiration fighting another fight called mental health perfect family man since become hero,Sports
start decade wild card team end wild card team,Sports
goal danny ings ever scored premier league season,Sports
great night last night guy colin sahlmanm leo young mile lex young mile girl sam mcdonnell mile ailish hawkins mile,Sports
cmon boy let make start brilliant summer,Sports
announced home opener canadiens playing stanley cup final think happier man michael andlauer right,Sports
manchester red beautiful fan,Sports
already crazy groin strike even main card yet,Sports
check wrote mouth watering encounter lisbon everything need champion league final link,Sports
format show build character story towards dec ppv fire withhold judgement untill ppv payoff know folk used weekly wrestling show actually showing continuity working formula,Sports
unacceptable time clean house top bottom people running sport seem incapable job excuse today excuse sauter wreck texas excuse truexcuster wreck cota strike youre,Sports
nd annual draft book first one done virtually see went first round,Sports
hear people saying clip upset officiating late fouled charge jackson fouled whole way rim pg missed clutch free throw thats difference,Sports
proud whole team good clean top finish team need ricky proving great driver cant wait next weekend,Sports
far survivor wicketkeepers team probably read pitch closely courtesy,Sports
know patrick ewing congrats claiming big east auto bid catch aq bid tracker,Sports
looking forward start season fresh season one adjustment schedulewise progress evolution sport relevant way track,Sports
announced attendance v tonight third largest crowd history,Sports
sooooo v yesssssss,Sports
kobe might passed away im gonna stay strong live,Sports
quicker end expected blast girl coach teammate life,Sports
check patrick mahomes chief autograph nameplate football jersey case x available,Sports
first match cwc challenge league tomorrow morning v host cest match centre extra update feed follow match centre team toss weather,Sports
row baby another big win look bull team know needed vooch make every player team better guy worked hard keep going guy,Sports
chelsea bringing trophy home blue way,Sports
awesome win turn corner takedown best enjoy w friend,Sports
said season year away playoff year bonus good one young core group led qb give allen another year develop keep defense intact draft wr use cap space wisely set longterm success,Sports
fun fact womens basketball team play gold medal tonight rematch st womens olympic game history took place montreal,Sports
always love someone go grain im think chief win,Sports
live europa league final villarreal manchester united first blood united villarreal foyth ended bandaged head moreno villarreal leading break,Sports
michael owen premier league accumulator today see predicted happen final match today odds bet win betslip link included read tip,Sports
si sooner former ou golfer abraham ancer fall nd master going sunday final round,Sports
xbox battle predicts er win big game defeat preview sunday showdown,Sports
lavonte david say tom brady told teammate stop cry reaching super bowl think brady great game might come last drivetied kc would score win capturing point spread,Sports
dang bringing heat tonight knockout buzzer,Sports
rryan finnerty next weekend big game v hope decided ice nothing else ask fairly reffed game put right guy charge leave decipher meaning,Sports
yard rushing st half record yard game charlie davis okie state,Sports
loop hour conspiracy theory lopez review houston sport award attendee nonattendees paint perfect texan offseason picture og chat gary kubiak,Sports
congrats keep going sky limit best luck gold paris olympic,Sports
great action ncaa woman hockey championship bad app tv,Sports
correction he second fighter signed team year,Sports
tyson fury sings american pie beating deontay wilder post swaggered greatest,Sports
take mithali raj inning score nothing may good considering strike rate decent considering match situation team need one anchor comment harman try someone else,Sports
jordan taamu best qb xfl thats fact,Sports
ncaa tournament full swing game take look basketball history uncovered interesting nugget must read,Sports
way added team decade,Sports
defense field way much already showed touchdown steelers,Sports
congratulation boy getting ncaa tournament pulling,Sports
king clay take win th barcelona title took hour minute victory,Sports
wait main event time already,Sports
congrats threw everything nadal king clay denied,Sports
dont care anyone say still got happy see ring,Sports
move second big move past inside,Sports
lakers playing lazy defense slow,Sports
fancy win open today shame dropped shot last hole yesterday wouldve great spectacle seeing leading within shot going last hole,Sports
oh commentator professional foul say sin bin coz cronkthank god ref consistent,Sports
yes l u geaux tiger lsufootball hazelnut orleans,Sports
amount people jump bandwagon one slagging name whenever got beat dont support defeat yous cant support victorious champ back,Sports
icymi guy recapped st half nba season sure go listen subscribe share rate review thanks friend,Sports
next matchup philadelphia eagle v atlanta falcon comment think win tonight sunday night game fun bfitathletics stancesocks,Sports
ccc softball championship live score oregon tech pitch inning ci brings u th,Sports
hunch circumstantial evidence allegedly attempting sway game yesterday nfl entering sketchy territory ive got come,Sports
errol spence jr versus danny garcia breakdown,Sports
hope give baz green light go ref saw biased refereeing today game field bunker disgraceful annesley cant keep protecting clown,Sports
aleksandar rakic paraphrase israel adesanya beat jan blachowicz main event next go back middleweight rakic want fight glover teixeira interim light heavyweight belt,Sports
leading front firstever elite group match chandigarh captain scored matchwinning second list century seal run target like yuzvendra chahal mohit sharma rahul tewatia,Sports
source air quality pic plan stay play la v,Sports
dana white going hard fought like crap even said fight sucked look agree probably best way approach press conference selling million ppvs watch fight,Sports
bruin come back quick run lead left game team tied point paint,Sports
randy arozarena first major league home run extends cardinal lead th inning arizona,Sports
champion league final set played wembley,Sports
idk keep showing u ohio state fan club telling u committee,Sports
night one great top bottom good match crowd really make impact thank stellar night,Sports
marco tilio starting versus month leaving club search regular game time story,Sports
congrats well deserved looking forward fighting soon wilder v fury ii tyson fury hand deontay wilder first career loss,Sports
several former active cricketer taken social medium express objection incident ground,Sports
signed cb torry mctyer chief practice squad placed cb darius phillips reserveinjured list,Sports
im loyal cityzen im taking shot title send personalized profile picture team colour reminder whenever team playing let play choose team,Sports
sport w dallas cowboy v green bay packer week,Sports
ill put hand say unluckiest team bottom half especially train wreck team wce clogging valuable real estate,Sports
w in out jamal adam trade first dealing covid camp qb preview ahead training camp,Sports
horse race today think starting super bowl huge,Sports
football return enforced christmas break road search early point,Sports
tammy abraham let gooooo wake early saturday,Sports
sad sad day super bowl year mean bout another black quaterback win super bowl,Sports
th best odds win super bowl next year im already pumped september,Sports
added money seems follow wherever go overlay main event player love getting tougher find work kidding course great work place always honor guarantee,Sports
halfterm manchester united would grade red devil first half season latest piece grade second half campaign set kick,Sports
im proud apart man suffered long enough year still cringe remembering bad starting line made onward western conference final,Sports
week book rest cusa next tom stewart game recap,Sports
red knight hold defeat harrisburg score tough week red knight huge bounce back win tonight end game day stay safe,Sports
know world series nba season starting leading golf tournament right,Sports
girard indian v john f kennedy eagle,Sports
