cleaned_text,topic
wonder song got perform award show probably eclipse song album title one,Pop Culture
album like broke baby heart tho,Pop Culture
would like send love along virtual hug head pat monsta x monbebe well storm pas strongest forget,Pop Culture
truly impressed amount rust pistol end episode,Pop Culture
watching eating noodle perfect sunday,Pop Culture
remember first heard bts ft mrl would play song bts,Pop Culture
sometimes forget always remember monsta x,Pop Culture
hi army hope great weekend remember drink water vote tag bts,Pop Culture
oh ya also remember vote ok,Pop Culture
ok monbebe guess time head bed keep trending see morning remember monsta x love,Pop Culture
hi everyone week time actually lately check youtube video week remember fun cheer,Pop Culture
remember ikon left without bi protest yg stayed silent banner fansign today none mean local organizer charge decoration,Pop Culture
remember balance interaction everyone clear exo follower theyre automatically going receive likesrts way combat comment xexos post please make sure reply,Pop Culture
really really really go bed wishing best luck hosting light performance watermelon sugar release,Pop Culture
want watermelon sugar need hear harry swearing,Pop Culture
movie sunday pm rsvp,Pop Culture
watermelon sugar sound even better live good,Pop Culture
watermelon sugar make feel like belong beach playing volleyball jamming friend love much thank u gem kiwi truly walk,Pop Culture
love tour harry watermelon sugar fan high harry watermelon sugar fan high harry watermelon sugar fan high need ticket,Pop Culture
celebrating watermelon sugar disneyland,Pop Culture
tvmusic network watch harry style perform light watermelon sugar saturday night live,Pop Culture
breathtaking thats im going sleep thinking p harry watermelon sugar taste good,Pop Culture
harry sricken style brooooo watermelon sugar goooodd oh lorrrrddddd cannot wait album,Pop Culture
high school u go watermelon sugar high,Pop Culture
watermelon sugar de harry style em,Pop Culture
guess listening watermelon sugar light today nonstop hint,Pop Culture
praying many u made mistake heat battle cant wait see bounce back continue record breaking career repent remain broken fox,Pop Culture
petition hannah montana curly haired go tour missing old day,Pop Culture
harry style watermelon sugar reaction,Pop Culture
debating gun safety legislation senator interrupted another school shooting,Pop Culture
listen harry style watermelon sugar first deep dive music came surface sort mesmerized,Pop Culture
didnt watch harry style weekend dont sweat covered ranking everything former one direction member dual host musical guest,Pop Culture
harry style watermelon sugar official audio x yesssss,Pop Culture
check watermelon sugar harry style,Pop Culture
top artist tokio hotel harry style bring horizon hawthorne height andrea bocelli,Pop Culture
stream album love guala,Pop Culture
absolutely loved interview best podcast ive listened long time album masterpiece,Pop Culture
roha vote stream album let get rohas fighting,Pop Culture
rohas make win vote mwave starplay stream album let get rohas,Pop Culture
conversation brilliant album imagination misfit kid grammy nomination composing euphoria working beyonc sia kanye zendaya hope record sir paul mccartney future plan,Pop Culture
port harcourt ready home away concert coming th december higi haga along peter odili road time pm carpet pm main event,Pop Culture
winning ticket see august highlight year forever thankful,Pop Culture
listen album melody,Pop Culture
happy bday chanyeol hope wonderful day member saranghae exo fighting also good luck release album,Pop Culture
thankful,Pop Culture
happy preorder album user get free single official drop date january st let goooooo,Pop Culture
watch musician release album light music video home movie,Pop Culture
wow amazing bright christmas light outside hotel,Pop Culture
love christmas light,Pop Culture
uvtraveler rooted ground,Pop Culture
live update stage sierra leon national stadium sold,Pop Culture
world greatest performer watch video see,Pop Culture
every time ot come together feel heavy absence home every time see mbb long lie come back stay strong monbebes,Pop Culture
x let fly high,Pop Culture
rest well today boy worked hard always ilysm,Pop Culture
eat well rest well,Pop Culture
hope good day please rest well,Pop Culture
rest peace juice wrld literally artist actually liked music helped calm tough time actually made feel good dont care one see tweet legend die making rip,Pop Culture
legend fall making,Pop Culture
still see shadow room rip,Pop Culture
haluuuuuu sasagipinkitadarren onasap apple music youtube spotify,Pop Culture
unknown battle spotify apple music bandcamp,Pop Culture
apple music go stream,Pop Culture
lead dark apple music lead dark bandcamp spotify,Pop Culture
star teardrop ancestral disorder album spotify bandcamp apple music,Pop Culture
meet victoria mahoney first woman direct star war film,Pop Culture
saying along film theory uncomfortable truth jedi order star war jedi evil,Pop Culture
friend humble request please trend ask others tweet retweet constitution countryand inciting others,Pop Culture
star war rise skywalker preview review,Pop Culture
star war signal future black hollywood joe biden agrees,Pop Culture
force strong guy fantastic review spoiler seen movie yet watch check star war rise skywalker movie review,Pop Culture
disney star war rise skywalker still dominated box office despite harsh review follow news,Pop Culture
check star war bb bah humbug christmas holiday snow globe coin piggy bank,Pop Culture
absolutely loved every moment star war episode perfect setup managed bring saga fine conclusion probably helped misdirects tlj well done cant wait watch merry christmas,Pop Culture
though met already low expectation still grateful given year wrote came still appropriate,Pop Culture
rise skywalker ring second best christmas ever little woman spy,Pop Culture
christmas break head resides along every episode sweet time,Pop Culture
tell taehyung amazing kb gayo also album way,Pop Culture
medicare plan finder ad medicare plan finder ad listen live wake morning mf urban talk news laugh,Pop Culture
know ive said id lay line yennefer want amend say yennefer jaskier,Pop Culture
f sicko mode listen live wake morning mf urban talk news laugh,Pop Culture
f x wish wish listen live wake morning mf urban talk news laugh,Pop Culture
b join urban music revolution listen live wake morning mf urban talk news laugh,Pop Culture
baila baila baila listen live wake morning mf urban talk news laugh,Pop Culture
random tweet artist decade going artist next decade,Pop Culture
angelo lady listen live wake morning mf urban talk news laugh,Pop Culture
notorious big big poppa listen live wake morning mf urban talk news laugh,Pop Culture
still cant understand people know seeing great talented iswe country better wake ooocox ghs greatest resource music industry,Pop Culture
find mbc voice ad find mbc voice ad listen live wake morning mf urban talk news laugh,Pop Culture
last bollywood movie decade turn one best movie decade take bow diljitkiara superb kareena stupendous must watch,Pop Culture
enjoying sound defected radio house track decade special h,Pop Culture
already know album sound even better spring song like sunflower vol adore play beautifully degree sunlight,Pop Culture
deckchair poet iced bun album always piste christmas playing final track decade finishing laugh,Pop Culture
great end decade nd great gift fan ahead year solid look solid logo expectation set high,Pop Culture
dance decade away year mastermix good end way started radio listen live tonight pm thank,Pop Culture
okay tasked come top list movie decade hard designed protocol scroll year find favorite year tie thanks duality brain,Pop Culture
listen album aha gazelle available,Pop Culture
top cumulative box office cr nett movie tasted success box office winning streak past year,Pop Culture
song song decade song year reached year eve tom slick show radio rock blitz hope guy like,Pop Culture
plz sign help put end stop dog fighting punish elmer james given jr full extent law sign petition,Pop Culture
looking forward sa starla song boy starlastarrysunday tntboys,Pop Culture
release delighten mind flawless tune full audio yt unique bit u nailed music lyric link,Pop Culture
latest start inspire daily thanks,Pop Culture
really looking forward group talent dream waste time let debut learn mistake already good artist work hard hidden building,Pop Culture
first live featuring watch full video watch itsubscribe follow also dropping,Pop Culture
boy love show three investigator great united state bit hard watch always make sure never miss episode,Pop Culture
song kick first round video hey singing background check,Pop Culture
begin bad boy life coming officially starting wednesday,Pop Culture
gig horizon free entry one hitchin metal mass first round come,Pop Culture
bad boy life grossed estimated weekend represents nd largest january debut alltime day weekend estimate,Pop Culture
bad boy life win box office huge holiday weekend,Pop Culture
congratulation winner deserve however dont understand despite strong role didnt get award far truly deserves,Pop Culture
watching episode lefthand path se,Pop Culture
episode available listen like comment follow follow,Pop Culture
understand everytime make asim say sorry shukla para zariwalla respect show even caller week always called clear shukla co accident think,Pop Culture
finished episode would kill clover liked moment showed screen total badass became favorite character season meant,Pop Culture
still understand get play grown end deathly hallows pt never please write grown hp adventure finally see element jo hp,Pop Culture
episode start,Pop Culture
police chief make well apparently netflix annoyed fan lucifer fellow seems great influence allowed discus case time,Pop Culture
check beast cellar severin blu ray lmtd sold k scan,Pop Culture
cute innocent boy heart kiddish sometimes goofy sometimes lovable kind polite time,Pop Culture
stay strong watching back matter,Pop Culture
really hope together soon request u fight ur fan want see uh together fighting love uh,Pop Culture
daredevil got hand turtle foot get guy go ninja go ninja go maestrochoung young,Pop Culture
fan poster absolutely stunning really hope winning poster get official poster,Pop Culture
really hope performs play brings singing like recorded version,Pop Culture
bird prey fantabulous emancipation one harley quinn movie review reel reject,Pop Culture
check latest review bird prey movie review,Pop Culture
bob marley wailer trenchtown rock ur future update tune tag,Pop Culture
jennifer lopez live nation partner multiyear touring deal exclusive,Pop Culture
listen chat bird prey director cathy yan,Pop Culture
jade bee masked singer please say im wrong im losing mind,Pop Culture
added listing poshmark nwt jennifer lopez boyfriend jean,Pop Culture
lauren know hedgehog masked singer heard first il retweeting revealed,Pop Culture
w woman gone bob marley visit,Pop Culture
box office bird prey disappoints million debut,Pop Culture
j lo fan trying steal oscar award hand heartthrob definitely blue thing,Pop Culture
harley quinn bird prey gamrbarbie photo make happy remember follow u,Pop Culture
bird prey show summer conclude summer reading program youre best thanks everything,Pop Culture
ive got much ticket ticket see masked singer live,Pop Culture
hit loved excellent review,Pop Culture
exciting painfully real time still shocked loved film much find watching film,Pop Culture
happy valentine puddins u tell saw bird prey korneliaroma lightworkssociety giantscastingshadows ocwomensmarch santaneraliving,Pop Culture
kaash paige love song lyric queen lovei love song,Pop Culture
glad cassie finally said yes dress,Pop Culture
kabir singh didnt filmfare award mean seriously kidding wonder india never win oscar hypocrite,Pop Culture
really understand running oscar great horrorsuspense flick watched long time probably last saw beautifully shot movie loneliness thankyou watch,Pop Culture
inspirational station internet ver na jones uncoditional promo visit listen online,Pop Culture
joaquin phoenix destroys dairy industry livekindly,Pop Culture
fuming internet wont load video ya gal still gonna help get trending,Pop Culture
guy let break internet,Pop Culture
pm listener help becoming official going official patreon page show love matter cost along getting nicee song,Pop Culture
ft perfect match tonight thank,Pop Culture
perfect song beautiful night feat thank jimin,Pop Culture
sid naaz inseperable sid naaz love sid naaz care sid naaz perfect example true love make sidnaaz,Pop Culture
jungkook choreography time like perfect song dance,Pop Culture
choose let go x stay forever one stop fly high,Pop Culture
fire fly high high higher fire fly high high higher hwangholgyeonge ppajin deusi jeongsini ontong neoppunya uh hanchameul hemaedeon sungan beonjjeogin like thunder lightsaber yeah,Pop Culture
dj cheys chained blue coming next wiggle know midnight thanks listening show see next weekend,Pop Culture
coming next hope x please play song thank,Pop Culture
coming next hope feat please play song thank,Pop Culture
ruled world play ft please play official music video,Pop Culture
like request bts feat let keep requesting together army,Pop Culture
hi could play japanese artist song first week billboard japan chart sixtones imitation rain music video youtube ver,Pop Culture
coming next hope bts feat,Pop Culture
hope bts ft coming next,Pop Culture
arashi turning rhab remix official music video,Pop Culture
saw white lady musical kinsale last night one thing absolutely blew mind winner dancing star dance whole show,Pop Culture
seddy hendrinx lowkey official music video,Pop Culture
music video still pic way feel directed founder belruz videography carlos colon visualimagefilms music video link bio,Pop Culture
mary j blige u one official music video,Pop Culture
aye man made top top hbcu dj voting end tonight wanted thank everyone voted frfr mean lot salute dj keep great work thank,Pop Culture
list favorite show binge two week social distancing skipped hulu intentionally hillary special,Pop Culture
ive watched episode stranger hows first day social distancing going show recs,Pop Culture
gulf stream rider end line,Pop Culture
heartfelt always sandy mclelland acclaimed album cross line enjoy please cool lovin horde,Pop Culture
waiting bash trudeau today note shutting economy going hurt u keep distance take precaution stay home kudosfrontline worker helping u stay afloat faith,Pop Culture
newest episode go back movie theater still open last week available,Pop Culture
hope ft coming next kineticfilm music video,Pop Culture
idk sitting thinking momma swift please stay healthy safe time,Pop Culture
tv review daily story,Pop Culture
ok look ive finished tiger king one thing need get next week danny mcbride submitting weekly video sucking role joe exotic end le biopic expect,Pop Culture
everybody bit playing live hr set right like proper music check absolute legend trying brighten lockdown,Pop Culture
edward barber sings please stay,Pop Culture
caved pressure started tiger king literally feel brain cell dying episode watch,Pop Culture
broadcasting home dj cheys chained blue coming next alright queen mean raise hand truth,Pop Culture
okay could please help convince put spice world need,Pop Culture
finished watching day hand top fivetop ten best television show time,Pop Culture
camera work storytelling boneyard match legit perfect wrestling movie perfectly done white girl wood old horror movie,Pop Culture
yo star war peep go check man whip droids battlefront ii,Pop Culture
community member marie barnhart shared sweet star war lego collection shelf see share thing like inside group,Pop Culture
digital mirage online music festival presented,Pop Culture
heavy hook juice wrld app,Pop Culture
check added closet poshmark star war graphic v neck shirt xl,Pop Culture
dj khaled dj khaled rick ross future cardi b nicki minaj drake chris brown feat djkhaledchris brownliltjaycardi bpop smokerick rossjay zroddy ricchtravisscottmigoslil bab app,Pop Culture
gashi feat dj snake afro b chris brown safety ur future update tune tag,Pop Culture
ce moment radio post omarion ft chris brown jhene aiko,Pop Culture
cheat sheet break star war rise skywalker easter egg might missed,Pop Culture
enter win star war rise skywalker bluray heck bunch u,Pop Culture
check best chris brown dvd video compilation mix dvd,Pop Culture
ahh cant wait use annual pas galaxy edge open glad got ride rise resistance least era star war galaxy,Pop Culture
check added closet poshmark alice wonderland alien star war pin,Pop Culture
lullaby juice wrld type beat reidgocrazy,Pop Culture
last session conference like last harry potter movie really good cant help fall asleep day long marathon watching im ready temple announcement though,Pop Culture
best mixtape mixed flakesthemixtapemogul extended mix flakesthemixtapemogul feat afro b burna boy taylor swift katy perry halsey khalid maroon chris brown sam smith app,Pop Culture
best mixtape mixed flakesthemixtapemogul extended mix flakesthemixtapemogul feat blueface tyga chris brown drake post malone tory lanez wiley lil baby dababy city girl app,Pop Culture
dont usually feel angry think today angriest ive ever felt know billboard unfair so yet fair artist like harry style similar situation happen sabotage,Pop Culture
finally got chance watch present country place artist performed home absolutely amazing performance great way share music hope continues fashion future,Pop Culture
sober reflection dedicated lord jesus christ noble,Pop Culture
laying bed nothing year several month ago saw talking series watched enjoyed waiting month living responsibility keep dead entertained,Pop Culture
long time scream writercoproducer chris la vigna internet radio show terminal transmission listen first episode hear full cut dead air theme song dangerhole,Pop Culture
friend put onto year horizon first ever made world buckminster fuller absolutely fascinating man study documentary programme made,Pop Culture
started basically show worst part kenya barris show acting jesus christ year producing tv film think woulda sense cast better actor play,Pop Culture
celine dion andrea bocelli lady gaga lang lang john legend perform mooi,Pop Culture
love sam smith john legend rendition stand,Pop Culture
piano instrumental karaoke coffee watch full video yt channel link bio,Pop Culture
didnt rolling stone ask drumming charlie watt didnt drum kit,Pop Culture
pop drop back music listen full song let u know know song pop z drop listen tweet u pop drop,Pop Culture
miss squawk box click full length interview,Pop Culture
dj khaled higher ft nipsey hussle john legend,Pop Culture
red hot patti smith set participate earth day livestream concert see full lineup,Pop Culture
listening full slane castle gig last year bbq n beer gig memory,Pop Culture
ranking family feud host,Pop Culture
tune live legend family fitness show help support family child need drive research nonsmoking lung cancer donate,Pop Culture
super bummed didnt get play kid marathon starting line morning thanks lot guess well plan seeing awesome family runner rescheduled date october,Pop Culture
sly family stone like baby,Pop Culture
craaaaaaaaaaaaaaaaaaaaaaaaaaaaaaaaaaaaaaaaaaaap gonna self destruct ending make sense devil talking asta uestion telling,Pop Culture
nsg ourself music video grm daily,Pop Culture
day world music video positive mental health covid corey rocked folk rocked watch video,Pop Culture
came across youtube since stuck please tell sung version,Pop Culture
end promotion lim jaebeom bambam still didnt get ending fairy deserve always top two viewed solo cam among others dont deserve im saying,Pop Culture
music video brother bornpaidzeezy shot,Pop Culture
pagibig fortune cookie mnl music video,Pop Culture
ive got lot problem people strike airing happy festivus rest power jerry stiller,Pop Culture
could look juan roig foundernof mercadona chain spain paying staff working day week since tha start lockdown staff extra week pay giving nearly help b aid supplier,Pop Culture
little acorn episode going right back beginning,Pop Culture
come want season season please work little give season please still waiting season,Pop Culture
phil guy try tell play whole dayand ruin fun like,Pop Culture
today anniversary debut river song internet told anyone popup rewatch silence library forest dead say britain give everyone hour prep spread word,Pop Culture
lily please vote lisa vote others,Pop Culture
craziest thing body said want kick trump even polite although cant threaten office president former secretary state colin powell endorses joe biden president,Pop Culture
season renamed reason american horror story,Pop Culture
happy pride month embrace grooming,Pop Culture
check featuring happy pride month,Pop Culture
know bit late party finished watching netflix let say would die ending cry happy tear thanks p happy pride month,Pop Culture
happy pride month,Pop Culture
encouraging k friend show love support taetae rest bts member also let stay protect cost ever happens happy th anniversary,Pop Culture
favorite tag love ah happy th anniversary,Pop Culture
yes music life blessed bestest music idol life,Pop Culture
joe seijun suzuki raise bar yakuza cinema sophisticated savagery beautified brutality youth beast j shishido baddest gangster hit steaming player part,Pop Culture
wowwee knocked virtual woman excellence award park congratulation nominee winner thank always bestest emcee,Pop Culture
love song much emotional im reminded many memory izone love,Pop Culture
love icon wont make sense ok king win award win soty bestest boy,Pop Culture
album including limited version worth love youuuu,Pop Culture
octavia never giving disciple anything unless hope safe must disciple know everything clarkes people cool see young murphy brief moment,Pop Culture
llegamos millones happy guy thank much album best give win,Pop Culture
love youuuu,Pop Culture
jesse lee peterson show gioyc friday mr president know juneteenth mean part,Pop Culture
love game never left live set think everything love band love guy,Pop Culture
mingi bestest boy ever love mingi,Pop Culture
dear saw interview uncle dead one best men ever known died alone tongue cheek joke funny would lucky half man learn respect,Pop Culture
watch made music video,Pop Culture
charting global youtube music video chart week million view,Pop Culture
gangnam style charting global youtube music video chart week million view,Pop Culture
fanfare debuted global youtube music video chart week million view,Pop Culture
bro music video dope af haha,Pop Culture
left right debuted global youtube music video chart week million view,Pop Culture
jackson wang way official music video,Pop Culture
understand people totally streaming party rapper fandom nowadays rapper many song different genre rock rnb pop dancehall house edm reggaeton many blend got song,Pop Culture
understand people want cast good actor film ki script toh waise bhi kharaab hoti hai aur upar se achhe actor ko cast karke unki acting skill ko kyon kharaab karna,Pop Culture
artist number music video like youtube mv jb bp,Pop Culture
jenna marble quits youtube fan call shane dawson jeffree star,Pop Culture
guy know still ongoing im seeing much tl still nd week mass streaming voting please dont lose motivation ahgases really working hard please work hard,Pop Culture
paramore misery business official music video,Pop Culture
u call music video latest album prod video,Pop Culture
happens vega stay vega music video dropping tomorrow noon video shotdirected,Pop Culture
check talented singer hit song music video outstanding type vibe,Pop Culture
podcast episode antic shane dawson jeffrey star jenna marble nothing yet prosper,Pop Culture
east coast tune pm allnew episode talk fabulous talk show opera skill plus chef show u prep delicious steak time th,Pop Culture
ready watch bila cupid jatuh cinta starting th july everyday saturday pm tv,Pop Culture
fox news host tucker carlson said hysteria black life matter movement like pandemic,Pop Culture
fox news host tucker carlson said hysteria black life matter movement like pandemic fox news personality likened hysteria movement pandemic claimed minneapolis wuhan,Pop Culture
p dwaynechavez dj payback gonna kick th july mix weekend like old time,Pop Culture
spotify surpassed stream platform th song full album congratulation girl,Pop Culture
directed music video kiss floor album maze enjoy,Pop Culture
sorry say need care scared love cause weaker wrong wrong make strong,Pop Culture
f move listen wake morning mf urban talk news laugh,Pop Culture
correct ga year back idhe time ki morning show samantha entry,Pop Culture
furniture listen wake morning mf urban talk news laugh,Pop Culture
im tired perpetuating lie trump cry daily protest led never flag veteran guided kneeling came served illinformed word salad like wannabe george wallace,Pop Culture
dont normally watch sunday morning news show today introduced shes killing quality consistency peter jennings prime time worthy,Pop Culture
icymi live music longer allowed folly beach bar restaurant past pm city council held special emergency meeting thursday morning,Pop Culture
california investigator extend naya rivera search outside lake sign petition,Pop Culture
blind prod sean prominent download app submit music today,Pop Culture
white tee summer walker nonoah,Pop Culture
get em prod mr brady download app submit music today,Pop Culture
bad energy juice wrld,Pop Culture
cent share screenshot heated dm exchange smith jada pinkett smithaugust alsina affair armenian reporter,Pop Culture
beautiful sound uncharted worldz razaa music dream wishing well platform music,Pop Culture
probe act official shiraz listen,Pop Culture
