cleaned_text,topic
currently favorite thing internet right proud,Pop Culture
august ft rick ross song defining entanglement cap jam,Pop Culture
jisoo came viral makeup ro mentioned countdown live came colorful eyeshadow one teaser poster tell maeng blackpink,Pop Culture
studeo loved start submitcom music,Pop Culture
tryna break internet sheesh,Pop Culture
august alsina release entanglement song feat rick ross,Pop Culture
ohhh august alsina really turned whole mess jada smith around hot track featuring rick ross told man gotta listen track man promise regret,Pop Culture
closed sunday di kanye west,Pop Culture
boyertown native fellow grad came talk show started gallon lava season beyond may look like full interview story,Pop Culture
quick mix lady album available major music platform also go check iamnialong movie fatal affair look amazing,Pop Culture
probe act official shiraz listen,Pop Culture
happy national ice cream day blink square soba blackpink,Pop Culture
imposibleng national ice cream day lang kaya nagppost sila ge self blackpink,Pop Culture
win feat snoop dogg tpain ludacris rick ross dj khaled,Pop Culture
power piano display enjoy high flavour x offering stream tracklist,Pop Culture
superstar mahesh name enough destroy box office record,Pop Culture
show power superstar,Pop Culture
tweet one n half day power,Pop Culture
year experience become mature subject pick better understanding work box officemahesh,Pop Culture
way one voice vlive power clean timeline save day wait anticipation selca,Pop Culture
extremely delighted release thala sir th year anniversary common dp sure fan online celebrate cdp,Pop Culture
music power transcend age race cultural differencesits product grew toronto multicultural city director sergio navarretta event,Pop Culture
kayak concert social distancingcupsaw lake style thanks drew great show cupsaw lake,Pop Culture
koi jab tumhara hriday tod de though meant one beloved easily fit special love lyric,Pop Culture
morning guy seen original cover fan made want make dream come true make happen plz,Pop Culture
johnny cash walk line big coyntry musa pekka like yes thanks go play,Pop Culture
gary valenciano love always cprm,Pop Culture
die heskay feat tiwalade app,Pop Culture
entire cast coming back like together get keep seeing victor portray feel story show cast mean everything love guy love,Pop Culture
seea beautiful vocal queen luvit always love,Pop Culture
jooheon want happy jooheon love,Pop Culture
proud joo love much bb,Pop Culture
remember namjoon said love love bts,Pop Culture
ambition dalek love,Pop Culture
congratulation enjoy first stage today cheering afar love treasure,Pop Culture
arnabjiyou real hero nation citizen go ahead without fear love youso much salute heartlyusername,Pop Culture
love last week position week chart,Pop Culture
grew hearing story hero like chandrakanth pendurkar sundeep surve tukaram omble etc pls let ur reputation stoop high profile loyal political master people,Pop Culture
love time superstar need k retweets love,Pop Culture
couldnt happier today love wonoooo oppaaaa,Pop Culture
real life rapsz vega residency rick ross,Pop Culture
please stop reached far arnab sir hero love thank want justice ssr,Pop Culture
kirstie alley exact opposite chrissy teigen god bless kirstie alley love,Pop Culture
really wish ppl would stop editing koo cute little cheek scar photo clean adorable respected bts,Pop Culture
streaming type programmed streaming programmed stream apps let pick song app pick song example deezer flow free pandora free livexlive stream apps count hot,Pop Culture
christian conversion mafia working feeely rule changing demography india village expected beforewhy bjp anything,Pop Culture
listening party gitz album led boy sb tweeted countless time better done within first week think also help hopefully bring back hype,Pop Culture
expected b typical movie whr start wid bang bt tht different good shown range f emotion cast crew god sake miss,Pop Culture
bay area fire weather watch due heat wave dry lightning,Pop Culture
channel download app submit music today,Pop Culture
find way back back past tense hit hard,Pop Culture
find way back back silence lyric guy put breath taking,Pop Culture
really like castmates show love everybody included thats dope show,Pop Culture
sometimes youngjae like enter kkt talk ahgases even suggest jaebeom could really every time see yj talking ahgases feel love good,Pop Culture
shining city little funk soul light like dynamite woahohoh,Pop Culture
w love club,Pop Culture
shining city little funk soul light like dynamite woahohoh bts,Pop Culture
iarmys slacking please let energy jarmys karmys carmys u army keep streaming dynamite spotify apple music,Pop Culture
mistake need apple music,Pop Culture
richie spice brown skin listen wake morning mf urban talk news laugh,Pop Culture
bts performing spring day iheart spread message morning come darkness season eternal line giving u hope one day everything alright chose comfort u,Pop Culture
prince would die u listen wake morning mf urban talk news laugh,Pop Culture
leaving morning chicken diamond,Pop Culture
power book episode review thought,Pop Culture
cannot simultaneously prepare prevent death einstein sorry war great range always impressivebe st season th love character show multidimensional,Pop Culture
hype crazy act really going turning point taemin whole career dont think u ready,Pop Culture
full entertainment watched st four episode wow man,Pop Culture
coming week revised line reissue st episode slb archive discussion brother talk end week rate review u please,Pop Culture
know lot site gave mixed review movie lived hypei especially happy role dummy u balance nani act well,Pop Culture
watch series premiere power book ii ghost tonight c philo,Pop Culture
knocking series early watching season finale oh man last night pynk,Pop Culture
congratulation winning st annual award favorite actress,Pop Culture
video coming later,Pop Culture
never remix download app submit music today,Pop Culture
activist spent g black life matter donation house personal expense fbi,Pop Culture
jungle open rolled rider stole food bear brought back lion hold court ape gorilla lighter got eye tiger heart fighter tha mobb,Pop Culture
cause ah ah star tonight watch bring fire set night alight,Pop Culture
watch bring fire set night alight vote category,Pop Culture
cause ahahi star tonight watch bring fire set night alight shoe get morn cup milk let rock roll sambung lirik lanjutkan guy vote category,Pop Culture
co iii star tonight watch bring fire set night alight vote category,Pop Culture
bribg fire vote category,Pop Culture
watch bring fire set night light vote category,Pop Culture
watch bring fire set night alight vote category,Pop Culture
fortune teller told power mind,Pop Culture
problem give prime airtime he pointless highly divisive giving prime airtime,Pop Culture
sunday vibe wait get back play live stay safe snd check streaming service,Pop Culture
w podcast president trump first lady melania join u wishing speedy recovery,Pop Culture
wonder ever meet shawn mendes,Pop Culture
everything need know dwts updated pm,Pop Culture
able watch performance yesterday saw lot tweet like choreo tho honestly love choreography full sassiness pretty savage indeed,Pop Culture
wow post concert depression real post bts concert depression whole level thank,Pop Culture
wow heart si full thank working hard make u happy time constant undying love borahae,Pop Culture
may bts concert ever attend uplifting honestkind humble much gratitude heart rmjinsugajhopejiminv jungkook truly angel earth need right,Pop Culture
best concert ever ive never seen bts concert person made feel like part army ocean performance incredible never forget,Pop Culture
live playing walking dead season episode first playthrough,Pop Culture
army please vote,Pop Culture
dj hoodrich thewu future king behind scene,Pop Culture
october horror need suggestion greatest according,Pop Culture
carat vote mubeat app use multiple account please maximize use moveeeeee,Pop Culture
stay safe mama fan choice award,Pop Culture
stay safe everyone god bless u,Pop Culture
stay safe filo blink followed vote,Pop Culture
stay safe everyone followed vote,Pop Culture
stay safe filo moot followed vote,Pop Culture
stay safe everyone wag patangay hehe followed vote,Pop Culture
stay safe everyone followed vote,Pop Culture
vote vote vote filo moot pls stay safe vote worldwide fan choice mnet asian music award,Pop Culture
next join u,Pop Culture
next channel let go,Pop Culture
next catch eat drink smoke like food bourbon cigar like tune,Pop Culture
please stop streaming view rising konces great job hope better stay safe everyone fighting,Pop Culture
fake news republican party,Pop Culture
trump supporter rioting outside election office across america,Pop Culture
please listen u vall zoom,Pop Culture
please please listen u,Pop Culture
united state trend follow insight bottom kate mckinnon trevor michael che lemon haney brian kelly inkigayo view google search trend insight,Pop Culture
im big fan reporting arent following twitter coverage hurricane puerto rico fantastic good see added team,Pop Culture
someone said enhypen running walking seriously power hold urghh,Pop Culture
bar close pm ny rocking parking lot party,Pop Culture
outro cross line sound fancy album preview,Pop Culture
yesterday show threw dominik name potential winner battle royal joke currently final four,Pop Culture
music video everywhere go run guy,Pop Culture
watch brand music video short directed produce cc meneja,Pop Culture
umusic video wami wokqala lo bafethu please watch subscribe comment share link music video friend mbzet official music video feat link thank,Pop Culture
official music video brand single featuring watch,Pop Culture
david prowse veteran bodybuilder actor original physical performer darth vader original trilogy,Pop Culture
sad news actor david prowse played darth vader original star war trilogy dead,Pop Culture
christmas music bed,Pop Culture
congratulation st win best dance performance male group,Pop Culture
finished watching gonna say anything story felt complex st watch loved sound design read mixed atmos dolby immersive experience term sound designmixing,Pop Culture
please include season attack titan including final season nexflix india fan really hoping watch netflix last day attack titan craze india gone crazy,Pop Culture
watching attack titan crunchyroll,Pop Culture
want listen kid cudi jack harlow put spotify even though ive listed many time still number one queue,Pop Culture
purple disco machine sophie giant hypnotized,Pop Culture
purple disco machine sophie giant hypnotized,Pop Culture
purple disco machine sophie giant hypnotized,Pop Culture
christmas came early releasing another amazing song crew wait see tour cheer,Pop Culture
check star cinema offering year princess dayareese starring maymay entrata edward barber mayward kapamilya ever mayward kapamilya ever mayward kapamilya ever,Pop Culture
ep star war last jedi movie review spoiler,Pop Culture
sloweddown time holiday season perfect time dark sky gazing latest,Pop Culture
jesus light lfcc classic he road darkness brightest way,Pop Culture
last start terrifying battle end far creepy encounter distrust intimidation comradeship causing havok humour equal measure week resolution seems apropos year,Pop Culture
earning gift card selling stuff join using code blqbtn extra pt listed topps star war mandalorian season pursuit escape,Pop Culture
earning gift card selling stuff join using code blqbtn extra pt listed topps star war mandalorian season looking work,Pop Culture
earning gift card selling stuff join using code blqbtn extra pt listed topps star war mandalorian season atst awoken,Pop Culture
horror short film side box alter watched night gave nightmare,Pop Culture
woman love superhero movie found installment patronizing trying walk line love story girl action boy ended badly,Pop Culture
couldnt count many time moo see false accusation towards girlsants trying bring u strong enough deal apologize mamamoo,Pop Culture
like smile like kindness like eye l like lip like handsome like way think love every little thing really love gulf morning,Pop Culture
year eve special suck terrible looked wasted breath fresh air finest,Pop Culture
think cute someone tell straight like yamyam gucong,Pop Culture
got good time bad one cd signed jonah marais support,Pop Culture
story behind music version theme song,Pop Culture
kudos music crew,Pop Culture
driver license repeat,Pop Culture
music video acted coming tomorrow,Pop Culture
prince sign time official music video,Pop Culture
asks u u tell u told u tired castle air got dream want world share castle wall lead despair remember talking album everyone thing talking,Pop Culture
perfection myth chasing like chasing wind maymay megandangnatueral maymay megandangnatueral,Pop Culture
final hour president trump grant pardon commute sentence people including lil wayne kodak black,Pop Culture
lil wayne vizine ur future update tune tag,Pop Culture
di pa rin masyado nag ssink sakin na james release song soooo excited congratulation daysto soda release,Pop Culture
chikki also evictd came back jasmin bhasin,Pop Culture
bb king freestyle lil wayne drake,Pop Culture
want know reason behind selin audacity self confidence know engin aydan tell truth stop seems big plan watch see cumartesi fox,Pop Culture
please take time vote got mubeat mv year category lost spot fell second place,Pop Culture
seokhwa said really like oneus sunbaenim song baby song really good,Pop Culture
omg voice always love deep soothing voice yasssssssssssssssssssss,Pop Culture
currently number eighteen limang libong tc light mv link bgyo light asap,Pop Culture
teumes still trend red carpet alreadt want start treasure sma,Pop Culture
wow within min trending spot india power twitter king kingdom keep roaring fam,Pop Culture
np sunshine light,Pop Culture
get enough chill singersongwriter playlist cover power,Pop Culture
music composer took last night tweeted febth needless say simple tweet led flood speculation song anna valentine day stay tuned,Pop Culture
watch velvet undergroundwho love sun,Pop Culture
thought tomorrow give strength go today,Pop Culture
someone tell didnt miss ateez perform yet,Pop Culture
splendid movie legend owns film every single scene every character n nuance accounted u wonder anything even going happen movie shock solid,Pop Culture
tru rider fronteng duceydaphatom listen live,Pop Culture
request please play music video arashi turning friday livestream love rainbow daylight summer kite whenever call arashi,Pop Culture
request oooo please play music video arashi turning friday livestream oooo story summer kite whenever call arashi ok copy paste ok,Pop Culture
request oooo please play music video arashi turning friday livestream oooo future still summer kite whenever call arashi,Pop Culture
request arashi party starter whenever call dive future summer music never end,Pop Culture
soulja k go crazy official music video,Pop Culture
winning aside least need put strong fight ikon give let keep going together keep streaming ytkorean site vote mwavewhosfan vote idol champ stream ikonics,Pop Culture
loved gorgeous action packed hilarious touching masterpiece represents part movie mean lot u amazing voice cast especially,Pop Culture
lemon pepper freestyle debut uk spotify chart stream drake th rick ross th entry chart rick ross highest peaking song uk spotify chart surpassing like,Pop Culture
apple music uk whats next day lemon pepper freestyle ft want need ft peak,Pop Culture
danakil meet odg blow wind ur future update tune tag,Pop Culture
latest movie theater daily thanks,Pop Culture
long hair seokjin making come back omg ahhhhhhhhh,Pop Culture
still like like wind walked eight thousand mile ask return date,Pop Culture
learn movie dolphin island enter digital copy end u,Pop Culture
cheapest price online check cyclops xmen movie james marsden action figure toy biz w jean grey,Pop Culture
super straight kill,Pop Culture
pleasure introducing america six year later chance catch live fall cbs morning,Pop Culture
better vocal cannot delivered might queen onceinageneration talent far cover go near top without mariah carey,Pop Culture
anybody else watching laura kuenssberg show morning guest comrade andrew marr,Pop Culture
click wonder woman bluray,Pop Culture
honing voice refining detail making writing shine check,Pop Culture
great main event great show thank thank clapp clapp clapp rip,Pop Culture
ground full cam sb inkigayo,Pop Culture
jimin nice keep going,Pop Culture
minieeeeeeee lively lovely today stay safe jin hyung,Pop Culture
shout devil,Pop Culture
spotify ww baila conmigo meses dancing devil dia,Pop Culture
thanks company twitterati stay safe everyone see next week mclean close second,Pop Culture
reason view slowing sometimes atinys streaming follow streaming rule wrong way yt deleting view streaming properly,Pop Culture
advantage multitalented bts rm always amaze rm rapper many advantage various field reason liked many people indonesian,Pop Culture
ohmygod taemin sweat shirt wow really worked hard,Pop Culture
ok draw next twitter allows option poll please comment youd like choose boom boom,Pop Culture
easter sunday celebration watch easter service link powerful message rev abisimo okanlawon,Pop Culture
pure poetic utmost passionate never dying tangible forever young selfish desire stopped id never thought wed come,Pop Culture
deobis close u free pls stream stealer full version yt also naver b got,Pop Culture
update light official music video view like k subscriber k comment k keep streaming guy,Pop Culture
really love song would really cool play today pleasedddefdcdffc,Pop Culture
u know u really love taylor swift u bought album itunes r playing r automatically inlove yes right love u much taylor,Pop Culture
check awesome spotify playlist music inspiration weekend massive thank including single feat,Pop Culture
oooo waitwait put tap dancing sound kid,Pop Culture
rewatching love monroe rosalee together still figure never serious love interest,Pop Culture
congratulation entire team three lady nailed movie superb performance word power packed bgm extraordinary,Pop Culture
adarsh performance brilliant wait see next project best congratulation entire team,Pop Culture
ready night two tonight everywhere else awesome night one,Pop Culture
night ready tonight big night absolute faves walking champ nia defend title nattie tamina raw woman title opportunity auska getting moment,Pop Culture
hay put little darling head line chris cuomo say wont police reform white people kid start getting killed,Pop Culture
sublime political film conservative pov check u youtube dont let left control medium follow,Pop Culture
special place hell reid henry check amazing release go give support deserves,Pop Culture
sick fake love fake love fake love sorry fake love fake love fake love fake love voting bts category,Pop Culture
jihoon blue hair jihoon forehead jihoon spec jihoon turtle neck talented mc jihoon,Pop Culture
park jihoon blue hair,Pop Culture
excited coming next grateful hanbin,Pop Culture
unto uswho like lord reprise israel houghton breed,Pop Culture
wearing purple sparkly cape set performing gold sequined tux tail event handle amount fabulous,Pop Culture
hope make live forum mentioned music video turning request arashi turning next fl fun,Pop Culture
jackson wang galantis pretty please official music video,Pop Culture
george benson give night official music video radio cause music air lot loving everywhere give night,Pop Culture
chris stapleton starting official music video,Pop Culture
throwback music video song dream august april album project produced directed,Pop Culture
reminder please post song please spoil comeback last go hiatus let sabotage,Pop Culture
giveon heartbreak anniversary official music video,Pop Culture
spice sean paul shaggy go deh official music video,Pop Culture
ht square copy total ktl copy total hylt copy total album copy total vote,Pop Culture
falling red storm inside,Pop Culture
nominate prettiest boy alive good heart,Pop Culture
dear love album pack photobooks photocards extra would cool full length lpvinyl record next album plus goody go album thought,Pop Culture
propain song day divided stand album absolute power,Pop Culture
wtblfs unsealed album square black ver kill love pink ver album ver drop offer dm meee hehe,Pop Culture
basta voting coz long ago four nation lived together harmony everything changed fire nation attacked avatar master four element could stop world needed vanished,Pop Culture
yeah beat chaching like money disco overload good go diamond know glow let go cause iii star tonight watch bring fire set vote,Pop Culture
closer year later person must,Pop Culture
done th th episode never thought kollywood make thriller crime web series nailed chosen wonderful story,Pop Culture
drop vote drop building nominate treasure,Pop Culture
check listing added closet adidas original star war cpo sneaker size,Pop Culture
never give moa victory right behind corner nominate tomorrow x together,Pop Culture
choose ground nominate twice,Pop Culture
dj cheyanne blue n chained blue coming wanna lay corner strut sexy guitar well well well,Pop Culture
viewed mv korean act butter ground bts film morning,Pop Culture
man built every step success made entire world gaze started liking onscreen performance grownup admiring offscreen character complete package superstar,Pop Culture
finally done binge act awe struck way rani bharti played role perfection iota doubt bundle talent deserve space well kudos entire cast,Pop Culture
sana may mabuting loob na nagccompile ng mga ganapsss ng boy busy tita keep missed,Pop Culture
could wrong pretty sure reason full catholic wedding less pm uk think previous three divorce oul francie vatican bit funny,Pop Culture
kon whosfan yt view increasing keep almost hour left let give real answer,Pop Culture
yes id like see greatest batman ever att make ben afflecks solo batman film sign petition,Pop Culture
satan worship im devil supporting artist since hiq radio,Pop Culture
conjuring devil movie watch online,Pop Culture
watch full video facebook watch much love fascinating exhilarating divine performance passionate breathtakingly beautiful precious sacred treasure,Pop Culture
ha ha got tuned tv brilliant thank thank thank fantastic get stuffed real news channel shove antenna rear orifice,Pop Culture
young looking tv right courtesy,Pop Culture
glad see characterize brilliant satire site call funniest site internet become absolutely hysterical make belly laugh daily basis,Pop Culture
yugbam really soulmates besties time frame comeback appearing musuc showsi really love much yugbam inkigayo,Pop Culture
oh shewolf london one favorite film maybe live tweeting next weekend,Pop Culture
relaxing music video meditation music video calm music stress video please visit youtube channel subscribe,Pop Culture
lil herb aka arrival music coming,Pop Culture
every cix music video,Pop Culture
checkout kayode ft zlatan heavy duty official music video,Pop Culture
argument void official music video,Pop Culture
hii friend would love hear kill music daily ty,Pop Culture
lil wayne holy official audio radio dope hip hop heat,Pop Culture
like big sky wide groundi catastrophically love gulf night,Pop Culture
bright morning vote unmovable vote bright song unmovable vote kan goo best thai song vote unmovable sad movie,Pop Culture
congrats advance expectation base cast alone pretty sure hit,Pop Culture
permission dance coming min watch angel song,Pop Culture
wait want watch come large buttered popcorn large soda pretty sure theater charged buck,Pop Culture
permission dance really power make people happy instantly,Pop Culture
permission dance vote,Pop Culture
permission dance temazo mundial,Pop Culture
permission dance official mv surpassed view youtube,Pop Culture
permission dance vote,Pop Culture
permission dance vote,Pop Culture
permission dance yt trend let trend higher,Pop Culture
permission dance streaming,Pop Culture
permission dance mv surpassed view congratulation,Pop Culture
kiwww permission dance view keep streaming army let go,Pop Culture
global spotify update july th permission dance,Pop Culture
spotify global permission dance butter dynamite spotify u permission dance butter,Pop Culture
according youtube permission dance official mv recorded million view within hour release youtube mv premiere peak concurrent viewer,Pop Culture
kpop mv reach like youtube last kpop mv reach like bts permission dance,Pop Culture
cause need permission dance,Pop Culture
apple music br dirio top permission dance peak butter peak,Pop Culture
permission dance vote,Pop Culture
info permission dance kst genie bug flo melon vibe daily chart peak chartsk,Pop Culture
tweet rm need permission dance,Pop Culture
naya rivera arrested allegedly striking husband head bottom lip daily est en ligne merci,Pop Culture
wheres thread collab drop hour,Pop Culture
loved crazy writing well executed brilliantly supported cast two female lead boy yatra music kudos,Pop Culture
explicit lyric ransom x big ghost ltd heavy head album stream,Pop Culture
lucky time okay still love muchwill remember moment phiballs world share goal even though like competition really fun,Pop Culture
music capitol cut live studio,Pop Culture
hi im available pls avail vc video bundle content promo today telegram youre filipino reading comprehension like guy slum dont even try,Pop Culture
watch music video,Pop Culture
seriously bummed miss year least choice time little mama wouldnt made heat haha hear luke killed always question fall year,Pop Culture
chillyrob release music check hot banger,Pop Culture
available streaming feat great music enjoy,Pop Culture
girl bandana print short livestream set rolling loud,Pop Culture
ghost feat akira prod litlikenoah mxrkus song prod,Pop Culture
