cleaned_text,topic
never mind v next weekend back football matter,Sports
anyone know game next thursday fox thats arguably last game entire schedule id imagine fox,Sports
first manager christmas break clash,Sports
apparently tyson fury went night club post fight press conference basically stopped mgm grand battered deontay wilder way night,Sports
game day v div sponsored roebuck draycott clay lower abbot bromley school,Sports
im taking inspiration hero villain hero starting aussie friendly time pm villain master moved unaussie friendly time,Sports
happen bring boy home,Sports
surprised even year former cricketer india still dont get difference odis t acceptable odis acceptable t,Sports
v fury ii live link wilder v fury ii livefight v fury live free,Sports
sold ticket saturday looking sell rest cant wait renew season ticket thought wanted winstill love team make effort better thing money,Sports
big shout homie judging medium meal pressbox u bank stadium preseason game gonna eating good season home game beat writer visiting team youre treat,Sports
zhang v best womens ufc fight ever greatest fight ever unbelievable thought joanna run back,Sports
take lion pm cdt today kickoff sure get preview xfactors today game,Sports
chennai super king creating special jersey number respect achievement neeraj chopra gold medalwinning throw neeraj,Sports
show everyone best tournament give fan devotee coach club century best,Sports
field hockey take vermont outofconference matchup afternoon fell short last time uconn game,Sports
strongly believe time left paul george find rhythm back gone team cant afford pandemic p take shot find rhythm series coach must adjust minute attempt along rotation,Sports
making change schedule due game postponed play home pm instead facing game portland moved second half season,Sports
wowvito goal rusnak time surely lost footing bad luck v,Sports
chelsea fc leicester city youri tielemans wonder goal win fa cup final,Sports
cardinal take field cross town rivalry game v leuzinger olympian gonna great night thedalefootball,Sports
demon soul could closer expected recent rating indication jordan devore,Sports
check smurfs race smurf village game,Sports
man repeat man slow steady win fight dont guy dont let someone push stair take,Sports
enjoy stream tonight loved support believe dropped following happy appreciate massively best fifa played stream thanks shown support,Sports
played exenergy nuke shakey got thing fix wp definitely second best team sa atm proud boy tonight,Sports
boy take win tonight proud guy ggs carnage,Sports
best game decade opinion,Sports
game area grandview height man follow follow arcadia final game sure,Sports
happy year starting decade switching sevtech,Sports
streaming game come stop join,Sports
three game preview week v v v good stuff,Sports
thought saying everyone else trash man split isnt looking good,Sports
streaming overwatch w later osu animal crossing hope see ya,Sports
hamilton panished black life matter,Sports
wish attending biggest gaming convention world joining epic giveaway chance win garrison gaming table,Sports
expected come back didnt think would due magnus miscalculating endgame transition like exciting finish set,Sports
check live playstation call duty modern warfare live,Sports
game ai show live come listen deconstruct,Sports
brilliant commentary push f pawn toward queening square win game losing match frodo charging toward mount doom,Sports
underwater game still mightily unfair unlike ground game train crossing signal giving warning wet game really luck get anywhere,Sports
th play much hidden detail dialogue without doubt best work arthur morgan greatest relatable protagonist gaming history,Sports
never stop loving thing game told bill room growth im gonna looking forward seeing,Sports
game day three team action week sts v h pm kick reserve v reserve pm kick rds v rds pm kick best luck three team,Sports
dont think expecting physical game today,Sports
along many member answering question related game asked want know anything pokkn highly recommend shooting question,Sports
live come stream show love twitch,Sports
super game win thriller,Sports
month old last time dodger world series please wrap tonight boy,Sports
check american trivia family edition board game,Sports
get people thought cheated cu must content creator practiced like basketball game team say cheated practiced weekend fair good sport last,Sports
upon advice shall wait day give thought since know close friend playing watched xqc stream know thought,Sports
lanthorne fc chandler well confident display boy biggest win date solid back clinical going forward record intact top league go x x x,Sports
take look full shootout scoreless win houghton start play goal wheeler gagnon singer three osborne save,Sports
come check play mass effect andromeda hardest difficulty,Sports
featured streamer spoc streaming star war old republic come say hi support,Sports
dundalk away later today could take huge step towards winning league point oriel cmon,Sports
look sugar bird dropped easter egg allright easter special nft original,Sports
omg finally got episode cleared death call progress hope enjoy game looking forward episode,Sports
saw esbc video released corner man mini game round la fight night kinda bummed everyone get beat drop still,Sports
favorite game decade order completely random long list want leave anything rimworld minecraft assassin creed odyssey anno,Sports
seems unstoppable moment easy game hand going good three way fight top,Sports
anyone else notice xbox one controller used review booth xfl game x stand xbox,Sports
want everyone chance win word yet play match match noobs pro match match get killed player crouch spamming jumping wall thing need use claw elite controller,Sports
think guy great job game love graphic love story linecampaign multiplayer amazing game year thought,Sports
