cleaned_text,topic
lily please vote lisa vote others,Pop Culture
still like like wind walked eight thousand mile ask return date,Pop Culture
top cumulative box office cr nett movie tasted success box office winning streak past year,Pop Culture
shining city little funk soul light like dynamite woahohoh,Pop Culture
watching eating noodle perfect sunday,Pop Culture
congratulation red velvet queendom th win thank working hard always best luvies great today well congratulation u,Pop Culture
never understand want u feel ashamed bra strap show,Pop Culture
best rapper trillavelli performed vlone runtz fan went rolling loud nyc weekend lit,Pop Culture
get kod second round making see trilogy,Pop Culture
army please vote,Pop Culture
please please listen u,Pop Culture
lil herb aka arrival music coming,Pop Culture
anyone want example someone bigger sport quote dhoni retired injured rested nobody dare utter word dropped,Pop Culture
show power superstar,Pop Culture
jooheon want happy jooheon love,Pop Culture
encouraging k friend show love support taetae rest bts member also let stay protect cost ever happens happy th anniversary,Pop Culture
strong jennifer lopez dismisses silliness super bowl halftime show criticism,Pop Culture
permission dance yt trend let trend higher,Pop Culture
wow post concert depression real post bts concert depression whole level thank,Pop Culture
fell asleep wake find defeated cowboy doubt,Pop Culture
like fr blackpink comeback upcoming august hope true also lisa release song july,Pop Culture
gary valenciano love always cprm,Pop Culture
never give moa victory right behind corner nominate tomorrow x together,Pop Culture
united state trend follow insight bottom kate mckinnon trevor michael che lemon haney brian kelly inkigayo view google search trend insight,Pop Culture
morning two hour news pick premier league breakfast fair say plenty talk today,Pop Culture
gashi feat dj snake afro b chris brown safety ur future update tune tag,Pop Culture
u know u really love taylor swift u bought album itunes r playing r automatically inlove yes right love u much taylor,Pop Culture
minute watching fight live get hype,Pop Culture
choose ground nominate twice,Pop Culture
sick fake love fake love fake love sorry fake love fake love fake love fake love voting bts category,Pop Culture
harry style watermelon sugar reaction,Pop Culture
stay safe everyone followed vote,Pop Culture
guess listening watermelon sugar light today nonstop hint,Pop Culture
bar close pm ny rocking parking lot party,Pop Culture
health come first please take care worry anything army patiently wait return love much,Pop Culture
greeting please hear dope song world right aka bts feat,Pop Culture
sad saw playing young true inspiration famous poem dear basketball,Pop Culture
saw white lady musical kinsale last night one thing absolutely blew mind winner dancing star dance whole show,Pop Culture
hat team field tracking keeping u updated praying safety,Pop Culture
mass commercial entertainer like ghilli pokkiri football angle added strong msg abt woman empowerment cr budget say watch football dribbling skill emotional scene,Pop Culture
daredevil got hand turtle foot get guy go ninja go ninja go maestrochoung young,Pop Culture
really love energy tl rn let keep going streaming fun everybody pitch keep hyping watch stage genius wooyoung,Pop Culture
man built every step success made entire world gaze started liking onscreen performance grownup admiring offscreen character complete package superstar,Pop Culture
legend fall making,Pop Culture
night ready tonight big night absolute faves walking champ nia defend title nattie tamina raw woman title opportunity auska getting moment,Pop Culture
cute innocent boy heart kiddish sometimes goofy sometimes lovable kind polite time,Pop Culture
laying bed nothing year several month ago saw talking series watched enjoyed waiting month living responsibility keep dead entertained,Pop Culture
every time ot come together feel heavy absence home every time see mbb long lie come back stay strong monbebes,Pop Culture
red rock show tonight also th anniversary becoming state thus centennial state home greatest performing art venue world,Pop Culture
stay safe filo blink followed vote,Pop Culture
felt nice see live sport familiar face friend colleague tv today appreciate took pull thank,Pop Culture
vote vote vote filo moot pls stay safe vote worldwide fan choice mnet asian music award,Pop Culture
click wonder woman bluray,Pop Culture
jihoon blue hair jihoon forehead jihoon spec jihoon turtle neck talented mc jihoon,Pop Culture
virender sehwags triple century south africa watched live venue still ticket game would love get signed man one day,Pop Culture
calling butcher first round draft pick smoothest piece hitting ever high pressure situation showtime,Pop Culture
could look juan roig foundernof mercadona chain spain paying staff working day week since tha start lockdown staff extra week pay giving nearly help b aid supplier,Pop Culture
give good reason year,Pop Culture
grew hearing story hero like chandrakanth pendurkar sundeep surve tukaram omble etc pls let ur reputation stoop high profile loyal political master people,Pop Culture
aj aj aj walkoff ko buzzer,Pop Culture
lucky surrounded strong empowered woman shoutout sister happy international womens day amazing woman deserve celebrated,Pop Culture
get enough chill singersongwriter playlist cover power,Pop Culture
elliot fix world us computer,Pop Culture
life morning face school time change b full moon c verge friday th anthem week,Pop Culture
christian conversion mafia working feeely rule changing demography india village expected beforewhy bjp anything,Pop Culture
thankful,Pop Culture
still want original come back,Pop Culture
fake news republican party,Pop Culture
keep going suppor whoever keep going wish,Pop Culture
rest peace juice wrld literally artist actually liked music helped calm tough time actually made feel good dont care one see tweet legend die making rip,Pop Culture
coming next hope feat please play song thank,Pop Culture
paramore misery business official music video,Pop Culture
probe act official shiraz listen,Pop Culture
dj khaled higher ft nipsey hussle john legend,Pop Culture
may bts concert ever attend uplifting honestkind humble much gratitude heart rmjinsugajhopejiminv jungkook truly angel earth need right,Pop Culture
next catch eat drink smoke like food bourbon cigar like tune,Pop Culture
everything need know dwts updated pm,Pop Culture
dear hope youre well hope youve smiling lot today hope youre wonderful day deserve best love much wait album tour would mind following itd mean world x,Pop Culture
yugbam really soulmates besties time frame comeback appearing musuc showsi really love much yugbam inkigayo,Pop Culture
lullaby juice wrld type beat reidgocrazy,Pop Culture
sloweddown time holiday season perfect time dark sky gazing latest,Pop Culture
watermelon sugar sound even better live good,Pop Culture
congratulation winning st annual award favorite actress,Pop Culture
great main event great show thank thank clapp clapp clapp rip,Pop Culture
request please play music video arashi turning friday livestream love rainbow daylight summer kite whenever call arashi,Pop Culture
hope good day please rest well,Pop Culture
didnt rolling stone ask drumming charlie watt didnt drum kit,Pop Culture
phil guy try tell play whole dayand ruin fun like,Pop Culture
sana may mabuting loob na nagccompile ng mga ganapsss ng boy busy tita keep missed,Pop Culture
congratulation doris burke make history call conference final espn radio st woman serve game analyst network tv radio broadcast deep postseason,Pop Culture
wowwee knocked virtual woman excellence award park congratulation nominee winner thank always bestest emcee,Pop Culture
album empty soundsbernie leroux dark side city,Pop Culture
perfection myth chasing like chasing wind maymay megandangnatueral maymay megandangnatueral,Pop Culture
pop drop back music listen full song let u know know song pop z drop listen tweet u pop drop,Pop Culture
wonder ever meet shawn mendes,Pop Culture
nominate prettiest boy alive good heart,Pop Culture
georgette heyer problem brother sister,Pop Culture
love hong kong protestors correct week ok leading world really powerful woman speaking truth yes woman space correcting trump real time,Pop Culture
tv review daily story,Pop Culture
yall leave alone theme song done change song back joe version,Pop Culture
hay put little darling head line chris cuomo say wont police reform white people kid start getting killed,Pop Culture
better vocal cannot delivered might queen onceinageneration talent far cover go near top without mariah carey,Pop Culture
jon vilma apart st player created thuggish culture greg williams,Pop Culture
woke turned tv watched make red clearance free ball red st frame wow im still proud ball break last time played snooker,Pop Culture
oh shewolf london one favorite film maybe live tweeting next weekend,Pop Culture
death hit hard reminder people fighting silent battle may know always kind assume love fully live life fullest,Pop Culture
sitting restaurant ohio drinking bud light understand left florida greatest comedian,Pop Culture
superstar mahesh name enough destroy box office record,Pop Culture
chikki also evictd came back jasmin bhasin,Pop Culture
katy perry performs baby mine poodle nugget disney fam version coming little baby expect costume everything,Pop Culture
jackson wang way official music video,Pop Culture
sad day rest love one greatest ever basketball wont without,Pop Culture
man humble beginning get richhe carry umbrella midnight,Pop Culture
jerry stillers greatest moment seinfeld continuing effort provide news,Pop Culture
watch music video one big country song,Pop Culture
margot robbie really intricate foot stunt suicide squad flip toe backward open lock,Pop Culture
sad hear news passing kobe bryant kobe one greatest nba player alltime one greatest athlete ever heart prayer go family,Pop Culture
chillyrob release music check hot banger,Pop Culture
bb king freestyle lil wayne drake,Pop Culture
music composer took last night tweeted febth needless say simple tweet led flood speculation song anna valentine day stay tuned,Pop Culture
guy know still ongoing im seeing much tl still nd week mass streaming voting please dont lose motivation ahgases really working hard please work hard,Pop Culture
cool j support rick ross actual house used interesting morning,Pop Culture
best concert ever ive never seen bts concert person made feel like part army ocean performance incredible never forget,Pop Culture
oh ya also remember vote ok,Pop Culture
understand people strike think win battle,Pop Culture
final hour president trump grant pardon commute sentence people including lil wayne kodak black,Pop Culture
love king queen best proud sidnaaz lover,Pop Culture
extremely delighted release thala sir th year anniversary common dp sure fan online celebrate cdp,Pop Culture
naya rivera arrested allegedly striking husband head bottom lip daily est en ligne merci,Pop Culture
highlife night winning smackdown championship beat rollins night going hard time topping night,Pop Culture
drop vote drop building nominate treasure,Pop Culture
everybody bit playing live hr set right like proper music check absolute legend trying brighten lockdown,Pop Culture
wing made fly goodnight peter pan love forever always continue make proud carrying legacy good world miss much cam,Pop Culture
didnt watch harry style weekend dont sweat covered ranking everything former one direction member dual host musical guest,Pop Culture
request arashi party starter whenever call dive future summer music never end,Pop Culture
want listen kid cudi jack harlow put spotify even though ive listed many time still number one queue,Pop Culture
dustin kick yikes inactive long came back bite arse love see rd let chandler fight oliveria winner fight title fight card,Pop Culture
love time superstar need k retweets love,Pop Culture
j lo fan trying steal oscar award hand heartthrob definitely blue thing,Pop Culture
someone said enhypen running walking seriously power hold urghh,Pop Culture
basta voting coz long ago four nation lived together harmony everything changed fire nation attacked avatar master four element could stop world needed vanished,Pop Culture
closer carrying defender every play start running lot time clock gotta end point though,Pop Culture
never knew anyone let alone female loved much saw post get right people make sequel gordy year later would awesome,Pop Culture
entire cast coming back like together get keep seeing victor portray feel story show cast mean everything love guy love,Pop Culture
roha vote stream album let get rohas fighting,Pop Culture
panellist say environmental activist every right furious world leader done nothing tackle demand climate change agree watch tonight pm channel,Pop Culture
excited album come friday tweet unlock preview song preorder album,Pop Culture
like smile like kindness like eye l like lip like handsome like way think love every little thing really love gulf morning,Pop Culture
deobis close u free pls stream stealer full version yt also naver b got,Pop Culture
idk sitting thinking momma swift please stay healthy safe time,Pop Culture
like request bts feat let keep requesting together army,Pop Culture
story chief trading yearold ethan mcindoe gm scott carter said uncertainty ty smith big factor trading mcindoe keeping overage dmen filip kral noah king,Pop Culture
thanks company twitterati stay safe everyone see next week mclean close second,Pop Culture
fly high x,Pop Culture
fyn music video comin soon touchdown kane shot travarescraig edited,Pop Culture
get em prod mr brady download app submit music today,Pop Culture
friend humble request please trend ask others tweet retweet constitution countryand inciting others,Pop Culture
prayer may heal live play another game love matter,Pop Culture
til addition speeding playback slow playback libby x perfect listening harry potter la piedra filosofal keep trying learn spanish,Pop Culture
choose let go x stay forever one stop fly high,Pop Culture
fianna fil famous partied showing expected return form,Pop Culture
gave clinic keep name discussion even though super bowl big way tonight casually dropping got engaged freaking amazing,Pop Culture
year experience become mature subject pick better understanding work box officemahesh,Pop Culture
pleasure introducing america six year later chance catch live fall cbs morning,Pop Culture
love youuuu,Pop Culture
ive got much ticket ticket see masked singer live,Pop Culture
freaking excited august,Pop Culture
congratulation entire team three lady nailed movie superb performance word power packed bgm extraordinary,Pop Culture
request oooo please play music video arashi turning friday livestream oooo story summer kite whenever call arashi ok copy paste ok,Pop Culture
reason view slowing sometimes atinys streaming follow streaming rule wrong way yt deleting view streaming properly,Pop Culture
couldnt count many time moo see false accusation towards girlsants trying bring u strong enough deal apologize mamamoo,Pop Culture
dj cheyanne blue n chained blue coming wanna lay corner strut sexy guitar well well well,Pop Culture
stay safe wherever bub,Pop Culture
celebrating watermelon sugar disneyland,Pop Culture
update light official music video view like k subscriber k comment k keep streaming guy,Pop Culture
sad news actor david prowse played darth vader original star war trilogy dead,Pop Culture
closed sunday di kanye west,Pop Culture
iarmys slacking please let energy jarmys karmys carmys u army keep streaming dynamite spotify apple music,Pop Culture
w podcast president trump first lady melania join u wishing speedy recovery,Pop Culture
star war signal future black hollywood joe biden agrees,Pop Culture
kabir singh didnt filmfare award mean seriously kidding wonder india never win oscar hypocrite,Pop Culture
wearing purple sparkly cape set performing gold sequined tux tail event handle amount fabulous,Pop Culture
sorry knowing late still grateful making happy always forever express lovesupport best boy please keep shining thank always knocking arohas heart stay safehealthy,Pop Culture
another year another heartbreak thank best league one gonna hurt,Pop Culture
bit sad especially showcasing bit jpop hoping see perform together one last time closing ceremony miss played demon slayer anime song amazing,Pop Culture
listening party gitz album led boy sb tweeted countless time better done within first week think also help hopefully bring back hype,Pop Culture
really like castmates show love everybody included thats dope show,Pop Culture
one day wake late wake hype around rn feel amazing powerful confident u love thank,Pop Culture
least yorke enough insight understand thom yorke concedes hypocrite climate change,Pop Culture
hype crazy act really going turning point taemin whole career dont think u ready,Pop Culture
look cutting yalls nba salary sponsorship yall dont bring home gold get focused,Pop Culture
listen harry style watermelon sugar first deep dive music came surface sort mesmerized,Pop Culture
really like jamie benn really like rick bowness love see win stanley cup ex wife favorite team morally bring cheer,Pop Culture
cannot put word much love every time listen fall love song thank creating absolute masterpiece cannot wait youll future,Pop Culture
ahmed musa spotted arena anthony joshua fight took place follow,Pop Culture
started basically show worst part kenya barris show acting jesus christ year producing tv film think woulda sense cast better actor play,Pop Culture
arnabjiyou real hero nation citizen go ahead without fear love youso much salute heartlyusername,Pop Culture
sir charles make madthen hit shot match competitor compete,Pop Culture
teumes still trend red carpet alreadt want start treasure sma,Pop Culture
like someone help figure,Pop Culture
last start terrifying battle end far creepy encounter distrust intimidation comradeship causing havok humour equal measure week resolution seems apropos year,Pop Culture
omg voice always love deep soothing voice yasssssssssssssssssssss,Pop Culture
joaquin phoenix destroys dairy industry livekindly,Pop Culture
trained well right use muscular finger next comeback arohas also arohas please rest well,Pop Culture
jimin nice keep going,Pop Culture
permission dance temazo mundial,Pop Culture
radiostyle pbp exciting live commentary join host cohost top featured prelim throughout main card every maneuver strike,Pop Culture
day great music video kosame cord,Pop Culture
local see youre keeping fire ever love stay safe,Pop Culture
could wrong pretty sure reason full catholic wedding less pm uk think previous three divorce oul francie vatican bit funny,Pop Culture
definitely agree w comic writer take bad movie classic pastiche far superior film anchored amazing performance joaquin phoenix,Pop Culture
east coast tune pm allnew episode talk fabulous talk show opera skill plus chef show u prep delicious steak time th,Pop Culture
music share feeling song,Pop Culture
proud joo love much bb,Pop Culture
high school u go watermelon sugar high,Pop Culture
saw ryan taylor water park couple year ago kid turned head saw first thing hadnt seen six year even said hi sang ryan taylor wall,Pop Culture
wonder song got perform award show probably eclipse song album title one,Pop Culture
able watch performance yesterday saw lot tweet like choreo tho honestly love choreography full sassiness pretty savage indeed,Pop Culture
rus troll brady russell wilson us custom happy gilmore clip clown tb ahead capital one match,Pop Culture
fortune teller told power mind,Pop Culture
closer year later person must,Pop Culture
ranking family feud host,Pop Culture
added listing poshmark nwt jennifer lopez boyfriend jean,Pop Culture
august ft rick ross song defining entanglement cap jam,Pop Culture
finally got chance watch present country place artist performed home absolutely amazing performance great way share music hope continues fashion future,Pop Culture
lonnie walker get start road tonight,Pop Culture
celine dion andrea bocelli lady gaga lang lang john legend perform mooi,Pop Culture
winning aside least need put strong fight ikon give let keep going together keep streaming ytkorean site vote mwavewhosfan vote idol champ stream ikonics,Pop Culture
think fair say credibility topic outside bball objectively look jacob blake incident blame cop talking backside china educate,Pop Culture
lucky time okay still love muchwill remember moment phiballs world share goal even though like competition really fun,Pop Culture
way one voice vlive power clean timeline save day wait anticipation selca,Pop Culture
yall leave alone theme song done change song back joe version,Pop Culture
awaited audio launch day nanbas today pm telecasted nanbas make time free watch full video audio launch beginning till end many surprise thing waiting nanbas,Pop Culture
requesting release full audio launch event youtube huge request fan side,Pop Culture
join u live day upland national park climate change supporting nature many fringe event featuring,Pop Culture
music video yam repass link bio hoodie season iii coming soon,Pop Culture
official music video brand single watch,Pop Culture
fyn music video comin soon touchdown kane shot travarescraig edited,Pop Culture
hmmm movie look good,Pop Culture
hope dont mind use brilliant bio pic well done everything youve done tackle climate change brilliant young woman exactly world need,Pop Culture
look like crew busy congratulation entire team,Pop Culture
least yorke enough insight understand thom yorke concedes hypocrite climate change,Pop Culture
standin red dress dress houston toyota center,Pop Culture
watch music video one big country song,Pop Culture
jones lot say thunberg climate change protest best forgotten,Pop Culture
overdose latest video release gbaki feat wc westside connection bosch overdose,Pop Culture
album empty soundsbernie leroux dark side city,Pop Culture
boy display wide range technical musical ability track strong opener album introduction come,Pop Culture
tasteful follow silk watch jpapi cowbell solo somewhere middle cowbell,Pop Culture
globus really nice friday tresorberlin nice inspiration hear play blend classic techno track really good reconnect legendary,Pop Culture
really want album bad god give album please hope kind people give hiks,Pop Culture
camper show love help u send china style blessed busy authentic dedicated music man also love belief work great trip,Pop Culture
put mirror album plzz,Pop Culture
door officially open come say hi show love maybe help u follow making world better place stream time,Pop Culture
imagine put yeosang part preview album th listen album surprised finally get line cry,Pop Culture
fitting send jesse pinkman suttle storytelling never take anything away breaking bad narrative vince gilligan master storyteller nailed completely worth watch,Pop Culture
el camino every breaking bad character return movie,Pop Culture
dont usually want sing praise thank running extended breaking bad recap franchise film need begin way,Pop Culture
duuudeee freakin loved wasnt expecting good final ending breaking bad,Pop Culture
perfect anxiety hour minute breathe happy thank vince gilligan rest bb cast brought back relive greatness breaking bad,Pop Culture
great ill watch anything breaking bad world always slightly rose tinted glass sheer love show felt like solid addition make desperate season,Pop Culture
breaking bad el camino rotten tomato score far bad,Pop Culture
breaking bad without doubt best tv series era brings closure fantastic movie completes everything,Pop Culture
confirm hogey ne oure olle film maadi sir nodokinna munche ne helbahudu bharaate bad movie trailer proved forget went flop spree making routine movie life short make bad movie,Pop Culture
best rapper trillavelli performed vlone runtz fan went rolling loud nyc weekend lit,Pop Culture
dear please dont destroy classic breaking bad fan,Pop Culture
definitely agree w comic writer take bad movie classic pastiche far superior film anchored amazing performance joaquin phoenix,Pop Culture
pop mythology review longawaited movie el camino breaking bad movie,Pop Culture
greeting please hear dope song world right aka bts feat,Pop Culture
hi conquering world right please help u celebrate playing bts feat tonight,Pop Culture
rising unifying world killing stage arena london,Pop Culture
fine wherever go stop requesting bts ft army world must hear tonight,Pop Culture
hi bts conquering world right pls help u celebrate playing bts feat tonight,Pop Culture
lost tryna find answer world around going crazy day night time request may please hear bts feat tonight,Pop Culture
time world television premiere cool,Pop Culture
university foreigner perugia ambassador italian identity around world official video,Pop Culture
l j reynolds key world,Pop Culture
sunday vibe child world,Pop Culture
love hong kong protestors correct week ok leading world really powerful woman speaking truth yes woman space correcting trump real time,Pop Culture
voted practicing take world,Pop Culture
wing made fly goodnight peter pan love forever always continue make proud carrying legacy good world miss much cam,Pop Culture
mari elsa bruni adorable thing world,Pop Culture
dear hope youre well hope youve smiling lot today hope youre wonderful day deserve best love much wait album tour would mind following itd mean world x,Pop Culture
add album f world spotify powered,Pop Culture
dear hope youre wonderful day deserve best love much wait album tour would mind following itd mean world u x,Pop Culture
seems deeper meaning feeling story life bird keep poking head hit boulder got older like groove boogie perk,Pop Culture
presave album moment time dnairo vol spotify powered,Pop Culture
