cleaned_text,topic
streaming overwatch w later osu animal crossing hope see ya,Sports
streaming pm est fun animal crossing horizon come hang fun,Sports
listen getting hard stay home nothing tv tell play game spectator pitcher cant lick finger spitting dugout foot apart contact glove safer grocery store,Sports
move second big move past inside,Sports
r easy longhorn draft someone another school remainder draft thanks em,Sports
congrats signing hard work great attitude pay excited family,Sports
underwater game still mightily unfair unlike ground game train crossing signal giving warning wet game really luck get anywhere,Sports
check american trivia family edition board game,Sports
ufc ppv start minute life good,Sports
ufc success boxing back soon,Sports
ufc like need supportplease follow,Sports
wait watch live sport first time month,Sports
golf todayglad see live sport back hopefully work safe,Sports
quick somebody fire blue emu giving end race,Sports
lap brings light pit road four tire fuel attempted add tape quite stick came first left first,Sports
proud small part thanks player partner seminole gc gracious host amazing cause much needed live sport time tee colonial yet,Sports
admire massive effort along bring sport back day remembered turning point return live sport competition,Sports
brilliant commentary push f pawn toward queening square win game losing match frodo charging toward mount doom,Sports
great battling match go manning,Sports
absolute freaking knockout right bell bat face,Sports
dang bringing heat tonight knockout buzzer,Sports
everyone need watch buzzer knockout,Sports
ernie johnson reacts drew brees comment use blindfold,Sports
trump say kneeling latest drew brees national anthem controversy divide conquer know better,Sports
nfl star malcolm jenkins slam drew brees comment anthem protest woefully ignorant,Sports
upon advice shall wait day give thought since know close friend playing watched xqc stream know thought,Sports
congratss th win,Sports
enjoy stream tonight loved support believe dropped following happy appreciate massively best fifa played stream thanks shown support,Sports
win georgia star baseball academy sp christian mansfield ip h k b b b rbi dog take seed play tn select bright early start bracket play,Sports
morning second gold bracket game please watch u va glory u johnsonavvisato team,Sports
sprint race p p weekend pace promised start well making next weekend,Sports
guard cal klesmit neenah strong performance morning crafty skilled guard good going left,Sports
take away thus far prelim really found comfort zone calling fight rare form evening ready main card,Sports
already crazy groin strike even main card yet,Sports
recap kamaru usman outclasses jorge masvidal hold max holloway retain respective title meanwhile stop jose aldo become bantamweight champ,Sports
prop alex fight,Sports
usman defeated masvidal ufc unanimous decision follow u highlight subscribe youtube link bio,Sports
second half start lafc galaxy got start playing winger bit different spot right back tied half,Sports
probe act returning guest shiraz listen,Sports
miss leganes pull great escape real madrid tonight report,Sports
awesome win turn corner takedown best enjoy w friend,Sports
michael owen premier league accumulator today see predicted happen final match today odds bet win betslip link included read tip,Sports
goal danny ings ever scored premier league season,Sports
super sunday premier league last war pm stay tune englishpremierleaguedaily premierleague v v leicestercity,Sports
jan man making final appearance today servant best centre back last twenty year alongside ledley shame get send deserves thanks memory x,Sports
come must get positive result today need establish premier league club today game massive,Sports
terribly sad day saying goodbye premier league career absolute city legend also premier league legend class pitch mention full trophy cabinet,Sports
haller ht think michi glorious u look tired todayneed get box prime haller game one,Sports
kevin de bruyne best player premier league,Sports
beauty edge box want football,Sports
w in out jamal adam trade first dealing covid camp qb preview ahead training camp,Sports
sign raheem mostert restructured contract sf really jamal adam focus lead training camp,Sports
jamal adam take victory lap online arrives seattle report training camp made unprecedented trade allpro safety work resign adam beyond plan,Sports
check original game perfection fun run milton bradley game hasbro,Sports
funny fan celebrated yet mention crowd breaking social distancing north south bias yet,Sports
phixos day go st yr since bought ticket yea intense battle lmao miss,Sports
thinking sit watch,Sports
along many member answering question related game asked want know anything pokkn highly recommend shooting question,Sports
eight team remain season manchester city favourite win trophy following comfortable win real madrid update latest odds,Sports
gabriel jesus offer glimpse man city always hoped could,Sports
nigeria trend follow insight bottom guardiola brighto world cup tolanibaj laycon yakubu tbaj man city ligue view google search trend insight,Sports
halfway ride remarkably slightly schedule mile circuit really enjoying tailwind quite headwind way back never mind lap go support,Sports
guardiolas tinkering end familiar champion league exit man city,Sports
expected come back didnt think would due magnus miscalculating endgame transition like exciting finish set,Sports
team arrow always show love support go watch play right,Sports
pathetic bias seen tonight favouring manu like man city last night let impartial,Sports
quicker end expected blast girl coach teammate life,Sports
great half football really enjoyable excellent expected chance either end good fred recovered many ball williams continuing grow,Sports
dummy calling playoff game monday night download app free code clipcast watch live broadcast along u laclippers,Sports
lineal cham peen way back john l sullivan put notice grind boxing academy fitness center,Sports
demon soul could closer expected recent rating indication jordan devore,Sports
dead daylight fog dive connection part connection coming sorry uploading later expected internet decided deserve upload,Sports
check wrote mouth watering encounter lisbon everything need champion league final link,Sports
koemans arrival altered priority lautaro martinez still number list club planning making attempt early september time lautaro martinez operation return front line,Sports
pong unconscious hit ground stay trainer give thumb he ok minute later give magical pas wrap game year retiring sue brain injury,Sports
sends shot ground bounce crossbar,Sports
dragon line lock ball turned webb clear,Sports
x factor guy score anytime champion league final di maria odds coutinho odds joshua kimmich odds marquinhos odds combination odds pick poison become millionaire one night,Sports
live chilled stream playing watching champion league final giving away gifted sub best prediction chat come tell future,Sports
hoping come cut promo much love thunder dome,Sports
strongly believe time left paul george find rhythm back gone team cant afford pandemic p take shot find rhythm series coach must adjust minute attempt along rotation,Sports
requesting hall fame script go winning champion league,Sports
bit light listening saturday morning chairman kim berry discussing club upcoming quarter final,Sports
check live playstation call duty modern warfare live,Sports
giannis going might good buck take pressure everyone trying force let guy play,Sports
im proud apart man suffered long enough year still cringe remembering bad starting line made onward western conference final,Sports
lakers advance western conference final blowout win game,Sports
source air quality pic plan stay play la v,Sports
take lion pm cdt today kickoff sure get preview xfactors today game,Sports
ready see get w tonight make conference final first time history,Sports
watch kawhi pt game warm look advance firstever western conference final lacden pm et espn music,Sports
remember time determined never make conference final,Sports
breakfast football start red zone channel day dinner,Sports
check topps baseball card tcg eddie bressoud san francisco giant vg,Sports
started beating winter classic get watch corey perry get step closer raising stanley cup thank real dope year also stats,Sports
commentary app website today,Sports
know missed throw back last time lightning stanley cup later,Sports
q john lovett tackle bear rolling,Sports
hat denver nugget playing great nba basketball series earned respect put league notice force reckoned,Sports
yo gas happy izzy polish brick house came mad correct fight bubble bout action finally,Sports
hamilton panished black life matter,Sports
never understand newcastle went bruce benitez,Sports
dundalk away later today could take huge step towards winning league point oriel cmon,Sports
lanthorne fc chandler well confident display boy biggest win date solid back clinical going forward record intact top league go x x x,Sports
understand circumstance jumping arm catch anyone seems risky best yall screaming throw old man back,Sports
cyclone chance separate pack month iowa state remaining october schedule v ttu pm bye ok state tbd kansa tbd,Sports
defense field way much already showed touchdown steelers,Sports
dak prescott first career reception td put halftime,Sports
steelers lot happy week win eagle also need fine tuning defensively want come away win sunday brown column,Sports
bounce went way trae klatt tipdrill td catch late th helped raider beat cpu class first round,Sports
congrats go spank dodger salute build run go get em next year,Sports
feel like amazing job season even without main pitcher got far almost made world seriesim proud astros fan thank amazing season see yall next year,Sports
winner wednesday evening fa youth cup rd qualifying round tie host winner tie st round proper,Sports
know team even bothered put boot today point mayo halftime tuam embarrassing stuff pathetic defending game,Sports
think agree astros lose america win congrats heading time bring,Sports
really curious show next year great drive today,Sports
time surge week plus guy talk three week away,Sports
minute would sleeping,Sports
world series corey seager single give dodger lead th por n con,Sports
hunter renfroe dont dowith two two out popped dodger get done get run home different level offensive baseball,Sports
dodger look take command series ray thats terrible series tied clearly someone want dodger win tonight,Sports
people made top waiting long anxiously refreshing twitter grinding year please help reach dream thanks good luck everyone hopefully wake news made,Sports
month old last time dodger world series please wrap tonight boy,Sports
thought forgot huh next,Sports
great stat game led min tied trailed game ended one score affair start fluke better team,Sports
si sooner former ou golfer abraham ancer fall nd master going sunday final round,Sports
im taking inspiration hero villain hero starting aussie friendly time pm villain master moved unaussie friendly time,Sports
yes master breaking record process,Sports
show everyone best tournament give fan devotee coach club century best,Sports
dont care anyone say still got happy see ring,Sports
errol spence jr versus danny garcia breakdown,Sports
yard rushing st half record yard game charlie davis okie state,Sports
errol spence jr v danny garcia live stream full fight ppv world welterweight championship premier boxing champion pbc fox online watch live watch live pbc fox,Sports
errol spence jr back like never left nice win errol spence v danny garcia,Sports
get people thought cheated cu must content creator practiced like basketball game team say cheated practiced weekend fair good sport last,Sports
prayer anyone west virginia bear today unfortunately,Sports
columbus crew ml champ needed,Sports
columbus crew ml cup title win seattle balknmag,Sports
next game time update v ohio state cbs sport classic cleveland oh rocket mortgage fieldhouse saturday december pm et cbs tunein,Sports
time date december pm adam gase still head coach,Sports
podcast ohio state football early signing day preview,Sports
championship game week college football alabama v florida clemson v notre dame ohio state v northwestern oklahoma v iowa state pick preview line courtesy,Sports
think perfect challenger robbed way think could make real magic,Sports
idk keep showing u ohio state fan club telling u committee,Sports
featured streamer spoc streaming star war old republic come say hi support,Sports
yes well done true inspiration good christmas year lewis,Sports
greatest show turf wr getting separation wr getting open positioning always great gotta love,Sports
start season started bottom,Sports
minute player need greatest impact,Sports
irvin anyone see jerry rice greatest need head examined,Sports
year eve make good choice stop think risk afford take affect future affect family affect teammatescoaches,Sports
seems unstoppable moment easy game hand going good three way fight top,Sports
several former active cricketer taken social medium express objection incident ground,Sports
penalty need improve second half leo suarez hard time position either need play closer sideline sub gio,Sports
correction he second fighter signed team year,Sports
commentator game given job based ability alone said chelsea happy point cup game,Sports
want everyone chance win word yet play match match noobs pro match match get killed player crouch spamming jumping wall thing need use claw elite controller,Sports
halftime entertaining first minute match live goal second half,Sports
played exenergy nuke shakey got thing fix wp definitely second best team sa atm proud boy tonight,Sports
reason weighed lb bout announced non title arbitrarily khabib abdicated ufc lightweight title second upon retirement know crown dustin champion,Sports
halfterm manchester united would grade red devil first half season latest piece grade second half campaign set kick,Sports
commentary box pm gmt prepares second season grand prix world series preseason festival involving tier two team watkins glen tune,Sports
making change schedule due game postponed play home pm instead facing game portland moved second half season,Sports
end first quarter warrior lead anthony edward minnesota catch second quarter w online,Sports
red knight hold defeat harrisburg score tough week red knight huge bounce back win tonight end game day stay safe,Sports
always love someone go grain im think chief win,Sports
men finished nearly third event saturday pick dual win clarion,Sports
horse race today think starting super bowl huge,Sports
lavonte david say tom brady told teammate stop cry reaching super bowl think brady great game might come last drivetied kc would score win capturing point spread,Sports
watching super bowl hope winning need gift card,Sports
watching super bowl phone game watching commercial,Sports
last time team looked good chief,Sports
th best odds win super bowl next year im already pumped september,Sports
bruin come back quick run lead left game team tied point paint,Sports
looking forward start season fresh season one adjustment schedulewise progress evolution sport relevant way track,Sports
getting better every year,Sports
far survivor wicketkeepers team probably read pitch closely,Sports
far survivor wicketkeepers team probably read pitch closely courtesy,Sports
far survivor wicket keeper team expert epadi evanga matum solunga,Sports
news lightning clock lifted time start trackdrying effort,Sports
leading front firstever elite group match chandigarh captain scored matchwinning second list century seal run target like yuzvendra chahal mohit sharma rahul tewatia,Sports
daniel james martial rashford front three tonight matic also start,Sports
great comeback win overtime v lake park proud guy excited senior night tomorrow v glenbard north,Sports
away win sunshine,Sports
icymi guy recapped st half nba season sure go listen subscribe share rate review thanks friend,Sports
prediction rest card makhachev put clinic stop dober aljamain pick strap yan nunes nunes retains izzy becomes champ champ stoppage,Sports
team royal v team clutch team royal v ark razorback one lost one came second place game lit come check u next weekend much love boy stepping ready movie coming,Sports
aleksandar rakic paraphrase israel adesanya beat jan blachowicz main event next go back middleweight rakic want fight glover teixeira interim light heavyweight belt,Sports
going put guardrail protect driver dont doubt story see hilarious,Sports
nd annual draft book first one done virtually see went first round,Sports
manchester red beautiful fan,Sports
know patrick ewing congrats claiming big east auto bid catch aq bid tracker,Sports
cut net lehgoooooooooo,Sports
sunday morning catch,Sports
haha right tell go tide cut net,Sports
check stephen curry swingman jersey chinese year white small youth used,Sports
great action ncaa woman hockey championship bad app tv,Sports
cant wait watch main event fight tonight ufc fight night presented modelo brunson v holland app,Sports
duc de beauchene get line,Sports
ncaa tournament full swing game take look basketball history uncovered interesting nugget must read,Sports
head coach gu malzahn said ncaa transfer portal changed landscape recruiting college football would know day since arriving ucf malzahn landed commitment six transfer,Sports
team shutout bhsu yellow jacket sunday afternoon click link get detail great win,Sports
congratulation boy getting ncaa tournament pulling,Sports
reaction one hardestfought win career one gave victory season opener first time since,Sports
saw esbc video released corner man mini game round la fight night kinda bummed everyone get beat drop still,Sports
look sugar bird dropped easter egg allright easter special nft original,Sports
sorry actually really enjoyed boat race today great ouse close exciting also slightly biased cambridge race,Sports
row baby another big win look bull team know needed vooch make every player team better guy worked hard keep going guy,Sports
night one great top bottom good match crowd really make impact thank stellar night,Sports
take full min drown time octagon experience bring breath back,Sports
hell shakib play like playing like chasing score shakib playing like chase remove bring next year remove morgan shakib dk,Sports
idea undertaker return end every wrestlemania collect body main event loser,Sports
next main event let go,Sports
vamosssssssssssssssssss rafaaaaaaaaaaaaaaaaaaaa th time champion take bow warrior king longest best set roller coaster match year highest quality long live king,Sports
year younger fitter bodyi pretty sure bat batter virat singh abhishek sharma combined,Sports
king clay take win th barcelona title took hour minute victory,Sports
congrats threw everything nadal king clay denied,Sports
heat race coming next note lap top transfer top go dash,Sports
loop hour conspiracy theory lopez review houston sport award attendee nonattendees paint perfect texan offseason picture og chat gary kubiak,Sports
lone offensive pick saturday delivered production two year ago memphis opting rb kenny gainwell video,Sports
looking forward battle florida playoff,Sports
city xtra isnt u im proud journalist reveals moment nearly ended pep guardiola man city career,Sports
champion league final could played london,Sports
ccc softball championship live score oregon tech pitch inning ci brings u th,Sports
champion league final set played wembley,Sports
try take eighth still hold buescher want piece battle well,Sports
ccc softball championship live score oregon tech nothing going u th well head,Sports
chelsea fc leicester city youri tielemans wonder goal win fa cup final,Sports
watched fa cup final last nightas every year great see lift trophywell deserved great see fan backatmospherenoise credit side fa cup always magic kid still book proof tear,Sports
good back today keep going,Sports
exciting news launching competition structure ahead planned return action september includes prestigious cup wait see everyone back court competing,Sports
great night last night guy colin sahlmanm leo young mile lex young mile girl sam mcdonnell mile ailish hawkins mile,Sports
ahhh good time bros nashville tie series double ot colorado sweep blue first team sweep advance second round,Sports
year later congrats soon year old pga pga championship,Sports
live europa league final villarreal manchester united first blood united villarreal foyth ended bandaged head moreno villarreal leading break,Sports
think timo werner matchwinner saturday think prove mvp night blue carry day,Sports
chelsea bringing trophy home blue way,Sports
th play much hidden detail dialogue without doubt best work arthur morgan greatest relatable protagonist gaming history,Sports
really intrigued win game think one future face league dont know got help need right would also love able talk kawhi king la another couple week,Sports
like format love prime time spot think shouldve put biffles tire start car would little fair field came last lead lap cant take away local he doin great,Sports
two hot action today man match preparation seems good trainer said side note help notice khairy rafik reach wretched keeper guy realized prefer opposing goal,Sports
u generation coming back unimaginable disappointment missing world cup russia,Sports
reserve team man match sponsored gorseinon kai superb win getting score sheet great goal well done kai,Sports
cmon boy let make start brilliant summer,Sports
congratulation great game man match brilliant performance,Sports
t day cochairs john harrity sandy maxey david jaffe pump u count u one last time start st finish strong,Sports
brand facility night let get thing underway tyler reddick lead field green flag shortly,Sports
aye james harden hardly twitter rocket stint went net tweeting scary hour every winwill tweet go back twitterlmao,Sports
respect sticking around congratulating winning team james harden straight locker room show type person must learnt lebron,Sports
absolutely true pivotal creation development acknowledged like marriage one party fell love look someone else love,Sports
marco tilio starting versus month leaving club search regular game time story,Sports
yearold southampton leftback jake vokins likely leave club loan ahead next season,Sports
take mithali raj inning score nothing may good considering strike rate decent considering match situation team need one anchor comment harman try someone else,Sports
stanley cup habs lightning preview,Sports
dillon tate pitch th oriole strike side tor,Sports
massive episode buntsbruises show welcome tonight logan come help preview stanley cup final breaking mlb season far electric episode tap tonight otbn cameo well,Sports
announced home opener canadiens playing stanley cup final think happier man michael andlauer right,Sports
hope senior get go yard tonight bring home boy give em heat,Sports
stat day scored alltime point red bull ring,Sports
pretty sure gained ton fan,Sports
lachie whitfield replaced medical substitute jeremy finlayson copping knock head,Sports
switched tv pm apparently news extended sport report nothing happened today amazing,Sports
never mind v next weekend back football matter,Sports
congratulation italy simply hurt go every single one thank,Sports
contact head across chest ridiculous call bunker atrocious,Sports
celebrating th anniversary world series team one game tonight one game get put top list incredible witness almost surreal difficult season game make summer fun,Sports
happen bring boy home,Sports
fancy win open today shame dropped shot last hole yesterday wouldve great spectacle seeing leading within shot going last hole,Sports
unacceptable time clean house top bottom people running sport seem incapable job excuse today excuse sauter wreck texas excuse truexcuster wreck cota strike youre,Sports
potential champion crowned tonight legacy defining day star talk morning scott foster clown shouldnt employed somehow head ref important game season clean,Sports
watching coverage olympic road race amateurish interview important part race get back commentary,Sports
racing k morning due early matinee wont good luck runner glad heat gone race good condition pb runner fun,Sports
priya malik win gold,Sports
fun watch dominate semi good luck gold medal match,Sports
ill put hand say unluckiest team bottom half especially train wreck team wce clogging valuable real estate,Sports
watching olympics breakfast catch happened overnight like people would watching golf playoff player contention low behold thing good idea inform everyone bottom screen golf,Sports
congrats keep going sky limit best luck gold paris olympic,Sports
amount vuvuzelas winning beer cup would happened saved u madness,Sports
fun fact womens basketball team play gold medal tonight rematch st womens olympic game history took place montreal,Sports
chennai super king creating special jersey number respect achievement neeraj chopra gold medalwinning throw neeraj,Sports
ufc bonus dana white open checkbook six fighter rewarded,Sports
ufc derick lewis v ciryl gane post fight reaction,Sports
big shout homie judging medium meal pressbox u bank stadium preseason game gonna eating good season home game beat writer visiting team youre treat,Sports
check listing added closet white sox long sleeve fanatic medium newish,Sports
tasmania host final next weekend elimination final v uta stadium saturday august pm elimination final v uta stadium sunday august pm history,Sports
hope move find club actually give platform perform quality player ole doesnt even know squad amount chance fred get screw thing actually alarming,Sports
start calling class nfl draft class amount talent theyre compiling newest addition brandon inniss top receiver country,Sports
