text,tags
"I personally believe that #SHIB will shock many once again. Especially with everything being built from sovereign identity, gaming and all the way to privacy. $SHIB is going to be a  beast in this space.",SHIB
"Ever wanted 39,000 games in your pocket?  The Intelper X6 Game Stick's got them all - PS1, MAME, and more! Its quad-core power and HDMI output make gaming a breeze. Who knew retro could feel so high-def?  #RetroGaming #TechLovers Buy Now! https://s.shopee.ph/6ATP8EnJm1",RetroGaming TechLovers
"I have a lot of very personal, complicated thoughts and feelings on #LiesOfP, so for now, I’ll share those. But Lies Of P is one of the best gaming experiences of my life. #Podcasts #VideoGames",LiesOfP Podcasts VideoGames
"Koloni4d | Star Gaming Asia Claim serta Dapatkan Kemenangannya Hanya Di sini https://heylink.me/koloni4d.vip 
#Hamster_Kombat #LaCasaDeLosFamososMx #sstvi #GameAssets #koloni4d #newmember #AsianAcademyCreativeAwards #asia #gameasia",Hamster_Kombat LaCasaDeLosFamososMx sstvi GameAssets koloni4d newmember AsianAcademyCreativeAwards asia gameasia
"Join me for dice and slots with unlimited faucet,  grab treasure boxes to share  BTC bonus pool! #Dice #Slots #BTC #Gaming #OnlineCasino #onlinegaming",Dice Slots BTC Gaming OnlineCasino onlinegaming
" Unleash your gaming potential with the ASUS ROG Strix G17! For just $1,999.00, enjoy the power of AMD Ryzen 9 7845HX, GeForce RTX 4070, and a stunning 17.3"" FHD 144Hz display! https://amzn.to/4hslbqk 
#blackfriday #GamingLaptop #TechDeals #amazon #amazonprime",blackfriday GamingLaptop TechDeals amazon amazonprime
"Happyハローウィン的な日付で
いいねボタンをポチると
かぼちゃになるらしくて
かわいいからちょっと

押す？

#HappyHalloween",HappyHalloween
Das war einfach zu Geil #Fortnite #Gaming #Clips,Fortnite Gaming Clips
We are live! More “Into the Storm” Pathfinder 1e action right to your screen! http://Twitch.tv/unnatural_1s  #ttrpgcommunity #TTRPGs #pathfinder #gaming #twitch #IntoTheStorm #Hayethe #tabletopgames #TuesdayFeeling #TuesdayFun #ADHD #Halloween,ttrpgcommunity TTRPGs pathfinder gaming twitch IntoTheStorm Hayethe tabletopgames TuesdayFeeling TuesdayFun ADHD Halloween
"Secret Squirrel stuff in the Black Ops 6 Campaign!
https://twitch.tv/jackriffton_rifftongaming… #twitch #twitchlivestream #twitchstreamer #CallofDuty",twitch twitchlivestream twitchstreamer CallofDuty
