text,tags
"Coming to the end of #InternationalWomenDay2020, the fight for equality continues, equality of all types, day after day, join a trade union tomorrow and join the fight {@The CWU@} ✊✊.",InternationalWomenDay2020
Military blocked the road around US Embassy & other embassies. And they will cut off internet 1 a. m. to 12 p. m. 22-feb-2021. {@UN Human Rights@} {@United Nations@} {@UN Special Rapporteur Tom Andrews@} {@President Biden@} #WhatIsHappeningInMyanmar  #Feb22coup,WhatIsHappeningInMyanmar Feb22coup
#Kindnesschampion ZaNia Stinson is what #kindness is all about  This 14yo grew up a #shelter and knows what it is like to be #hunger so she puts together #ZFeedsGo-GoBags to help people who are #homeless and need help #thereisgood❤️ {@The Charlotte Observer@} {{URL}},Kindnesschampion kindness shelter hunger ZFeedsGo homeless thereisgood
"#AskWDSU: What questions do you have for our weather team? Drop them in the comments on this Facebook post & I’ll get them answered on-air throughout the day. Stay safe, everyone!  >> {{URL}} {@wdsu@} #HurricaneIda",AskWDSU HurricaneIda
"Our thoughts are with those affected by floods.  Stay safe everyone ❤️  “If the road is flooded, forget it.” #AUResearch {{URL}} by Garry Stevens & {{USERNAME}} {@Western Sydney University@} and {{USERNAME}} {@Macquarie University@} via {@The Conversation@} .",AUResearch
The main evildoers behind this conspiracy are still under the shield of power which made us furious! Delay in justice is always denied justice! We still have some faith left in system so please emphasize our pleading  #justiceforhirenpatel {@Gujarat Police@} {@DGP Gujarat@} {{USERNAME}},justiceforhirenpatel
Yuval Noah Harari: Lessons from a year of #COVID  In a year of scientific breakthroughs — and political failures — what can we learn for the future? {{URL}} via {@Financial Times@},COVID
"Dear President Cyril Ramaphosa {@Cyril Ramaphosa VoteANC@} and South African Government {@South African Government@} , we demand #JusticeForFikileNtshangase and other land as well as environment Activists. Will you protect their human rights? - Sign the Petition! {{URL}} via {@Change org@} ",JusticeForFikileNtshangase
WATCH: Sen. Schumer says Trump lied in State of the Union address {{URL}} via {@YouTube@} #SOTU,SOTU
Congratulations {@Joe Biden@} on being elected as the president of United States of America (USA)#USElectionResults2020 ..,USElectionResults2020
These thugs manhandled {@Yogendra Yadav@} outside #JNU in the full glare of media. Imagine what they re doing to the students inside. #JNUViolence,JNU JNUViolence
"I heard on the news about an internet outage affecting the Twin Cities metro. Why no proactive alert from you, {@CenturyLink@} ? {@CenturyLinkHelp Team@} #CenturyLinkDown",CenturyLinkDown
PLEASE sign this petition to bring back {@Jasko@} !!! He was wrongfully terminated from {@TeamYouTube@} !! We have to fight to get him back!!! #justiceforjasko {{URL}},justiceforjasko
"#BunkerBoy #MoscowMitch #KremlinKevin, the whole {@GOP@} , Fox News enablers and all these #MAGA roaches are American traitors.  Its time for pest extermination. They have no place in a healthy, functioning democratic American society.",BunkerBoy MoscowMitch KremlinKevin MAGA
Expect air travel delays today in the USA - 150 million Americans under winter storm warnings #avgeek {{URL}} via {{USERNAME}},avgeek
"#کچھ_نہیں_بدلا {@PAT@} {@Dr Tahir ul Qadri@} Our struggle is not against any one individual or group, but against the whole system. Nothing is expected to change until the poor in this country get justice.",کچھ_نہیں_بدلا
12.31.20 Post Election Update #14: NESARA NEW YEARS EVE SPECIAL {{URL}} via {@YouTube@} USA time to defend freedom rights laws constitution justice peace on earth save USA,14
"ICYMI: Today’s  Coast to Coast  on {@SportsGrid@} {@Scott Ferrall@} reacts to sports being shut down across America... {@Craig Mish@} & Dr Mitchell Roslin join, plus {{USERNAME}} in Hour 2 #GetontheGrid {{URL}} ",GetontheGrid
" It was very shocking because we saw a lot of dead bodies... I saw my neighbor dead. His body had been shot by five bullets. We found him, took his body to his house … He s an old man ~[age] 50.   #AxumMassacre #TigrayGenocide {@United Nations@} {@Human Rights Watch@} {@Vice President Kamala Harris@} {@President Biden@} ACT NOW! {{URL}} ",AxumMassacre TigrayGenocide
❗️VOTING ENDS SOON SO PLEASE TAKE TIME TO VOTE FOR NAMJOON❗️  200 replies  REPLY AS MUCH AS YOU CAN BTS SONGS SEPARATELY + I am voting #RM of #BTS ( {@BTS_twt@} ) for #BiggestCrush at #TDYAwards {@96 5 TDY@},RM BTS BiggestCrush TDYAwards
I don t understand why Sir {@Keir Starmer@} leader of the #LabourParty is remaining so quiet about #GreaterManchester while {@Andy Burnham@} is quite literally in the fight of his life to protect #Northerners. Why is he the #Labour leader again? Because of his #conservative leanings?,LabourParty GreaterManchester Northerners Labour conservative
Trump’s hatred for the media inspired an anti mask crowd to harass and chase off a local new crew.  Denying the 1st amendment is the opposite of #PrinciplesFirst   Group rallies against Minnesota mask mandate at State Capitol {{URL}} via {@KARE 11@},PrinciplesFirst
"#CBIFindAjitabh {@Google@} {@WhatsApp@} {@Facebook@} NOT co-operating with Indian law enforcement {@BengaluruCityPolice@} {{USERNAME}} & CBI is finding Ajitabh, whose life is involved, how can likes of {@Google@} demand MLAT procedure and case unreasonable delays. Please help {@Sundar Pichai@} {@Zee News@} ",CBIFindAjitabh
"The {{USERNAME}} {@Miami Herald@} Tallahassee bureau recorded, transcribed and analyzed what Gov. #RonDeathSantis has said from 66 of the news conferences & TV interviews he s held since the start of the pandemic. Here s how the narrative has changed. {{URL}} ",RonDeathSantis
"#BLM   NOTHING TO SEE HERE! Next Up - Nobel Prize. Black Lives Matter, Antifa March Through DC, Chant ‘Burn It Down’ {{URL}} via {@The Epoch Times@} ",BLM
Dwindling snowpack has already impacted water supplies & hydropower in CA and the western US. New {@IPCC@} report explains: {{URL}} #SROCC #IPCC,SROCC IPCC
#WildFlowers I ve just signed Plantlife s ( {@Plantlife@} ) petition to my council to help save and protect wildlife on our road verges. Please sign and share to show you care! #RoadVerges {{URL}},WildFlowers RoadVerges
"Video from late afternoon today as the winter storm #Xylia began moving into Wyoming, the big and fluffy snowflakes were plentiful and gorgeous! {@Jim Cantore@} {{USERNAME}} {{URL}} ",Xylia
The Crisis in the Skies of San Francisco {{URL}} via {@The New Yorker@} #California #CaliforniaFires #CaliforniaWildfires #BayArea #BayAreaFires #US #USA #SanFrancisco #sanfranciscosmoke #Sa #Oregon #OregonFires2020 #OregonFires #Washington #washingtonfires #wildfires,California CaliforniaFires CaliforniaWildfires BayArea BayAreaFires US USA SanFrancisco sanfranciscosmoke Sa Oregon OregonFires2020 OregonFires Washington washingtonfires wildfires
"“Dodgers look to take a command on the series, against the Rays” {@FOX Sports MLB@} {@FOX Sports@} that’s terrible! The Series is tied 2-2!! Clearly someone wants the Dodgers to win tonight.... #RaysUp",RaysUp
"Past week has been very bloody with the #SouthernCameroons conflict claiming many lives in a clear escalation of violence on both sides. There were running battles in #Bamenda, soldiers killed in Matazem & Momo, Army killing of civilians in Mundemba & deaths in Ndian {@Department of State@} ",SouthernCameroons Bamenda
Voting reset a couple hours ago remember to vote for both Mama and Ama  #MAMAVOTE #bts {@BTS_twt@},MAMAVOTE bts
"The irony of {@Priti Patel@} , #CressidaDick, & {@Metropolitan Police@} making a horrendous, authoritarian misstep just days before voting on a horrendous, authoritarian bill.  Hopefully the news that {@The Labour Party@} will vote no proves true.  PLEASE CONTINUE to contact your MPs, tell them to vote no!",CressidaDick
Remembering the Ground Hog days where {{USERNAME}} directed the morning news and we would include the live PA dance party in the newscast.  #danceparty,danceparty
"Apple AirTags Tipped to Launch Soon, May Come in Two Sizes Apple AirTags ultra-wideband trackers have been in the news for a while...  via {{USERNAME}} #SmartHome #Innovation {{URL}} _",SmartHome Innovation
Proud to be a part of this important research lead by Sam Pironon: Potential adaptive strategies for 29 sub-Saharan crops under future climate change {@NatureClimate@} {{USERNAME}} #ClimateChange {{URL}} Also the News & Views piece on it: {{URL}},ClimateChange
"The ABC staff decision to vote for pay rises while coronavirus cuts a swathe through the private sector shows we have a national broadcaster that shows nothing but contempt for ordinary Australians, says {{USERNAME}} . #auspol #ausmedia #TheirABC {{URL}} ",auspol ausmedia TheirABC
System is not working properly to resolve unemployment. Your all promises gone to vein. Your government are playing with the future of youth.  Don t ruin our life. {@Narendra Modi@} {@PMO India@} #JobKiBaat,JobKiBaat
" Oh look, {@Joseph Muscat@} !  This is never going away. {{USERNAME}} is making sure you don t either. Why does he need you to advise him on the economy when you have built it on #corruption? Any loose ends? Keeping an eye on your investments? {@Organized Crime and Corruption Reporting Project@} {{URL}} ",corruption
"A Germantown Hills church attended by a Woodford County man who tested positive for COVID-19 on Friday is closed until further notice, via our #publicradio partners at {{USERNAME}} . {{URL}} ",publicradio
Trump Signs Blank Paper With a Sharpie in Staged Photos at Walter Reed {{URL}} via {@The Mary Sue@} OMG! This dude is SUCH an idiot. #BidenHarrisToSaveAmerica,BidenHarrisToSaveAmerica
A black Trans women was at the forefront of the stonewall riots that allow us to have the freedoms we do today! #TransWomenareWomen so Boris Johnson: more protection for Black Trans Women UK - Sign the Petition! {{URL}} via {@Change org UK@},TransWomenareWomen
#PMSpeakUpOnSSRCase  if our lives matter to you ! If our vote matters ! If we chose you as our leader matters to you ! Speak up dear prime minister Mr Modi don’t let any politics happen to our SSR  {@Narendra Modi@} {@PMO India@},PMSpeakUpOnSSRCase
Congratulations & Félicitations to {@Kamala Harris@} on her ascension to the post of #VicePresident of the United States. This message is on behalf of all #Montrealers who want her to succeed and prosper. All our #BestWishesToKamala,VicePresident Montrealers BestWishesToKamala
"The doors are officially open NOW!! Come say hi and show him some love to {{USERNAME}} , maybe help us with a follow.  Making the world a better place 1 stream at a time. {{URL}} #Twitch #twitchaffiliate #SmallStreamerCommunity #SmallStreamersConnect #theducks #bighew",Twitch twitchaffiliate SmallStreamerCommunity SmallStreamersConnect theducks bighew
"#ClimateChange: Why are #US senators wearing this symbol?  Climate scientist, {@Ed Hawkins@} created graphic representing our warming world. US Democrat senators Tom Carper, Sheldon Whitehouse & Chris Van Hollen wore it as badge at State of the Union address. {{URL}} ",ClimateChange US
1-1 between the Storm and {{USERNAME}} at the first period media timeout.  Jirousek on the PP has the goal for GP #WeAreTheStorm,WeAreTheStorm
"#DONOTHINGDEMOCRATS My heart goes out to you all, {{USERNAME}} if you do one thing right in your presidency send this woman back so that justice is served  justice for Harry Dunn",DONOTHINGDEMOCRATS
"I m outraged that Cannoli, a healthy dog in {@Texas A M University@}  s muscular dystrophy lab, was put up for adoption & then yanked back into another lab. He s NOT a test tube. Shut down the dog lab! #FreeCannoliDogTAMU {@The Association of Former Students@} {@Texas A M VetMed BIMS@} {@Texas A M System@} {@Texas A M Foundation@} {{USERNAME}} {@Texas A M Athletics@} ",FreeCannoliDogTAMU
HR1044 is the only enforcement bill to see the light of day in many years. HR1044 is good for America! Legal immigration is broken! {@Rep Zoe Lofgren@} don t let our kids down. #KeepYourPromise #HR1044MustPass,KeepYourPromise HR1044MustPass
"A strange image, from Joe Biden:  We got to stop pouring flames on the fire.  {{URL}} {{USERNAME}} #AAG #AAG2020",AAG AAG2020
The latest Gwadar Oil and Gas! {{URL}} Thanks to {{USERNAME}} #gwadar #hollywood,gwadar hollywood
"I really hope Anneliese Dodds ( {@The Labour Party@} Shadow Chancellor) on #Ridge this morning acknowledges and addresses the fact that the two main parties have completely overlooked the gendered economic impact of Covid, which will only increase the gulf of inequality between men & women.",Ridge
"The {@GOP@} lost an election and now are behaving like toddlers, except their tantrums are destroying the country. Let it go people! Please. #sundayvibes",sundayvibes
I wonder what it s like for {@Scott Morrison@} {{USERNAME}} and their ilk knowing that their footnote to history will be  they were part of the last generation that thought they could get away with denialist conservatism by pretending climate change didn t exist ? #auspol,auspol
"The Economy, Lemurs And Us. {@PMO India@} , {@Ministry of Health@} , In our country, there are millions of homeless people wandering without food and basic facilities. #COVID__19 #lockdown #Economy #Nature #lockdowneffect #poor #marginalized #BasicNeeds {@pa ranjith@} {{URL}} ",COVID__19 lockdown Economy Nature lockdowneffect poor marginalized BasicNeeds
Two hurricanes are expected to enter the Gulf of Mexico early next week. Here’s {@Trevor Birchett@} with the latest on what we can expect. We’ll really need to watch #Marco and #Laura closely & stay weather aware. #mswx #alwx #WCBI {{URL}},Marco Laura mswx alwx WCBI
United Nations: Have a serious discussion of climate change on Earth. {@PA House Republicans@} : Set up new bureaucracy to repeal rules protecting the environment. Won t keep that majority for long with bad ideas like #HB1055. Get serious. #Plan4PA,HB1055 Plan4PA
" It was very shocking because we saw a lot of dead bodies... I saw my neighbour dead. His body had been shot by five bullets. We found him, took his body to his house  He s an old man. ~[age] 50.   #AxumMassacre #TigrayGenocide {@United Nations@} {@Human Rights Watch@} {@Vice President Kamala Harris@} {{USERNAME}} {{URL}} ",AxumMassacre TigrayGenocide
#EMBARRASSED   I spoke with a friend from Canad for well over an hour today.   I mentioned how embarrassed I am at #TrumpTaxReturns and she said she hoped Americans know they are embarrassed for us and are rooting for us to vote him AND REPUBLICANS out of office. They blame {@GOP@} !,EMBARRASSED TrumpTaxReturns
Chinese human rights defender Wang Quanzhang says he cut all emotional ties with his family so he could survive in prison {{URL}} via {@South China Morning Post@} #china #HumanRights,china HumanRights
{{URL}} {@Justice Department@} {@President Biden@} {@Vice President Kamala Harris@} {@Sen Debbie Stabenow@} {@Senator Gary Peters@} PLEASE INTERVENE in Minnesota. The police are brutalizing the citizens!!! #PoliceReformNow #BrooklynCenter #BrooklynCenterMN #EnoughIsEnough,PoliceReformNow BrooklynCenter BrooklynCenterMN EnoughIsEnough
"Happy #InternationalWomensDay to all the fabulous women out there! We’re so lucky to get to help showcase so many amazing women in the nerd community! {{USERNAME}} , {{USERNAME}} , {{USERNAME}} and The Lady Nerd are all so amazing and we have many more to come!",InternationalWomensDay
#PresidentDonaldTrump:  We re very close to completing a plan to open our country.   Read the full story on our app at the link in bio  Follow us for #WorldNews & more at: {{USERNAME}} Get our World News Pro App… {{URL}},PresidentDonaldTrump WorldNews
The fight against Covid-19 and climate change are a united battle {@Climate Reality@} {{USERNAME}} #LeadOnClimate {{URL}},LeadOnClimate
The world should know #Catalonia #Catalogne #Katalonien #Spanien #Spain #Espagne #EU #Europa #Europe {{URL}} {@dpa@} {{USERNAME}} {{USERNAME}} {@Agence France Presse@} {@Reuters@} {@EUobserver@} {@euronews@} {{USERNAME}} {@POLITICOEurope@} {@Die Nachrichten@} {{USERNAME}} {@WDR@} {@MDR@} {{USERNAME}} {{USERNAME}},Catalonia Catalogne Katalonien Spanien Spain Espagne EU Europa Europe
"#BREAKING {@San Diego Sheriff@} confirms {@Heartland Fire@} , {@CAL FIRE SAN DIEGO COUNTY FIRE@} and other agencies are at scene of a 20+ acre fire along I-8 near Crestwood Road in #Campo. At least one structure is threatened by the fire. The latest on {@NBC 7 San Diego@} at 7 #NBC7",BREAKING Campo NBC7
I keep hearing about Baylor Scott & White clinics sending huge out of network bills... this is exactly why we need Medicare For All and . {@Elizabeth Warren@} will lead that fight as President...the #BlueTsunami2020 will finally flip the Senate #UnrigTheSystem {{URL}},BlueTsunami2020 UnrigTheSystem
‼️PLEASE TAKE THE TIME TO VOTE FOR GOT7 ON MUBEAT UNDER MV OF THE YEAR CATEGORY. WE LOST OUR SPOT AND FELL TO THE SECOND PLACE‼️   #GOT7 {@GOT7@},GOT7
"Yes, The Supreme Court Non-Discrimination Decision Protect #Bisexual People Too {{URL}} via {@Teen Vogue@} ",Bisexual
"Zoom meetings aren’t end-to-end encrypted, despite misleading marketing {{URL}} by {@Micah@} , {@yell growler@} #Zoom",Zoom
#UFC250 {@Cody Garbrandt@} Got the cleanest Knockout That was a buzzer beater !!!,UFC250
10 of the scariest things Donald Trump has ever said {{URL}} via {@YouTube@} Anti-Trump? PLEASE VOTE #MakeAmericaUnitedAgain #vetsforscience #FTrumpS,MakeAmericaUnitedAgain vetsforscience FTrumpS
Hats off to the Denver Nuggets {@Denver Nuggets@} for playing Great NBA basketball through series. You have earned your respect & put the league on notice that you are a force to be reckoned with.  #respect,respect
"Around 800 people executed in #Axum home to ancient #OrthodoxChristian. “They started to kill people who were moving from church to home or home to home, simply because they were on the street.” #TigrayGenocide #EritreaOutOfTigray {@United Nations@} {@Department of State@} {@Human Rights Watch@} {{URL}} ",Axum OrthodoxChristian TigrayGenocide EritreaOutOfTigray
"Politics and #Penguins: The Fight to Save #Antarctica {{URL}} via {@Al Jazeera English@} #ClimateChange #conservation  After past attempts to create marine protected areas (#MPAs) in the pristine #Antarctic failed, a new hope might now be on the horizon.",Penguins Antarctica ClimateChange conservation MPAs Antarctic
"I just signed up for International SEL Day on March 27, 2020: Sign up today to showcase, promote, advocate for and support SEL in your community #SELDay {{USERNAME}} {{USERNAME}} {{URL}} ",SELDay
Election fraud. Early voter in Illinois says {@Tulsi Gabbard@} name was listed and boxed under  dropped out  {@Andrew Yang@} {{USERNAME}} {@Saagar Enjeti@} {@Van Jones@} {@FOX News Talk@} #YangGang {{URL}},YangGang
#ToryScum I stand with {@Angela Rayner@} and {@Andy Burnham@} in the fight against this corrupt child starving scum government,ToryScum
The ground of the Tigrayan village is soaked with blood and dozens of bodies lie strewn in the grass. Groans can be heard from a seriously wounded man squirming on the floor between two corpses.  #TigrayGenocide {@Amnesty International@} {@Human Rights Watch@} {@UN Human Rights@} {{URL}},TigrayGenocide
Check out this awesome  Social Distancing Around The World Six Feet Apart Graphic  design on {@teepublic@} ! {{URL}} #SocialDistancing #graphictee #graphicdesign #tshirt,SocialDistancing graphictee graphicdesign tshirt
A rich guy telling us we can t afford to help the poor. Tell him to give back the {@GOP@} #TaxScam. #Hypocrite {{URL}},TaxScam Hypocrite
gap is decreasing :/ ENGENEs please vote to widen the gap but dont use all your votes and cash. we need to collect as much as possible to drop it on the last day of the votings. {@ENHYPEN@} #ENHYPEN #ENGENE,ENHYPEN ENGENE
The Jesse Lee Peterson Show:  GIOYC Friday!; Mr. President... Do You Know What Juneteenth Means?  6/12/20 (part 1 of 2) {@Jesse Lee Peterson@} {{URL}} #Amazing {{URL}},Amazing
So {@NFL@} we not gonna support breast cancer awareness this year ?  #BCA,BCA
"I’m so sad {@Elizabeth Warren@} has dropped out of the race. You were my President. Thank you for all that you’ve done and the conversations you’ve had that have elevated the field. You are a fighter, and I appreciate your passion and drive. #MyPresident",MyPresident
" It was very shocking because we saw a lot of dead bodies... I saw my neighbour dead. His body had been shot by five bullets. We found him, took his body to his house … He s an old man.[age] 50.   #AxumMassacre #TigrayGenocide {@United Nations@} {@Human Rights Watch@} {@Vice President Kamala Harris@} {@President Biden@} ACT NOW! {{URL}} ",AxumMassacre TigrayGenocide
May the death and resurrection of Jesus christ bring forgiveness and healing to our land. {@I am listening to Magixx@} {@World Health Organization WHO@} {@President Biden@} {@Nigeria@} #Covid_19,Covid_19
Please sign this petition to help stop our precious trees being felled!  #TreesForLife {{URL}} via {{USERNAME}},TreesForLife
The reform of the security sector is a critical component in reducing conflict which #Ethiopia managed to do so but US seems to oppose reality to stick with lobbyists that are paid to lie about the reality on the ground! #Stand4EthiopianUnity #USAstopInterfering {@Josep Borrell Fontelles@},Ethiopia Stand4EthiopianUnity USAstopInterfering
"#Trump#Biden  The difference between four more years of Trump and four years of Biden is everything, and their approaches to their speeches almost perfectly demonstrated that.  {@Frank Bruni@} ",Trump Biden
I ve just signed Plantlife s ( {@Plantlife@} ) petition to my council to help save and protect wildlife on our road verges. Please sign and share to show you care! #RoadVerges {{URL}},RoadVerges
"“If your not going to put up a guardrail to protect the drivers, don’t doubt their stories about what they see in there.” Hilarious {@Dale Earnhardt Jr@} #LostSpeedways",LostSpeedways
$0.21 cents. Sorry. Gas fees are high  {{URL}} #Rarible #Ethereum #ERC721 #Collectible #NFT via {{USERNAME}},Rarible Ethereum ERC721 Collectible NFT
"#GiulioRegeni   #veritapergiulioregeni  The Regeni family says they are  distressed  by the arrest in Egypt  by Dr. Ahmed Abdallah, president of the board of directors of the Egyptian Commission for Rights and Freedoms {{URL}} via {@Repubblica@} ",GiulioRegeni veritapergiulioregeni
{@Keisha Lance Bottoms@} great job in reigning things in tonight and great job {@Governor Brian P Kemp@} for providing the support. Glad #Atlanta isn’t in the news tonight,Atlanta
"City Xtra |  This Isn’t Us, I’m not proud!  - Journalist Reveals Moment Which Nearly Ended Pep Guardiola s Man City Career #mcfc {{URL}} ​` {@City Xtra@} | {{USERNAME}} | {{USERNAME}} `",mcfc
manchester is red  {@Manchester United@} #MUNMCI  #InternationalWomensDay  #CHEEVE,MUNMCI InternationalWomensDay CHEEVE
"The police were trying to scare people that section 144 had been imposed in #Aarey and didn’t let the protestors chant slogans today {{USERNAME}} {{USERNAME}} {{USERNAME}} but we are mumbaikars, stubborn as usual to save aarey.. we didn’t stop #SaveAareyForest",Aarey SaveAareyForest
"Live debate by {@Christopher C Cuomo@} & {@Don Lemon@} about the fake news & partisan stand by #FoxNews and some other channels. Absolute eye opener. But here in #India our journalist who have partisan stand r honored. {@ravish kumar@} , {@Rana Ayyub@} , {@Sanket Upadhyay@} , {@Betwa Sharma@} , {@Saba Naqvi@} , {@Arfa Khanum Sherwani@} ",FoxNews India
"I don’t want {{USERNAME}} to die from #COVID19.  Because he shouldn’t be dying in a comfortable, secure hospital bed, he should be dying in jail.  Fix him up, bring him home, vote him out, lock him up, throw away the key.  Much better.  #TrumpHasCovid",COVID19 TrumpHasCovid
"Come chill out with {{USERNAME}} and be sure to subscribe, smash the like and turn on the bell so you don t miss anything. Follow him on twitter too so you see when he s going live #teamTAG {{URL}} ",teamTAG
Bill Gates-Funded Company Released Genetically Modified Mosquitoes in United States for the First Time {{URL}} via {{USERNAME}} >He also wants to dim the Sun. He s scaring me. #BillGates,BillGates
CNN&#8217;s Don Lemon Compares Trump Supporters to Addicts Who &#8216;Have To Hit Rock Bottom&#8217; via {@The Western Journal@} {{URL}},8217 8216 8217
stay safe everyone  wag patangay hehe <3  I followed {@96 5 TDY@} and I vote #LISA for #BiggestCrush at #TDYAwards {@BLACKPINKOFFICIAL@},LISA BiggestCrush TDYAwards
"Attention all four legged rebels! Please sign this petition to open a dog park in Cork City! It s a sorely needed amenity in the city, one that could be a great benefit to hounds everywhere! Please sign and share! #corkcity #cork #dogs #pets {{URL}} via {@Change org@} ",corkcity cork dogs pets
"The latest The Darkweb, Deepweb, and other Netherwolds of the Internet Daily Newz! {{URL}} Thanks to {{USERNAME}} {{USERNAME}} #bnb #fiat",bnb fiat
Democrats $1400 Stimulus Checks To Be Garnished For Unpaid Debt Because ... {{URL}} via {@YouTube@} #dummycrats,dummycrats
"The TSA wants to hire 6,000 new airport security officers by the summer #jobs #tsahiring {{URL}} via {@CNN Travel@} ",jobs tsahiring
sad {{USERNAME}} doesn t play by the rules of law - PLEASE VOTE #democracy #election #fair #republican {{URL}},democracy election fair republican
"Despite #Diab’s Assurances, the Boat Is Still Sinking  While the government of #Lebanon  has handled the #coronavirus crisis well, civil society representatives strongly criticize its 100-day performance. By #AcilTabbara {{URL}} {{USERNAME}} ",Diab Lebanon coronavirus AcilTabbara
