text,tags
"#Marr {@Ed Miliband@} explaining it clearly. There is NOTHING wrong with maintaining standards to achieve a deal. It s not  surrendering . Hopefully our {{USERNAME}} of-no-standards does the same thing if we get a deal for chicken with the US. Chlorinated, anyone? Standards.",Marr
" It was very shocking because we saw a lot of dead bodies...I saw my neighbour dead. His body had been shot by five bullets.We found him, took his body to his house … He s an old man. ~[age] 50.  #AxumMassacre #TigrayGenocide {@United Nations@} {@Human Rights Watch@} {@Vice President Kamala Harris@} {@President Biden@} ACT NOW! {{URL}} ",AxumMassacre TigrayGenocide
"Anybody else watching The Laura Kuenssberg Show this morning on {@BBC@} ? With her guest, Comrade Andrew Marr. #DefundTheBBC",DefundTheBBC
Why do we even have laws like #Sedition and #Treason if we do not charge those who have committed it? {@Nancy Pelosi@} and {@Chuck Schumer@} Should be subpoenaed and tried for #sedition. They knowingly used our system to attempt to oust our President on false charges. {@U S OGE@},Sedition Treason sedition
" {{USERNAME}} most hilarious part of the show was that Kejriwal is giving freebies from the amount he collected after he totally stopped corruption from Delhi. Really ????? This is so absurd, how smartly he makes fool of the people #AapKiAdalat Rgds Newsshakes",AapKiAdalat
A dose of good old #WhitePrivilege anyone? Ted Cruz s wife Heidi soaks up the sun in Cancun without the senator {{URL}} via {@Daily Mail Online@},WhitePrivilege
"Rebecca Pow asked a good question about the financial sustainability of peat restoration in {{USERNAME}} event. Tourism is definitely one angle, as is ELM - but {@National Trust@} & {@Green Alliance@} research also showed the power of private markets {{URL}} #CPC20",CPC20
"PHIXOs, 2DAYS TO GO BEFORE  THE 1ST YR SINCE WE BOUGHT OUR TICKETS FOR #EXPLORATIONINMANILA AND YEA. THAT WAS AN INTENSE BATTLE LMAO! #TEAMEASTWOOD I MISS Y ALL! {@EXO@} ",EXPLORATIONINMANILA TEAMEASTWOOD
12 people died due to #Lightning {@Nitish Kumar@} announced to give four lakh to the family of the dead.,Lightning
#BJPkilledPSUs  #StopPrivatisation We have hope with all the media channels.Raise the voice before collapses. Need help of all. It s not the fight against government it s a fight for rights. Hope we are together. {@AajTak@} {@Rajat Sharma@} {@Zee News@} {@NDTV@} {{USERNAME}} {@Hindustan Times@} {@ABP News@},BJPkilledPSUs StopPrivatisation
"Climate change, access to care, periods – what do they have in common? Women. On Monday, I’m joining #GoalsHouse to share why putting women first is changing #healthforall with {{USERNAME}} for {@The Global Goals@} .",GoalsHouse healthforall
#Save21LakhAdarshParivar {@Ashok Gehlot@} {{USERNAME}} Remove Liquidator from Adarsh Credit Cooperative Society Central Government not taking any measures to Justice poor innocent depositors also we represented so many times in so many ways. SO KINDLY YOU ONLY JUSTICE DEPOSITORS,Save21LakhAdarshParivar
" This state has shown a willingness to lead on clean and renewable energy. We can t stop now,  writes {{USERNAME}} in editorial calling on lawmakers to make #CEJA part of veto session agenda. {{URL}} ",CEJA
. {@BBC Politics@} Japan hit the #Brexit nail on the head: {{URL}} {{USERNAME}} talks so much sense but once again a BBC correspondent stops anyone putting intelligence into the  no deal  impact debate,Brexit
"The HQ library branch {{USERNAME}} got a landscape make-over in the front … good job getting rid of the #cactus island … fresh, restrained, open look is better … here in #Naples in #SWFlorida … {{URL}} ",cactus Naples SWFlorida
NEWS: The lightning clock has been lifted {@Daytona International Speedway@} . Time to start the track-drying efforts.  #NASCAR | #Daytona500,NASCAR Daytona500
"Next weekend Virtual Black Pride brought to you by Tri-State Black Pride! {{USERNAME}} #tristateblackpride #blackpride #midsouthpride #Memphispride #teammemphisprides #virtualpride @ Memphis, Tennessee {{URL}} ",tristateblackpride blackpride midsouthpride Memphispride teammemphisprides virtualpride
16 years later; Congrats soon to be 51 year old {@Phil Mickelson@} {@PGA Championship@} ⛳️‍♂️ #koreangolfnews #pgachampionship #golf #instagolf #golfing #media #korea  via PGA @ PGA Championship {{URL}},koreangolfnews pgachampionship golf instagolf golfing media korea
"Dear {@Archive Governor Andrew Cuomo@} , NYers have been camped out in the heat waiting for you to answer calls to have a conversation about your plans to cut down our trees, pave over our grass & reduce the grass space our kids use to play #pausethesaws {@Chuck Schumer@} {{USERNAME}} {@Rep Nadler@} ",pausethesaws
Unlocking the power of Scotland s rural areas with 5G - {{URL}} #5G  CC: {{USERNAME}} {{URL}},5G
I voted #TheBrainEvilGenius on {@The Tylt@} —because he s been practicing how to take over the world for a while now. {{URL}},TheBrainEvilGenius
I stand with {{USERNAME}} in the fight to #UnscreenOurSchools and I choose to prioritize #StudentVoiceOverParentFear. Which side are you on? {{USERNAME}} {@Mayor Bill de Blasio@} {{USERNAME}} {{URL}},UnscreenOurSchools StudentVoiceOverParentFear
Lowest level of {@TIME@} magazine can be seen from the fact that it goes with all those who create trouble in India. Is this not cheap journalism? Earlier an old lady whom no Indian knows & now #ChandrashekharRavan On its cover page shows how it works purely for money #Soldoutmedia,ChandrashekharRavan Soldoutmedia
End clampdown: Kashmir media. Communications blockade that has been in place for over 50 days has hampered the work of Kashmiri journalists.  #StandWithKashmir #KashmirIssue {@Iceland at UN@} {{USERNAME}} #StandForKashmir #KashmirBleedsUNSleeps {{URL}},StandWithKashmir KashmirIssue StandForKashmir KashmirBleedsUNSleeps
JP Sottile on Empire and Climate change & Jon Gold on Bill Barr and 9/11 justice  by {{USERNAME}} via #spreaker {{URL}},spreaker
"#TigrayGenocide is real. It is ongoing. People of #Tigray have been cut off from the world for over 2 months. Left to starve and die in the dark. All under {@Abiy Ahmed Ali@} . Allow humanitarian access, open banks, and stop killing civilians. #UNSC {@UNHCR the UN Refugee Agency@} {@United Nations@} ",TigrayGenocide Tigray UNSC
Greta Thunberg - Inspiring Others to Take a Stand Against Climate Change... {{URL}} via {@YouTube@} #GretaThurnberg,GretaThurnberg
"Closing borders for every problem is trump s way. He had no testing and rushed Americans back from Europe in a way that spread #covid {@Joni Ernst@} thinks {@Gov Kim Reynolds@} and trump and {@Iowa GOP@} have handled #covid well but over 135,000 dead since March and people are #angry & #scared",covid covid angry scared
Looks like {@Adam Miller@} & the #3News crew have been busy . . . Congratulations to the entire {@WKYC 3News@} team! {{URL}},3News
"The queen is on instablog again, queen of content   #VoiceOfTachaSymply Tacha is the voice to the voiceless {@TACHA@} OUR ACTIVIST TACHA OUR ACTIVIST TACHA OUR ACTIVIST TACHA OUR ACTIVIST TACHA #VoiceOfTacha",VoiceOfTachaSymply VoiceOfTacha
Vote Him Out! : Protesters Boo Trump During Visit To Ruth Bader Ginsbur... {{URL}} via {@YouTube@} #RuthBaderGinsburg #VoteHimOut2020 #VoteTrumpOut #VoteBidenHarrisToSaveAmerica #VoteBidenHarris2020 #VoteBlueToSaveOurDemocracy,RuthBaderGinsburg VoteHimOut2020 VoteTrumpOut VoteBidenHarrisToSaveAmerica VoteBidenHarris2020 VoteBlueToSaveOurDemocracy
Ted Cruz epic fail. His state is destroyed. Impeach this loser!  #texaswinterstorm #TexasFreeze #texassnow #TexasIsClosed #TedCruzIsATraitor {@Ted Cruz@} #failure #Republicans {{URL}},texaswinterstorm TexasFreeze texassnow TexasIsClosed TedCruzIsATraitor failure Republicans
DC Mayor {@Muriel Bowser@} Accuses Trump Of  Hiding Behind His Fence  From  Peaceful Protesters  {{URL}}  peaceful  MY A$$! #RadicalIdiot,RadicalIdiot
Coast Guard conducts overflight of areas affected by Hurricane Delta {{URL}} {@U S Coast Guard@} {@U S Coast Guard@} #HurricanDelta,HurricanDelta
Middle Eastern nations are scrambling to decipher the meaning of President-elect Joe Biden’s victory over President Donald Trump. #PresidentElect #JoeBiden {{URL}} via {{USERNAME}},PresidentElect JoeBiden
A Special Place In Hell by Reid Henry {{URL}} #NowPlaying   Check out this AMAZING new release by {@Reid Henry@} !! Go give him the support he deserves! <3,NowPlaying
United States trends  follow {{USERNAME}} for insight (Top 10) Alex Smith Mark Meadows #USPSProtests #LGBTQIAofTwitter #SundayThoughts #VoteRed2020 #TheChi Skyward Sword Waffle House Bay Area  View Google searches trend insight   {{URL}},USPSProtests LGBTQIAofTwitter SundayThoughts VoteRed2020 TheChi
". {{USERNAME}} :  The new conventional wisdom should be that the president who betrays his country is a one-term, twice-humiliated pariah-in-the-making, who is also, without presidential immunity, facing the prospect of financial ruin.  {{URL}} #UnitedStates #Trump",UnitedStates Trump
"Please Linus Kikai, you are so much uninformed about the impeachment of President Trump. Stick to Kirinyaga and stop embarrassing yourself on things you have limited knowledge of #NewsGang {@Citizen TV Kenya@} ",NewsGang
"PM {@Narendra Modi@} : Today if there is one story which reverberates throughout the country it is the story of cleanliness. Every person, family, village wants to tell their  experiences about cleanliness effort. This movement for cleanliness is driven by 125 cr Indians   #MannKiBaat",MannKiBaat
"#Australia {@ipbes@} World s oceans at a tipping point, indicates UN s Intergovernmental Panel on Climate Change report {{URL}} via {@ABC News@} ",Australia
“Super Straight” (kill me) is now up on {{USERNAME}} !!   #superstraightphobicandproud  #superstraights {{URL}},superstraightphobicandproud superstraights
"The price of choice – the fight over #abortion in Poland, by {{USERNAME}} {{URL}} via {@The Guardian@} #ReproRights",abortion ReproRights
"‍ You already voted once to defend Black Lives, #DefundSPD and reinvest in community. Can we count on you to hold the line and override the Mayor’s veto on Tuesday? {{USERNAME}} , {{USERNAME}} , {@Kshama Sawant@} , {{USERNAME}} , {{USERNAME}} , {{USERNAME}} , {{USERNAME}} , {{USERNAME}} ",DefundSPD
"I d like to thank {@FoxNewsSunday@} & #ChrisWallace for the outstanding example they set for social distancing this morning. Side-by-side, 5 or 6 people passing papers to each other. Show us how it s done! #smh",ChrisWallace smh
"EXOL, be ready to send your congratulation messages to our Yixing!    #/HoneyLAYDay   11pm china time / 12am kst {@Lay Zhang@} {@EXO@} {@Lay Zhang@} #LAY {@EXO@} ",LAY
⛰️Survey: Adventure travelers expected to resume near pre-COVID level travel spending in 2021. {{URL}} {{USERNAME}} #GroupTour #AdventureTravel,GroupTour AdventureTravel
#changeiscomming  The filthy fossil fuel industry in Alberta will never recover. Change is long overdue. The fight to end it will never stop it until Pm Trudeau stops it and follows the Paris Accord! {@Greta Thunberg@},changeiscomming
#CrookedLyingRacist Comrade {{USERNAME}} in 2011: A president could start a war with Iran for political survival.... {{URL}},CrookedLyingRacist
Spreading generosity this festive season and giving back to orphaned and vulnerable children in South Africa. A great initiative with {{USERNAME}} in partnership with {@ToysRUs@} .SouthAfrica. #GlassAndAHalf #GenerosiTrees {{URL}},GlassAndAHalf GenerosiTrees
"Switched on the TV for {@Sky News@} at 6pm, and apparently there wasn t any news, just an extended sports report. Nothing at all happened today??? Amazing! #News #NoNews",News NoNews
Woman Gets Chased Down By Trump Supporters & Bear Maced Over BLM Flag On Her Car! - {{URL}} via {@WORLDSTARHIPHOP@} #WSHH #WORLDSTAR,WSHH WORLDSTAR
Carbonomics  The amount of capital that has and will continue to be deployed into the #Carbonomics Sector is mind boggling. It’s in the hundreds of billions and will reach the trillions {{URL}} #carboncredits #carbon #esg #energy #oil {{USERNAME}} {@Marin Katusa@},Carbonomics carboncredits carbon esg energy oil
38  {@Wissam Ben Yedder@} sends a shot into the ground that bounces up off the crossbar.   #ASMSDR 0️⃣-2️⃣,ASMSDR
Stay safe everyone.  GOD BLESS US! {@SB19 Official@} #SB19,SB19
I wish people would stop watching Fox News. They helped to create this false narrative against climate change. What they are doing jeopardizes all of our lives. #Extinction  #ClimateCrisis #ClimateStrike {{URL}} via {@The Daily Beast@},Extinction ClimateCrisis ClimateStrike
Some food for thought ... #China Censors the Internet. So Why Doesn’t #Russia? {{URL}} {@Anton Troianovski@} {@The New York Times@},China Russia
Black lives matter means ALL black lives #BlackLivesMatter  Boris Johnson: more protection for Black Trans Women UK {{URL}} via {@Change org UK@},BlackLivesMatter
"Dear RailMinister Mr.Piyush Goyal And Ministry Of Railway. Sir we all apprentice are double skilled. And at this serious time, you should give an opportunity to us to serve our Rail And Nation. Rail is our family. #सेवा_का_मौका_दे {@Piyush Goyal@} {@Radha Mohan Singh@} {{USERNAME}} {@ANI@} ",स
"#SundayThoughts.   #BenTurok, who died at 92, on December 9th, was committed to fighting for the ideals of the left in South Africa. {{USERNAME}} and {{USERNAME}} of {{USERNAME}} (which Ben founded) reviews his contribution these ideas in his last years. {{URL}} ",SundayThoughts BenTurok
#Afghanistan There was never a war to be one. Afghanistan was just a stage setting. We was never at war with the country. Just faces behind screens & photos. The US believed to be in said nation. {@Rosie Duffield MP@} {@The Labour Party@} #skypapers,Afghanistan skypapers
#JoeBiden is complaining about Trump supporters blowing their horns saying  we are better than treating each other like this.  That s what we were thinking during the #Kavanaugh hearings and #RussiaHoax. #Democrats can dish it out but can t handle it. #Hypocrites {@Fox News@},JoeBiden Kavanaugh RussiaHoax Democrats Hypocrites
"A winter storm is set to bring significant snow to the region, with the first round arriving tonight. {@Gabe Prough@} has what you need to know below: #INwx #OHwx {{URL}} ",INwx OHwx
"#UFC252 Co main event! #omalleyVvera the suga show {@Sean O Malley@} is so good, intelligent and focused! Vera is good, but the hype on suga is deserved, suga wins inside the distance {@UFC@} ",UFC252 omalleyVvera
I guess it follows that President Trump didn t know that #Finland has the best education system in the world. Or that it s the most  wired  country in the world. {{URL}} via {@World Economic Forum@},Finland
The US gave {@World Health Organization WHO@} 400 million dollars last year?! ‍♂️ Jesus Christ. How are some Americans still poor #Covid_19,Covid_19
Trump Supporters Rioting Outside Election Offices Across America {{URL}} via {@YouTube@} #CountTheVote #EveryVoteCounts #AmericaHasSpoken #Democracy,CountTheVote EveryVoteCounts AmericaHasSpoken Democracy
Happy New Year s Eve 2020! #GoogleDoodle {{URL}} via {@Google Doodles@},GoogleDoodle
Kristi Noem  Gnome  on {@Face The Nation@} proving once again why she should never get anywhere near the White House. #KristiNoem,KristiNoem
"Please help my parents get home, they are stranded on the #OceanAtlantic {@Scott Morrison@} {@Marise Payne@} they were told by Chimu Adventures their charter flights were confirmed and now they re asking for more money & saying it s not happening!!",OceanAtlantic
The current issue of #TLPProtest is a mere case of incompetence. There was no need for {@Imran Khan@} {@Prime Minister s Office Pakistan@} {@Usman Buzdar@} {@Sheikh Rashid Ahmed@} & {@PTI@} {{USERNAME}} govt to arrest #SaadHussainRizvi #SaadRizvi in the first place. It was simply an act of provocation against them,TLPProtest SaadHussainRizvi SaadRizvi
Jerry Nadler: Climate Change Is a Greater Threat than a World War {{URL}} {{USERNAME}} #AAG,AAG
#RamlilaMaidan #CAA_NRC_support  We support {@Narendra Modi@} . becoz we love our country..,RamlilaMaidan CAA_NRC_support
Trump Supporters Rioting Outside Election Offices Across America {{URL}} via {@YouTube@} #Fking Trump on TV telling them it was happening! He is causing it . #Trump lost the Popular vote Again and stands to lose it all . Vile and  Evil !,Fking Trump
. {{USERNAME}} thoughts on the first night of the DNC? #APlovgov,APlovgov
#Eu I commend you for making decision with longterm benefits for the horn based on realities on the ground #Tigray #eritrea #ethiopia {@Pekka Haavisto@} {@Josep Borrell Fontelles@} {@Jutta Urpilainen@} {{USERNAME}} {@European External Action Service EEAS@} {@EU Council@} #TigrayGenocide #EUengageEritrea #EritreanTroopsOutofTigray,Eu Tigray eritrea ethiopia TigrayGenocide EUengageEritrea EritreanTroopsOutofTigray
"Take away thus far through the prelims {@michael@} has really found his comfort zone calling fights! He is in rare form this evening, ready for the main card. #UFCFightIsland #UFC251",UFCFightIsland UFC251
The latest The Dawn Bell Journal! {{URL}} Thanks to {@MaRS@} {@STAT@} {{USERNAME}} #biotech #hr,biotech hr
"I m up next on {@TRT World@} . Our special coverage of #SyrianRegime attacks in #Idlib continues with {{USERNAME}} {@Rahul Radhakrishnan@} {{USERNAME}} {@Mehmet Solmaz@} & {@Oubai Shahbandar@} . Plus, the latest on #COVID19 as it continues to spread. {{USERNAME}} is live in #HongKong. Watch from 10GMT",SyrianRegime Idlib COVID19 HongKong
Check out CANCEL WHITE PRIVILEGE! Available for the next 1 day via {{USERNAME}} {{URL}} #racism  #whiteprivilege,racism whiteprivilege
99/100 people made it into the top 100 for #FaZe5 I have been waiting so long and been anxiously refreshing {@FaZe Clan@} twitter. I have been grinding for 3+ years. Please help me reach my dream. Thanks and good luck to everyone. Hopefully I wake up to the news that I made it!,FaZe5
"Our department, in coordination with {@Tennessee Bureau of Investigation@} and local law enforcement, will launch an investigation into the incidents of violence in downtown #Nashville last night.  More: {{URL}} ",Nashville
Excited to hear speak at the {{USERNAME}} Network for the Advancement of Black Communities (NABC)  Advancing the Fight Against Anti-Black Racism  Conference today. #AntiBlackRacism ❤️DRG,AntiBlackRacism
"#Insiders {@David Crowe@} People on #Jobseeker are way better off going on to minimum wage, so there s no disincentive to getting a job even on the current rates. Absolutely true! From the end of this month we ll be living below the poverty line again too. #auspol #keeptherate",Insiders Jobseeker auspol keeptherate
"#BlackAmerica/#America {@Danny Glover@} ask {@Bernie Sanders@} why is he so concerned about an individual that is a communist in a Brazil prison,when you should be concerned about school shooting,gun control,and police killing unarmed black Americans,unless you’re a communist",BlackAmerica America
A surgeon in Akola operates for free to Army personals and their families citing #AkshayKumar as his source of inspiration An inspiration to millions - The King {@Akshay Kumar@},AkshayKumar
So indeed there WAS #ELECTIONFRAUD.  By Trump supporters...  The Daily Beast: Armed Virginia Men Wanted to Deliver Fake Ballots to Philly: Prosecutors. {{URL}} via {@Google News@},ELECTIONFRAUD
The latest The United States Daily! {{URL}} {{USERNAME}} {{USERNAME}} {{USERNAME}} #million #belgium,million belgium
Stay informed. Follow these accounts for critical information and updates throughout the day as Tropical Storm Cristobal makes landfall in Louisiana.   ⬇️⬇️⬇️  ️ {@NWS New Orleans@} ⚠️ {@Louisiana GOHSEP@}  {{USERNAME}} ️ {@NWS Shreveport@}  {{USERNAME}}  {@National Hurricane Center@}  {@LA State Police@} #lagov #lawx,lagov lawx
Remember when it was often said that  America is a country where anyone can grow up to be President . They left out  except {{USERNAME}}   The hypocrisy and intolerance of today s lib s is astounding! #VoteDemsOut2020,VoteDemsOut2020
"Puerto Rico hit by another earthquake - CNN {{URL}} #PuertoRicoEarthquakes Heartbroken for my family, friends, our diaspora, and island. {{USERNAME}} ",PuertoRicoEarthquakes
Live updates: Flash flood warnings issued as Tropical Storm Cristobal takes aim at La. shore. {@Sun Herald@} #readlocal {{URL}},readlocal
VOTING FYI --- Your candidate dropped out? Or you voted absentee? Check with your County office.  Some Michigan residents can vote twice  #OneVoice1 #OVElections #wtpTEAM {{URL}} via {@NBC News@},OneVoice1 OVElections wtpTEAM
"Some folks are asking so what if Ted Cruz went on vacation. Here s my answer: If ordinary Texans can step up & help out their neighbors, anyone who is in a position to do the same should do so. {@Beto O Rourke@} is doing it, as is {@Sheila Jackson Lee@} .  #CancunCruz {{URL}} ",CancunCruz
() Koeman’s arrival has not altered priorities — Lautaro Martinez is still Number 1 on the list. The club is planning to making a new attempt for him as early as September. It is time for the Lautaro Martinez operation to return to the front line. {{USERNAME}} #FCB ⚡️,FCB
“Ah Donald will just give it too the Mexicans for free.” We know your swagg Mr. President. #donaldtrump #conservative #representative #dontspeaksboutthe #borders #greyhound {{USERNAME}} #brothers,donaldtrump conservative representative dontspeaksboutthe borders greyhound brothers
“The French Island CFA believes Saturday’s blaze was started by a lightning strike on Wednesday. “It probably smouldered for two or three days until the wind swung around to the east...” #climateemergency {{URL}} via {@The Age@},climateemergency
Charge the cops who shot Jacob Blake - Sign the Petition! #blacklivesmatter #justiceforjacobblake {{URL}} via {@Change org@},blacklivesmatter justiceforjacobblake
"#waterman {@NWSC@} plz help me understand the problem in Namere, water comes once a week on Wednesday night/Thursday morning so those with tanks suffer all the time Kiki ddala ??",waterman
#JusticeForJacobBlake  Tony Evers: Charge the cops who shot Jacob Blake - Firma la petizione! {{URL}} via {@Change org Italia@},JusticeForJacobBlake
#SaveVibhor #SaveVibhor  #SaveVibhor   Why v r tending this..coz v want the freedom of truth: To be spoken out To be heard To be heard at large  This is the fight for Truth N Justice  #Justice4SSR n all othr victims {@HMO India@} {@PMO India@} {@Narendra Modi@},SaveVibhor SaveVibhor SaveVibhor Justice4SSR
"The second paper in the Applying Theories of Justice to Environmental Harms is about to begin. Titled  Violence, Transitions and (Invisible) Environmental Harms , the research by Dr Rachel Killean and Dr Lauren Dempster will be presented at 12:00 here - {{USERNAME}} #GreenCrime2021",GreenCrime2021
"BBC News - Judge blocks tell-all by #TraitorInChief {{USERNAME}} niece - for now (Yo {@GOP@} & {@President Biden@} , if you got NOTHING TO HIDE and everything is FAKE NEWS and the WORLD  silent majority  (sic) KNOWS it, why you SO SCARED??) PS: Taxes Please!! {{URL}} ",TraitorInChief
. {@Secretary Pompeo@} : Had a good discussion on developments in the Middle East with #Turkish Foreign Minister Cavusoglu today.,Turkish
"New Hampshire governor, {@Chris Sununu@} , keeps the state’s mask mandate to placate Massachusetts citizens. Chris, you serve the freedom loving people of New Hampshire not the communist state of Massachusetts. LIFT THE MASK MANDATE! #FireFauci",FireFauci
These supporters should have been stopped few days ago. What is needed in Nkandla is the SANDF. The police will not contain that situation by themselves. #Nkandla #SAToday_SABC {@SABC News@},Nkandla SAToday_SABC
Happy pride parade :) #NPP2020 #NepalPrideParade Queer Youth Group Nepal {{USERNAME}} {{URL}},NPP2020 NepalPrideParade
"#UCF head coach Gus Malzahn said the NCAA Transfer Portal has  changed the landscape  of recruiting in college football.   He would know. In the 34 days since arriving at UCF, Malzahn has landed commitments from six transfers. {{URL}} {{USERNAME}} ",UCF
I hope {@Donny van de Beek@} moves on and find a club that actually gives him the platform to perform. He is a quality player and Ole doesnt even know he is in the squad. The amount of chances Fred gets to screw things up is actually alarming. #ManUtd  #OleIn {@Manchester United@},ManUtd OleIn
"Please Stay At Home and Defeat COVID-19 When a family at Bangalore developed cold-fever & were scared, we arranged to get a doctor to visit their home through Police officials. If you know anyone needing help please let us know #SOSCorona {{USERNAME}} ",SOSCorona
"So you re marching, intimidating, threatening w/blm...do you even know what blm stands for?? blm has NOTHING to do w/ black lives  blm is ALL about marxism/communism, is that what you truly want?? {@President Biden@} is ALL ABOUT American lives, communities, jobs, #LawAndOrder, prosperity! 1",LawAndOrder
Remember that time the {@LA Clippers@} were determined to never make the conference finals? #Clippers #NBAPlayoffs #fail,Clippers NBAPlayoffs fail
Another example of the corrupt lengths which #Johnson s cronies will go to to stop ANY investigations - {{URL}} #Arcuri - remember also how {@Metropolitan Police@} stopped looking into #Brexit corruption??,Johnson Arcuri Brexit
Save Mother Nature Save world !!  Don t interfere matter of nature!  Also requesting close wuhan seafood market permanently {@World Health Organization WHO@} {@WTO@} {@United Nations@} {{USERNAME}} {@CIA@} It s 3rd time where virus killing from #wuhanmarket  Sufferings only humanity from this viruses!!,wuhanmarket
