text,tags
E no go beta for our  leaders  ooo.... And the {@Nigerian Army@} That we dey pity and support in the fight against boko haram has turn innocent citizens to targets.... Ahaaaaa this doesn t make sense.... {@Babajide Sanwo Olu@} Hide your face...  #EndSARS #Genocide #EndBadGoveranceInNigeria,EndSARS Genocide EndBadGoveranceInNigeria
" {{URL}} HIM Haileselassie at the League Of Nations in 1936, warning the world of upcoming WWII. #POTUS & racist #Blinken need to think twice before undue intervention in #Ethiopia s internal affairs. We ain t your run of the mill banana republic. {@James E Clyburn@} {@Vice President Kamala Harris@} ",POTUS Blinken Ethiopia
Stay safe everyone!   I followed {@96 5 TDY@} and I vote #LISA for #BiggestCrush at #TDYAwards {@BLACKPINKOFFICIAL@},LISA BiggestCrush TDYAwards
The latest Boston News and More on the Fly! {{URL}} Thanks to {{USERNAME}} #commencement2020 #food,commencement2020 food
. {@Lowes Foods@} Tonight I shopped in the Robinhood location. There were 2 people without masks. I spoke with each asking them to wear a mask. Why isn’t Lowe’s enforcing the mask policy? I will NOT return unless MASKS are MANDATORY. #MaskTheMug #MaskUp,MaskTheMug MaskUp
"The 10 that received warning letters are {@dTERRA Essential Oils USA@} , #PruvitVentures, {{USERNAME}} , #tranont, #Modere, {{USERNAME}} , #Arbonne #IDLife, #ItWorksMarketing, {@Rodan Fields HQ@} and  #Zurvita. You can read more in the FTC s press release. {{URL}} ",PruvitVentures tranont Modere Arbonne IDLife ItWorksMarketing Zurvita
"Dear {@Senator Joe Manchin@} and {@Kyrsten Sinema@} - Stop being Republican. They re not interested in helping Americans. They re interested in lining their own pockets. You claim to be Democrat. Start acting like it.  If you continue to obstruct, you re part of the problem. #VoteThemOut",VoteThemOut
The candidate running for President of the United States they don t want you to know about. His name is {@Andrew Yang@} Look him up. #SundayMorning #SundayThoughts #AndrewYang,SundayMorning SundayThoughts AndrewYang
Easter eggs a symbol of defiance for Myanmar protesters {{URL}} via {{USERNAME}} #MalayaBusinessInsight #MalayaOnline,MalayaBusinessInsight MalayaOnline
"Remember, following ABC s postgame coverage, the party continues at {@Major League Soccer@} . #MLSCup postgame w/ {@Ike Opara@} , {@Calen Carr@} , {@Matthew Doyle@} , myself and whole buncha folks on site!  Might be tough to watch if you re a {@Toronto FC@} supporter, but everyone else ought to have a good time.",MLSCup
Why hasn t the President hosted any other Leaders in other Regions? This is the second time he is hosting a regional meeting at Sagana Lodge. One of his failures. The President should be National. {{USERNAME}} {{USERNAME}} {@Jeff Koinange MBS@} #JKL {@Citizen TV Kenya@},JKL
"An important editorial by Stuart Stevens  Wake up, Republicans. Your party stands for all the wrong things now. - The Washington Post {{USERNAME}} Looking forward to reading your book #ItWasAllALie in May {{URL}} ",ItWasAllALie
"Public services - easy target for media.  #LFB didn’t build the tower block. Didn’t start the fire. Followed recommended best practice. Intimately involved with the loss of life. Besmirched for making a mistake in a desperate, rapidly changing emergency.  OTT response {@BBC News UK@} ",LFB
Wish this country would act this quickly with Mass Shootings and our Climate Change issues. #priorities {{URL}} via {@KING 5 News@},priorities
"Neda Amani,#Iranian Youth Assoc.#Switzerland.  #Iran has risen against the mullahs.We will continue to be the voice of our people&Resistance Units.We are raising our voices for #NavidAfkari&we will do everything we can to #SaveNavidAfkari life . {@Swiss MFA@} {{URL}} ",Iranian Switzerland Iran NavidAfkari SaveNavidAfkari
"Hi {@Ahmad Ibrahim Lawan@} {@Femi Gbajabiamila@} You have committed to probe crimes, #EndSARS and #EndPoliceBrutalityInNigeria. I am counting on you to fulfil your pledge — protect the human rights and dignity of all Nigerians and stand up for an equitable, inclusive and just society. #GlobalCitizen",EndSARS EndPoliceBrutalityInNigeria GlobalCitizen
Watch Kawhi (36 PTS in Game 5) warm up as his {@LA Clippers@} look to advance to their first-ever Western Conference Finals! #NBAPlayoffs   : LAC/DEN at 1 PM ET on ESPN  Music by {@UnitedMasters@} {{URL}},NBAPlayoffs
"#FriendshipDay Avatar on earth  Sant Rampal Ji Maharaj Ji is the only true saint as well as the greatest social reformer.He made a successful attempt to eradicate malpractices like corruption, dowry system from society.#Pvsindhu  -- {@Saint Rampal Ji Maharaj@} ",FriendshipDay Pvsindhu
" Climate change  all day, but not a peep on this!   Cue {@Ben Shapiro@}  s  Good Trump/Bad Trump . Definitely GOOD Trump!  Pastors praise Trump for skipping UN panel on  imaginary  climate crisis for  real  problem of religious persecution {{URL}} #FoxNews",FoxNews
The United States is Losing the battle against #COVIDー19   We are on the wrong side of it. Death records set daily in U.S. Over industrialized nations.   national mask requirement needed  Listen to the science  #FauciIsAHero {@Vice President Kamala Harris@} {@Alex Azar@},COVIDー19 FauciIsAHero
An Inspirational address by PM {@Narendra Modi@} on Climate Change. While US president {{USERNAME}} makes an unscheduled entry to the summit.  Proud moment for Indians. #HowdyModi {{URL}},HowdyModi
"Watching Olympics breakfast to catch up on what has happened overnight, like most people would. Watching the golf playoff with 7 players in contention. Low and behold {@BBC Sport@} {{USERNAME}} things its good idea to inform everyone at the bottom of the screen who won the golf. #getagrip",getagrip
"“I’m going to continue to fight right by your side. We will do what we’ve done from the beginning, which is to win. We’re not starting new parties.”  President Trump now {@CPAC 2022@} speaking of his role in the future of the Republican Party #CPAC2021 #Trump",CPAC2021 Trump
"Ok, who should I draw next from the #DarkOrder?   Twitter only allows 4 options in a poll so please comment below if you’d like to choose Boom Boom {@Colt Cabana@} !",DarkOrder
{@Jill Biden@} {@President Biden@} We love you and wish you a speedy recovery! Get well soon! #Trump2020NowMoreThanEver,Trump2020NowMoreThanEver
The greatest hindrance that we face as followers of Jesus is that we are either unwilling or lack the commitment to line up our words and actions with the faith we profess. {{USERNAME}} #ChangeYourMindset,ChangeYourMindset
"Red nation we owe it to {{USERNAME}} to pick up the flag and run with it while our leader is quarantined. Keep up the trump parades, the street rallies, continue the fight! {{USERNAME}} has been there for us. We need to be there for him #VoteRedToSaveAmerica #trump2020",VoteRedToSaveAmerica trump2020
"#DelhiFightsCorona {@CMO Delhi@} lady living in rajiv nagar is helpless and in search of groceries,she has no one in her family and a heart patient aswell so cant eat the served in the govt. Camps ,i request you please take it seriously. Number-8700400884, please help",DelhiFightsCorona
I voted for Warren early. Since she has dropped out come Nov. I ll vote for either Biden or Bernie.  #VoteBlueNoMatterWho   Getting {{USERNAME}} out is the bottom line.,VoteBlueNoMatterWho
"शिक्षक भर्ती  Honorable YOGIJI, Every year you conduct TET exam. Where is Super TET??? And how much we will mentally disturb. stop harashment us. This ego will not be right YOGIJI #yogijisoonassoonupprt {@Narendra Modi@} {@CM Office GoUP@} {@Yogi Adityanath@} {@Dr Satish Dwivedi@} {@Swatantra Dev Singh@} ",yogijisoonassoonupprt
Cuban families need a solution to the family reunification program. It is time to open the United States embassy in Cuba.  #USEmbassyHavforthePeople {@Mara Elvira Salazar@} {@MarcoRubioCuba@} {@Menendez for NJ@} {{USERNAME}} {@Rep Debbie Mucarsel Powell@} {@Mario Diaz Balart@} {@Albio Sires@},USEmbassyHavforthePeople
"Read this story. Just horrific. Be informed of what s happening. Work to end violence against Black trans women. #BlackLivesMatter #BlackTransLivesMatters Black trans woman, Dominique Rem’mie Fells, found dead {{URL}} via {{USERNAME}} Gay News",BlackLivesMatter BlackTransLivesMatters
"The heat islands are a recurring phenomenon of climate change. How to fight against them? Discover the solution proposed by {{USERNAME}} and {@VINCI Autoroutes@} , winner of the infrastructure award #GreenSolutions Awards #ClimateChange #ClimateAction #UNGA {{URL}} ",GreenSolutions ClimateChange ClimateAction UNGA
Climate change: We re in the midst of the hottest five years ever recorded #Next60Africa #NMGat60 #KusiIdeasFestival  @dailynation {@Nation Media Group@} {{URL}},Next60Africa NMGat60 KusiIdeasFestival
"#GSTAmnesty what is the problem of govt.? Small taxpayers are Indian please give him relief of late fees, Hon. Fin. Min. Please extend due date GST amnesty scheme upto 31st Dec. 2020. Capping 500/- late fees. {@NSitharamanOffice@} {@Narendra Modi@} {@CBIC@} ",GSTAmnesty
Celebrating thr birth anniversary of one the greatest pratihar Rajput king Mihir Bhoj who played an important role in protecting bharat fr Arab invaders in North  #RajputSamratMihirbhojPratihar #RajputSamratMihirbhojPratihar  #RajputSamratMihirbhojPratihar {{USERNAME}},RajputSamratMihirbhojPratihar RajputSamratMihirbhojPratihar RajputSamratMihirbhojPratihar
#IndvsSA: Heavy downpour in Dharamsala ahead of first T20 {{URL}} via {@The Tribune@},IndvsSA
"Another Con Artist using tax free church* for money laundering /evil brainwashing !?  #TaxChurches  Stella Immanuel has run the Fire Power Ministries in Houston, Texas, since 2002 {{URL}} via {@Daily Mail Online@} ",TaxChurches
Trump went to UFC 244 in New York City and was promptly booed out of the building when he was introduced to the crowd. #TrumpBooedAgain {{URL}} via {{USERNAME}},TrumpBooedAgain
Troup County becomes home to the first solar road in the United States #wrblwx #gawx #solar ##solarpower #renewableenergy #solarenergy #cleanenergy {@Bob Jeswald WRBL@} {@Nicole Phillips@} {{URL}},wrblwx gawx solar solarpower renewableenergy solarenergy cleanenergy
"Happy Pride Month to all! We celebrate in partnership with {@Outfest@} on #UnitedinPride,which includes a showcase of  #ProjectInvolve shorts. ️‍  Learn + watch more #ontheblog: {{URL}} ",UnitedinPride ProjectInvolve ontheblog
Follow me to raise the voice of student  @iAbhaySingh356  #5Baje5Minute  #UPSSSCमेंसुधारचाहिए  #69000शिक्षकभर्तीन्यायदो #abhinaysharma #69000_शिक्षक_भर्ती_UP,5Baje5Minute UPSSSCम 69000श abhinaysharma 69000_श
"Boomers, who lived through the Cold War, should know better. Stunning: A Delusional Socialist Just Blew Away the Democrat Competition in Nevada. Now What? {{URL}} #PJMedia via {{USERNAME}} ",PJMedia
Trump Announces Addition of Bahrain to Middle East Peace Deal {{URL}} via {{USERNAME}} #WINNING,WINNING
A policy star from #Tulare is heading to the White House! Congrats to {{USERNAME}} for her well-earned appointment to the Office of Mgmt and Budget. We need some $$$ for housing in CA!!! Central Valley Proud indeed {{USERNAME}} ! {{URL}},Tulare
Plz subscribe 2 {@CODEPINK@} - get on their  update  mailing list. You ll get notifications on everything pertaining 2 war and legislation in DC #AntiWar  You ll get details on bills & a script/info when you call your state rep -such as when the NDAA came up {{URL}},AntiWar
"Frogs are declining throughout the world and even in #Pakistan pollution, loss of habitat, climate change and poaching for medical labs are all contributing to their decline. Why aren t frogs protected under the law, what law protects them? {{USERNAME}} {{URL}} ",Pakistan
"“For them, our children were born to be killed. Parents cannot send their children to schools when they do not know whether they will return alive or dead.   #StandWithKashmir #ReturnKashmiriChildren {@Al Arabiya English@} #FreeKashmir",StandWithKashmir ReturnKashmiriChildren FreeKashmir
#IMPOTUS {{USERNAME}} Impeached President Donald Trump.  That will go down in the history books. Couldn t be a more fitting legacy for the most corrupt President in the history of the United States.,IMPOTUS
". {@Secretary Pompeo@} : “On behalf of the Government of the United States and the American people, I congratulate the citizens of the European Union as you celebrate #EuropeDay”. {{URL}} ",EuropeDay
"Hi {@Namibian Presidency@} , {{USERNAME}} thank you for committing to ratify the {@International Labour Organization@} Convention on Violence and Harassment in the World of Work! This will help women get the legal protection at work they deserve. As a {@Global Citizen@} I hope to see other world leaders do the same #LeveltheLaw",LeveltheLaw
"EAST OAHU: HPD manning traffic lights at  Kalanianaole Hwy at  Keahole, Hawaii Kai Dr, Kawaiahae, and Kuliouou. Treat all lights you come to as all way  stops. {@Hawaiian Electric@} working on power outage. 6800 w/o, down from 13000  #hitraffic",hitraffic
Happy Sunday! I’m in for Matt this morning on {@NEWS10 ABC@} .   A recap of last night’s severe weather   Quieter today  ☀️ Nice again tomorrow #WakeUpwith10,WakeUpwith10
"I truly hope {@Kamala Harris@} does find time to visit her ancestral village as Vice President Elect, or as #VPOTUS... that would be a truly beautiful moment.   We should all remember where we and our forefathers came from to bring us to this moment. {{URL}} ",VPOTUS
#SARS wrongfully picking up and harassing people all around in unmarked vehicles and without uniforms and the {@Nigeria Police Force@} always remain silent despite people s daily complaints. These thugs collect bribes with confidence. What a messed up country.,SARS
Graphic modeling of the effect of social distancing. Worth a read/look. {@The Washington Post@} #COVID19 {{URL}},COVID19
#Climate2020 {@Bernie Sanders@} Dear Senator Sanders ! I hope you win I am voting for you ! but now more then ever we need help fighting Climate Change and Global Warming ! it is the greatest threat hummanity faces please help ! S.Revier with Green Peace USA !,Climate2020
Very insightful article in #TheTimes by {@Matthew Syed@} -  crazy from the start to try to impose Western style democracy on #Afghanistan - where tribal ethnic affiliation is paramount. #Kabul is not the Country - only a very small part has knowledge of the outside world.,TheTimes Afghanistan Kabul
The {@Conservatives@} have been governing Our country for a decade. The #Conservatives are solely responsible for Not planning for a Pandemic. In 2014 they had a plan. And cut obligations year on year. I m hearing. #Covid_19 #UK,Conservatives Covid_19 UK
SCRMU Twitter Day on 7/6/21 AIRF/SCRMU DEMANDS to Declare all Railway Employees as  FRONTLINE CARONA WORKERS  raise the voice on 7/6/21 morning through  Twitter   #TreatRailwayEmployeesFrontlineworkers {@PMO India@} {@Ministry of Railways@} {@Ministry of Health@} {@Piyush Goyal@} @shivgopalmish1,TreatRailwayEmployeesFrontlineworkers
I m so sick of the media saying this is all because of #GeorgeFloyd NO this is about police brutality of all the #GeorgeFloyd in the world. Stop creating a narrative like this is an isolated event!!!  I m sick of {@CNN@} {@Fox News@} {@ABC News@} #BlackLivesMatter,GeorgeFloyd GeorgeFloyd BlackLivesMatter
"#Daytona {@NASCAR@} {{USERNAME}} --When Tech Sgt sang our #GREAT_NATIONAL_ANTHEM, i looked at the President and Melania and said YES. YES. YES. Thank you for embodying the words so many have fought and died for.",Daytona GREAT_NATIONAL_ANTHEM
The beauty of #DTLA shot by {@Chris Cristi@} right now is just breathtaking. Please stop the today’s insanity and take care of our city.♥️,DTLA
Silicon Controlled Rectifier (SCR) schematic diagram and symbolic representation...  You can join our family  {{USERNAME}} 1️⃣ Share with your friends. 2️⃣Join our #LearnEEE family  {{USERNAME}} 3️⃣Visit our… {{URL}},LearnEEE
"I think we can all agree that when the Astros lose, America wins. Congrats {@Tampa Bay Rays@} on heading to the #WorldSeries. Time to bring on the {@Los Angeles Dodgers@} ",WorldSeries
‘It’s sad but we warned the ANC’: Carl Niehaus weighs in on fiery protests {{URL}} via {{USERNAME}} #Read the head lines.. Aparthied was implemented because of the same reasons but it was wrong and roiting against a goverment they choose right because they are Africa,Read
Charge the cops who shot Jacob Blake - Sign the Petition! {{URL}} via {@Change org@} #JusticeForJacobBlake,JusticeForJacobBlake
The school to prison pipeline is a misnomer... for far too many students especially those of color... school is prison... 1.1 million kids attend schools with law enforcement and no counselors...   #leadbetter {{URL}} {{USERNAME}} {{USERNAME}} {{USERNAME}},leadbetter
. {@Kat Timpf@} said the media should  focus on the law  and not the politics of the recent Supreme Court decisions because the New York Times caused major confusion for changing a headline.  #MediaBuzz,MediaBuzz
President-Elect Joe Biden s German Shepherd Major to Be First Rescue Dog in the White House {{URL}} #Election2020 #MAAA #RescueDogs {@The White House@} #JoeBiden,Election2020 MAAA RescueDogs JoeBiden
Action not words is what is required from the world leaders to solve the Kashmir issue  #StandWithKashmir #ReturnKashmiriChildren {@Investors Bank@} {@Institutional Investor@} {@Nathan Michaud@} #FreeKashmir #EndSiege  #SanctionsForIndia {{URL}},StandWithKashmir ReturnKashmiriChildren FreeKashmir EndSiege SanctionsForIndia
Scrap #HS2. We want rinky dink #train lines that are safe to use around the clock. What would the Victorians do?  They had common sense. {@UK Prime Minister@} {@Boris Johnson@} #Transportation #transport,HS2 train Transportation transport
The latest The Fire-Climate-Media Daily! {{URL}} Thanks to {@NASA Climate@} {@NOAA Climate gov@} #under2coalition #kincadefire,under2coalition kincadefire
"Whether we come from the same ethnic group or not, we will stand united in the fight against tyranny. May we meet in the land of democracy. {@Marco Zanni@} {@David Sassoli@} {@Congressmember Bass@} {@Department of State@} {@Bureau of Democracy Human Rights and Labor@} #300Lives3Months  via {{USERNAME}} ",300Lives3Months
#America the republicans R playing the game of purge & block voters Don’t let em win Everyone get out register Check ye statues There are more people of good conscience then R #Republicans They win #America losses. {@Rachel Maddow MSNBC@} #FunFactFriday #FlashbackFriday #TexasBowl #FridayVibes,America Republicans America FunFactFriday FlashbackFriday TexasBowl FridayVibes
The #Ethiopian government is known to hide atrocities to protect the country s image. The Wollo famine in 1983 took 1.2 million lives with the knowledge of the government. What are we waiting for in #Tigray in 2021? #TigrayGenocide #BidenActNow {@Secretary Antony Blinken@} {@President Biden@} {@Senator Chris Coons@} {@United Nations@},Ethiopian Tigray TigrayGenocide BidenActNow
"#BREAKING - TASMANIA WILL HOST 2 {@AFL@} FINALS NEXT WEEKEND!    ELIMINATION FINAL: {@Sydney Swans@} v {@GWS GIANTS@} : UTAS Stadium on Saturday, 28 August at 3:20pm.  ELIMINATION FINAL: {@Western Bulldogs@} v {@Essendon FC@} : UTAS Stadium on Sunday, 29 August at 3:20pm.  History!",BREAKING
{{URL}} {@Michael Cohen@} YOU stole 4+ years from the entire planet s population AFTER decades of covering up 4 Donlad J TRASH & now {@NY AG James@} has to clean up a mess YOU HELPED MAKE  Most ppl can t even afford to sneak out to #ThePost 4 expensive steak & wine,ThePost
Lachie Whitfield has been replaced by {@GWS GIANTS@} medical substitute Jeremy Finlayson after copping a knock to the head #AFLGiantsSuns,AFLGiantsSuns
Donald Trump’s re-election campaign poses the greatest threat to American democracy since World War II. Mr. Trump’s ruinous tenure already has gravely damaged the United States at home and around the world. He has abused the power of his office  {@The New York Times@} #VoteHimOut,VoteHimOut
"Parts of #DelhiNCR receive heavy rain today, just right the next day of #Diwali2020 This is the power of Hindu lord, Lord Ram made it rain in #Delhi today. Provide relief from Choking #delhiairpollution .  #JaiShreeRam  #DelhiAirQuality  #DelhiRains @bhardwajpunjbi7",DelhiNCR Diwali2020 Delhi delhiairpollution JaiShreeRam DelhiAirQuality DelhiRains
"The greatest action any human can take to reduce emissions/waste is to have no, or fewer, children.  Yet environmental organizations, governments, and activists don t even mention it. #overpopulation {@The Nature Conservancy@} {@Greta Thunberg@} {@The Guardian@} {@CNN@} {@MSNBC@} {@WWF@} {@NPR@} {@BBC News World@} {@United Nations@} ",overpopulation
Gear up for #July4th weekend! Check out {{USERNAME}} ’s patriotic #Pickleball paddles and sporting attire: {{URL}},July4th Pickleball
The latest The Croydon Gazette! {{URL}} Thanks to {{USERNAME}} {@Sam Truelove@} {{USERNAME}} #croydon #send,croydon send
"Warning all #Resisters, 291 of my followers are following MAGAt {{USERNAME}} And I m sure many others are also being followed by this person so please retweet! I found him checking on who I wasn t following back with Follower Checker for Twitter app.   Please retweet! Thanks!",Resisters
Ventura County Sheriff : Take Public Volunteers To Find Naya Rivera - Firma la petizione! #FindNayaRivera #NayaRivera {{URL}} via {@Change org Italia@},FindNayaRivera NayaRivera
"I do not understand why {@Joe Biden@} is going to debate #Trump? Hes going to spend the whole time saying, That s a lie. That s a lie.That s a lie  WHY give the orange scourge the screen time? No one is changing their minds at this point.I m ready to #VoteHimOut NOW without debates.",Trump VoteHimOut
"Hi {@Heathrow Airport@} , are you aware that the info you give out at your terminal about arrivals from #COVIDー19 counties are incorrect? Government has withdrawn that guidelines on the 13/03/20. I think is reckless from them, but still incorrect information.",COVIDー19
#RemembranceSunday {@Help for Heroes@} {{USERNAME}} {@Royal British Legion@} #armedforces #LestWeForget  Northamptonshire Remembers {{URL}},RemembranceSunday armedforces LestWeForget
The Devil is In The #Construction Detail  By {{USERNAME}} {{URL}} #hse #leadership #safety,Construction hse leadership safety
