cleaned_text,topic
shadow daily dose content,Arts
lakshmi puja performed diwali invite goddess home year filled peace wealth prosperity return moneygive u reason perform ritual year agar lakshmi hi nahi raha kiski puja kare,Arts
sit fire mystic cave painting first man first woman defeating first beast dreaming simple future could survive heavy rain,Arts
make take wood slice animal tomorrow create set wonderful wooden disc perfect activity waitwhat create book space today,Arts
poet news shortest day blowy crosby beach suggested place recite winter solstice poem sunrise sun eye open breach horizon slumber bleached wonder woken,Arts
urban financial service coalition vision ensure full equitable participation people color,Arts
many fab author donating signed book illos support twitter auction looking forward bid tomorrow great initiative,Arts
perfect engagement photo session poke fun stagedyetcandid quality modern engagement photography also quietly point much modern culture performative andor curated social medium,Arts
blue falling star blue,Arts
tribals lived country age hardworking honest lovingcaringecofrndlyknow humanity fabls tribe superb human,Arts
may god deliver country evil,Arts
jesus christ really rise dead,Arts
svg png sublimation day dead dia de los muertos cricut projectssugar skull mask printable,Arts
repost jesus died rescue u sin reconcile u god rose grave alive,Arts
full saint describes worship three time worshiping full god morning afternoonthe hospitality god world evening aarti tell separately benevolent saint rampal ji maharaj,Arts
opposite attract trying push two positive two negative end togetheror case two mind readersdoesn work pain warning way protect,Arts
historical legacy show value never giving uncertain time historical legacy juneteenth,Arts
historical legacy juneteenth show value never giving hope uncertain time thanks piece important mission,Arts
solvesundsbostudio edition wearing opera costume designed mask orpheus directed composed outfit,Arts
um soooooo sooooo depressed idk guy family feeling wish could power stop,Arts
social distancing stay safe original wall art jane palmer art mixed medium sculptural artwork,Arts
excited announce work upturned root x x silverpoint handmade panel selected shown de young museum art exhibition featuring bay area artist open shortly reopens,Arts
happy day dead,Arts
power idea poetry change inspire world manifest brown girl brown girl rendition poem celebrating kamala harris becoming u vpelect go viral,Arts
gift love ingredient give loved one physicalvirtual crypto gift card within app get kikitrade wish merry christmas happy year,Arts
looking year eve plan check smoke mirror nye event think free flow great food stunning view looking iconic mb,Arts
ringing year eve enough cash,Arts
easter egg dyed cake decorating icing color paste love test idea using cake decorator colouring make look amazing,Arts
happy easter everyone little tatoe go play hide seek easter egg,Arts
coming shelter full saint rampal ji maharaj god kabir also avoids death sage came coming saint shelter one impregnated forehead put thorn savior god,Arts
lord inquired abel cain blood brother cried ground genesis,Arts
finished first round publisher edits mgya book also made cover art suggestion think super cool asked input top notch,Arts
image shared archieve hand written letter patent charles ii also engraved printed portrait king,Arts
human birth liberate oneself birth cycle attain ultimate salvation possible meditating holy divine word spend sunday god remembrance make,Arts
boast bestpreserved tudor garden england backdrop grand castle surrounding wisteria english rose ground offer perfect bigday setting,Arts
posting updated thread feel free check old,Arts
girl fell sky simon mawer,Arts
project tau project book featured today least pretty sure today accounting time difference regardless book still free monday grab copy,Arts
loving reading recommendation friend author book reviewer feel free u whenever like retweet,Arts
please check video draw christmas tree fun easy,Arts
eid mubarak muslim brother sister world may allah make easy u amin,Arts
eid mubarak friend wider muslim community wishing happy eid alfitr,Arts
psa yet watched friday looking little levity workout dont think watching replay slow jam news help,Arts
bad boy life take offshore bow race global jumanji next level ups game past ww international box office,Arts
king dead long live king following death nria tyrannical king xander seemingly unassuming subordinate randolph taken crown,Arts
proud entire team especial shoutout getting nominated big achievement hope prosper move onto bigger n better thing hope continue get opportunity create art term,Arts
dont patience restore hype,Arts
enjoyed review chapter two mention screenwriter gary dauberman,Arts
anyone remember season pleaded viewer stop voting stop sending good dancer home take lesson resign show actually dancing,Arts
every time hear vic perrin voice think story bruce timm told casting lex luthor cb asked kind voice thinking lex said vic perrin clancy knew exactly meant,Arts
assignment spoil tent enemy take anything want gotten death resurrection lord jesus christ,Arts
bad boy life expected cross million mark holiday weekend,Arts
great wee documentary lover movie review documentary,Arts
habakuk yet rejoice lord joy god salvation,Arts
morning peek around corner might move studio glasshouse millinery,Arts
happy eid mubarak love lagos nigeria,Arts
festing th detail bucktown,Arts
praise lord dance people key david pjt,Arts
savior sister available preorder savior sister amazon u amazon ca amazon uk,Arts
charted billboard chart group first ever entery u genre album chart twice th korean girl group chart billboard,Arts
may god almighty open door happiness u fulfil ur dream eid mubarak u ur family,Arts
rolling stone perform always get want one,Arts
lovesight dayfox vlog copyright music video please give watch dont forget comment like subscribe,Arts
opinion may celebrating international womens day fight equality go,Arts
fire god judge enemy everything scheming rising shall judged,Arts
fan please vote start storm writing award human legend terrify child,Arts
guest author thursday brenda marie smith light escape,Arts
excited launch podcast book blurb go tune send voice message find major podcasting platform also follow podcast facebook,Arts
right come let silly boy follower away please please go follow lad he savage hit he giving free copy,Arts
hmalways rep brand stitch n smile happy eid mubarak,Arts
black artist artist jeanmichel basquiat read full story image source,Arts
happy lovely beautiful deserves extra love today special day completing spank last night hour lucky might show killer deal album missed,Arts
perfect time sunday featuring who extremely talented genuine great sense humour cover story truly enjoyed writing,Arts
great night came support,Arts
queen know greatness cultural moment cant missed,Arts
radio show blue wednesday ft magnus klausen wind,Arts
happy eid muslim brother let observe physical distance wear mask let stop spread,Arts
huge welcome choir join orchestra first time today ready next weekend christchurch priory certain area priory sold,Arts
may blessing today celebration come much blessing light warmth family eid mubarak u,Arts
know bit late happy pride month last year able celebrate hour stream pride month hope continue work kid month,Arts
earns nd best pic dig first wide day,Arts
star war rise skywalker film review,Arts
lbc set become bbc music playing soundbites simpson,Arts
there atmosphere god bringing upon life would cause devil look bypass principle fruitfulness shalom temple amasaman,Arts
smorgasbord post archive great influenza pandemic christmas joy neal kidney,Arts
good morning brother beautiful great day lord made,Arts
marathi girl different family background make friend solo trip goa saw refreshingly enjoyable film good cinematography mix funfrolic value nicely woven script thing impractical music,Arts
watching jesus christ superstar today great performance juda may arena tour close get,Arts
music essence express listen song feel feeling put sung note give maximum every work engages connected sound music,Arts
review king eternal monarch,Arts
feel sorry people bought ufc ppv see snooze fest main event dont blame,Arts
resurrection jesus christ important event history,Arts
look sky imagine limitless sky embrace entirety world flaw hope happy tried prompt beautiful,Arts
summer reign rick ross summer walker,Arts
please check video draw cute kitten,Arts
call u name invite move love interpretation biblical story zacchaeus tax collector jesus called name order show love,Arts
happy work spared employee safe looking visit soon fire put respect,Arts
music theatre industry crumbling eye people stage million behind scene brink loosing everything need support,Arts
eid mubarak lovely moot muslim army may wish come true hope eid brings lot joy stay safe eid mubarak,Arts
wish happy eid mubarak,Arts
may resurrection power lord jesus christ restore lost glory opportunity breakthrough every good thing life happy easter remain bless,Arts
hadnt remembered also earthquake reported matthew gospel day jesus rose dead happy,Arts
white stripe effect cause,Arts
angel sky nelo esteves,Arts
read article mail sunday incredible discovery archaeologist uncovered first world war pompeii belgian field,Arts
aunty aisha eid mubarakmay allah accept ibadah ohi know far still need ram rice oh felicitate big bro wish muslim worldwide hearty celebration,Arts
valuable lesson story jesus facing anguish,Arts
halloween around corner made pumpkin patch corn maze yet uesugifarmspumpkinpatch monterey rd san martin ca,Arts
nigeria trend follow insight top eid mubarak cynthia morgan may ybnl sean tizzle view google search trend insight,Arts
really like ideacheck link see think every friday blackowned business petition callstoaction website,Arts
woken middle night tell hereby reject ending ground far bitter therefore alternate ending would take story next,Arts
