cleaned_text,topic
shadows daily dose beauty altmodel news url content via username username username latex artbook,Arts
lakshmi puja performed diwali invite goddess home new year filled peace wealth prosperity return moneygive us reason perform ritual year agar lakshmi hi nahi raha kiski puja kare savepmc modi das,Arts
sit fire mystic caves painting first man first woman defeating first beast dreaming simple future could survive heavy rains poetry username url,Arts
make take wood slice animals username tomorrow create set wonderful woodland animals wooden discs perfect autumn activity waitwhat create book space today url hantsdaysout,Arts
poet news shortest day blowy crosby beach suggested username place recite winter solstice poem sunrise suns eye opens breaches horizon slumbers bleached wonders woken poet shortestday crosbybeach,Arts
ufscnet username ufscmswc ufsclifestyle ufscculture ufscphilosophy hcp wblendingsolutions urban financial services coalition vision ensure full equitable participation people color url,Arts
many fab authors donating signed books illos support cfa twitter auctions looking forward bids tomorrow authorsforfireys great initiative username,Arts
enw perfect engagement photo session pokes fun stagedyetcandid quality modern engagement photography also quietly points much modern culture performative andor curated social media url via new yorker,Arts
blue falling stars blue username via oil painting art url,Arts
tribals lived country ages hardworking honest lovingcaringecofrndlyknow humanity fabls tribe superb human meena,Arts
may god deliver country covid evil deliverusfromevil username theworshiphouseonline,Arts
jesus christ really rise dead url faith via username,Arts
sugar skull clipart svg png sublimation day dead dia de los muertos cricut projectssugar skull mask printable url via,Arts
repost via username username jesus died rescue us sins reconcile us god rose grave alive ourdailybread resurrectionsunday resurrection greifoverturned url,Arts
whoisrealsadguru full saint describes worship three times worshiping full god morning afternoonthe hospitality gods world evening aarti tells separately benevolent saint rampal ji maharaj username,Arts
opposites attract trying push two positives two negative ends togetheror case two mind readersdoesn work pain warning way protect bookbubble username url ya teens amreading,Arts
historical legacy juneteenth shows value never giving hope uncertain times via historical legacy juneteenth via nmaahc blacklivesmatter url,Arts
historical legacy juneteenth shows value never giving hope uncertain times thanks nmaahc piece important mission url juneteenth,Arts
solvesundsbostudio username lgbtqia edition wearing opera costumes designed national opera mask orpheus directed username composed harrisonbirtwistle outfits url,Arts
um soooooo sooooo depressed idk guy family feeling wish could power stop smprotectyourartist smprotectchen westandwithchen joongang daily,Arts
social distancing stay safe original wall art jane palmer art mixed media sculptural artwork url via welshart covid,Arts
excited announce work upturned roots x x silverpoint handmade panels selected shown de young museum art thedeyoungopenan exhibition featuring bay area artists open shortly young museum reopens,Arts
happy day dead googledoodle url via doodles,Arts
power ideas poetry change inspire world manifest brown girl brown girl renditions poem celebrating kamala harris becoming us vpelect go viral url via indian express,Arts
gifts love ingredients merrychristmas give loved ones physicalvirtual crypto gift card within username app get url kikitrade wishes merry christmas happy new year url,Arts
looking new years eve plan singapore check smoke mirrors nye event think free flow great food stunning views looking iconic mbs visitsingapore username nyel url,Arts
ringing new years eve enough cash url newyearseve nyc pandemic coronavirus covid square username newyears username username username,Arts
easter eggs dyed cake decorating icing color paste url via love test ideas using cake decorators colouring make eastereggs look amazing easterweekend eastereggs choxthemuse,Arts
happy easter everyone little tatoe go play hide seek easter eggs nft nftcollector nftcommunity nftart nftshill crypto ethereum eth url,Arts
coming shelter full saint rampal ji maharaj god kabir also avoids death sage came coming saint shelter one impregnated forehead put thorn username rampal ji maharaj savior god,Arts
supernaturalbenefitsofthenewcovenantbloodofjesuschrist lord inquired abel cain blood brother cried ground genesis username username,Arts
finished first round publisher edits mgya book also made cover art suggestions think super cool asked input username top notch publishers publishing writingcommnunity author edits books,Arts
image shared medway archieve hand written letters patent charles ii username also engraved printed portrait king url,Arts
human birth liberate oneself birth cycle attain ultimate salvation possible meditating holy divine words spend sunday god remembrance make spiritualsunday news updates url,Arts
venueoftheday username boasts bestpreserved tudor gardens england backdrop grand castle surrounding wisteria english roses grounds offer perfect bigday setting url avon bristol,Arts
new posting updated fanart thread username url feel free check old art url,Arts
bookreview girl fell sky simon mawer url via username,Arts
project tau projects book featured today username url writingcommunity least pretty sure today accounting time difference regardless book still free monday grab copy,Arts
loving reading devonbookhour recommendations fantasyfortnight username friends authors book reviewers feel free us whenever like retweet,Arts
please check new video draw christmas tree fun easy url via christmas sketch drawing cartoon popart elearning remotelearning color pencilsketch holiday red blue green tutorial learn tree cute easy,Arts
eid mubarak muslim brothers sisters world may allah make easy us amin eidulfitr eidmubarak eidalfitr ramadan username username username username username username username,Arts
eid mubarak friends username wider muslim community wishing happy eid alfitr eidmubarak,Arts
sundaymorning psa yet watched fridays tonight show looking little levity workout dont think watching replay obama slow jam news help usaonfire blacklivesmatter,Arts
film money bad boys life takes offshore bow races global jumanji next level ups game past ww international box office url via hollywood,Arts
king dead long live king following death nria tyrannical king xander seemingly unassuming subordinate randolph taken crown url username postapocalyptic dystopian scifi,Arts
proud entire team thewhitetiger especial shoutout username getting nominated big achievement hope prosper move onto bigger n better things hope continue get opportunity create art terms,Arts
restorethesnyderverse dont patience restore hype,Arts
enjoyed kermode review chapter two username mention screenwriter gary dauberman theresareasontheydontjustfilmthebook noscriptnofilm itstartsonthepage creditscreenwriters,Arts
dwts anyone remember springer season pleaded viewers stop voting stop sending good dancers home spicer take lesson resign show actually dancing,Arts
every time hear vic perrin voice think story bruce timm told casting brown lex luthor cb asked kind voice thinking lex said vic perrin clancy knew exactly meant svengoolie,Arts
assignment spoil tent enemy take anything want gotten death resurrection lord jesus christ username username onlinechurch easterservice goforthespoils trem,Arts
bad boys life expected cross million mark holiday weekend lawrence gemini man smith films tv films tv pictures khaled badboysforlife url,Arts
great wee documentary lovers movie review neversurrender galaxyquest documentary url,Arts
habakuk yet rejoice lord joy god salvation username pstuche hotrservice,Arts
morning peek around corner might move studio glasshouse millinery millinery hats glasshouse handmade madeinnewyork newyorkmilliner username url,Arts
happy eid mubarak username love eidmubarak happycelebration sunday feetaffairs goodshoes lagos nigeria url,Arts
festing th details bucktown username username fleurstruly podcast nola food music festivals fun url,Arts
praise lord dance people key david pjt username praisethelordservice freshfire depthforheights,Arts
savior sister username available presale amreading writingcommmunity preorder savior sister amazon us url amazon ca url amazon uk url,Arts
monthwithmoreandmore charted billboard charts group first ever entery us genre albums chart twice th korean girl group chart billboard url,Arts
may god almighty open doors happiness u fulfil ur dreams eid mubarak u ur family riaz eidmubarakasim,Arts
rolling stones perform always get want one url via wow thanks rolling stones,Arts
lovesight dayfox vlog copyright music url via vlognocopyrightmusic vlog slenocopyrightmusic freemusic royaltyfreemusic nocopyrightmusic youtubemusic new video please give watch dont forget comment like subscribe,Arts
opinion spain may celebrating international womens day fight equality goes url username,Arts
fire god judge enemies everything scheming rising shall judged divinejustice username,Arts
fantasyfiction fans please vote start storm writing award username humans legend terrify children url,Arts
guest author thursday brenda marie smith light escapes newrelease dystopian postapocalyptic url via username,Arts
excited launch podcast book blurbs go url tune send voice message find major podcasting platforms also follow podcast username facebook bookblurbs podcasting reading,Arts
right come lets silly boy username followers away twitch url please please go follow lad hes savage hits hes giving free copy blackopscoldwar callofduty,Arts
hmalways rep brand stitch n smile happy eid mubarak username kaftan osogbotailor osogbomua url,Arts
black artist artist jeanmichel basquiat read full story url image source username art artist painting jeanmichelbasquiat basquiatarchive arthistory fashionart loqi,Arts
happy ziaday lovely beautiful username deserves extra love today special day completing spanks last night hours lucky might show killer deal album missed url,Arts
perfect time username sunday coverstory featuring kubrakhan whos extremely talented genuine great sense humour cover story truly enjoyed writing username url,Arts
great night username rewind username came support leroclife magiclife loveandgratitude werkflow garagegirl url,Arts
queen obama knows greatness cultural moments cant missed erykahbaduvsjillscott,Arts
np username username radio show blue wednesday ft magnus klausen wind username username,Arts
happy eid muslim brothers lets observe physical distance wear masks let stop spread covid south sudan username username,Arts
huge welcome choirs username username username username username username join orchestra first time today ready beethoven next weekend christchurch priory certain areas priory sold username,Arts
may blessings today celebration come much blessing light warmth family eid mubarak us username eidmubarak eid eidgifts eidoutfit url,Arts
know bit late happy pride month last year able celebrate hour stream life pride month hope continue work kids month extralifepride,Arts
theriseofskywalker earns nd best christmaseve starwars pic uncutgems digs first wide day url via hollywood,Arts
theriseofskywalker star wars rise skywalker film review url via,Arts
lbc set become new bbc music playing soundbites simpsonsleadingbritainsconversation thesimpsons,Arts
theres atmosphere god bringing upon life would cause devil look bypass username principles fruitfulness shalom temple amasaman shalomat sundaysaticgc yearoffruitfulness weareicgc,Arts
smorgasbord posts archives family friends history great influenza pandemic christmas joy neal kidney url via username,Arts
ghettogospel good morning brethren beautiful great day lord made radio username username ruff kenya username username username username,Arts
girlz marathi girls different family background makes friends solo trip goa saw prime video refreshingly enjoyable film good cinematography mix funfrolic values nicely woven script things impractical music,Arts
watching jesus christ superstar today great performance minchin judas may arena tour close lockdowntheater get,Arts
music essence expresses listen songs feel feelings puts sung note gives maximum every work engages connected sound music atimeshowcazexmew,Arts
review king eternal monarch url username happyblogging,Arts
feel sorry people bought ufc ppv see snooze fest main event dont blame masvidal ufc boringfight imgoingtobed,Arts
resurrection jesus christ important event history url faith via username,Arts
look sky imagine limitless sky embraces entirety world flaws hopes username happy tried prompt beautiful medium mediumwriters sky limitless poetry poetryprompt url,Arts
nowplaying summer reign rick ross summer walker url,Arts
please check new video draw cute kitten url via cat sketch drawing cartoon popart elearning remotelearning color pencilsketch orange red tutorial learn cute easy kitten ginger,Arts
calls us name invites move love username interpretation biblical story zacchaeus tax collector jesus called name order show lovemercy love grace forgiveness,Arts
happy art works spared employees safe looking visit soon fire put respect onelove underwood talk,Arts
music theatre industry crumbling eyes people stage millions behind scenes brink loosing everything need support dowden sunak musicmatters letthemusicplay,Arts
eid mubarak lovely moots muslim armys may wishes come true hope eid brings lots joy stay safe eid mubarak eidmubarak bringtheeidon,Arts
wish happy eid mubarak username eid eidmubarak eid stayhome staysafe health goodhealth sunday wellness medical ncdc healthyliving hospital url,Arts
may resurrection power lord jesus christ restore lost glory opportunities breakthroughs every good things life happy easter remain bless breakinglimits staysafe stayalive username username,Arts
hadnt remembered also earthquake reported matthews gospel day jesus rose dead url atozchallenge username happy easter,Arts
white stripes username effect cause url rock indie funk punk,Arts
angel sky nelo esteves url imagekind via username,Arts
read article mail sunday mail online incredible discoveries archaeologists uncovered first world war pompeii belgian field username lestweforget url,Arts
aunty aisha username eid mubarakmay allah accept ibadah ohi know far still need ram rice oh felicitate big bro username wish muslims worldwide hearty celebration tooeidmubarak,Arts
notlost username username username username username username valuable lessons story jesus facing anguish,Arts
halloween around corner made pumpkin patch corn maze yet uesugifarmspumpkinpatch monterey rd san martin ca mobile us url,Arts
nigeria trends follow username insight top eid mubarak cynthia morgan davidovsburnaboy eidwithtacha mydstvapp may cmchallenge ybnl pstirensaid sean tizzle view google searches trend insight url,Arts
really like ideacheck link see think every friday donate shop blackowned businesses sign petitions callstoaction everyblackfriday website via username url,Arts
woken middle night tell hereby reject ending theamberspyglass pullman grounds far bitter therefore alternate ending would take story next,Arts
