cleaned_text,topic
spotify surpassed stream platform th song full album congratulation girl,Music
check awesome spotify playlist music inspiration weekend massive thank including single feat,Music
fresh find discover music hot talent give listen diego opty follow opty listen,Music
permission_dance really power make people happy instantly,Music
kudos music crew,Music
hunter thompson favourite song lou reed bob dylan like spirit sky white rabbit,Music
prince would die u listen wake_morning f_urban talk_news laugh,Music
watch musician release album light music_video home movie,Music
jungle open rolled rider stole food bear brought back lion hold court ape gorilla lighter got eye tiger heart fighter tha mobb,Music
lemon pepper freestyle debut uk spotify chart stream drake th rick ross th entry chart rick ross highest peaking song uk spotify chart surpassing like,Music
tru rider front eng ducey daphatom listen_live,Music
top artist tokio hotel harry style bring horizon hawthorne height andrea bocelli,Music
giveon heartbreak anniversary official music_video,Music
gig horizon free entry one hitchin metal mass first round come,Music
huge shout amazing keep great work,Music
music capitol cut live studio,Music
got good time bad one cd signed jonah marais support,Music
fire fly high high high er fire fly high high high er hwangholgyeonge ppajin deusi jeongsini ontong neoppunya uh hanchameul hemaedeon sungan beonjjeogin like thunder lightsaber yeah,Music
random tweet artist decade going artist next decade,Music
spice sean paul shaggy go deh official music_video,Music
uvtraveler rooted ground,Music
richie spice brown skin listen wake_morning f_urban talk_news laugh,Music
album like broke baby heart tho,Music
best mixtape mixed flakesthemixtapemogul extended mix flakesthemixtapemogul feat blueface tyga chris brown drake post malone tory lanez wiley lil baby dababy city girl app,Music
power piano display enjoy high flavour x offering stream tracklist,Music
felix spoil album bit,Music
music homie prod platform drop comment feedback skater im dropping sunday slow roll,Music
ghost feat akira prod litlikenoah mxrkus song prod,Music
red hot patti smith set participate earth day livestream concert see full lineup,Music
really want album bad god give album please hope kind people give hiks,Music
solid pre save spotify apple_music checking teaser clip release,Music
ground full cam sb inkigayo,Music
come back lord wait till late edward iwantasap feel,Music
cause ah ah star tonight watch bring fire set night alight,Music
pure poetic utmost passionate never dying tangible forever young selfish desire stopped never thought come,Music
fresh find discover music hot talent give listen tic toc mo mint follow mo mint listen,Music
purple disco machine sophie giant hypnotized,Music
music_video brother bornpaidzeezy shot,Music
spotify ww baila conmigo meses dancing devil dia,Music
win feat snoop dogg pain ludacris rick ross dj khaled,Music
asks u u tell u told u tired castle air got dream want world share castle wall lead despair remember talking album everyone thing talking,Music
beautiful sound uncharted worldz razaa music dream wishing well platform music,Music
imagine put yeosang part preview album th listen album surprised finally get line cry,Music
minieeeeeeee lively lovely today stay safe jin hyung,Music
purple disco machine sophie giant hypnotized,Music
dance decade away year mastermix good end way started radio listen_live tonight pm thank,Music
f sicko mode listen_live wake_morning f_urban talk_news laugh,Music
excited coming next grateful hanbin,Music
pt kanye west,Music
outro cross line sound fancy album preview,Music
apple_music uk next day lemon pepper freestyle ft want need ft peak,Music
hour min visit download app playtore io enjoy concert,Music
watch brand music_video short directed produce cc meneja,Music
dj khaled dj khaled rick ross future cardi b nicki minaj drake chris brown feat djkhaled chris brown liltjay cardi b pop smoke rick ross jay z roddy ricch travisscott migos lil bab app,Music
fresh find discover music hot talent give listen jabber jaw mocity jones follow mocity jones listen,Music
boy display wide range technical musical ability track strong opener album introduction come,Music
hi bts conquering world right pls help u celebrate playing bts feat tonight,Music
falling red storm inside,Music
really love song would really cool play today please de f c dffc,Music
apple_music br di rio top permission_dance peak butter peak,Music
satan worship im devil supporting artist since hiq radio,Music
apple_music global butter permission_dance dynamite,Music
bts apple_music pm kst korea top permission_dance butter dynamite life go boy luv ft halsey,Music
lead dark apple_music lead dark bandcamp spotify,Music
lost tryna find answer world around going crazy day night time request may please hear bts feat tonight,Music
throwback music_video song dream august april album project produced directed,Music
george benson give night official music_video radio cause music air lot loving everywhere give night,Music
w woman gone bob marley visit,Music
enjoying sound defected radio house track decade special h,Music
already know album sound even better spring song like sunflower vol adore play beautifully degree sunlight,Music
dear love album pack photobooks photocards extra would cool full length lp vinyl record next album plus goody go album thought,Music
seddy hendrinx lowkey official music_video,Music
arashi turning r hab remix official music_video,Music
spotify global permission_dance butter dynamite spotify u permission_dance butter,Music
got back onto music show circuit post olympics past week promoting album much happened sure check weekly recall catch might missed,Music
info permission_dance kst genie bug flo melon vibe daily chart peak chart k,Music
watermelon sugar de harry style em,Music
permission_dance vote,Music
bringing back jam honor olympics tokyo,Music
never remix download app submit music today,Music
thread collab drop hour,Music
channel download app submit music today,Music
understand people totally streaming party rapper fandom nowadays rapper many song different genre rock rnb pop dancehall house edm reggaeton many blend got song,Music
permission_dance vote,Music
icymi live music longer allowed folly beach bar restaurant past p city council held special emergency meeting thursday morning,Music
champion drem tgi listen,Music
explicit lyric ransom x big ghost ltd heavy head album stream,Music
di pa rin masyado nag ssink sakin na james release song soooo excited congratulation daysto soda release,Music
fine wherever go stop requesting bts ft army world must hear tonight,Music
hii friend would love hear kill music daily ty,Music
story behind music version theme song,Music
bright morning vote unmovable vote bright song unmovable vote kan goo best thai song vote unmovable sad movie,Music
reminder please post song please spoil comeback last go hiatus let sabotage,Music
shout devil,Music
woman reach peak apple_music worldwide,Music
find mbc voice ad find mbc voice ad listen_live wake_morning f_urban talk_news laugh,Music
love icon make sense ok king win award win soty bestest boy,Music
f x wish wish listen_live wake_morning f_urban talk_news laugh,Music
u music_video wami wokqala lo bafethu please watch subscribe comment share link music_video friend mbzet official music_video feat link thank,Music
perfect blend music sport charity hatid ng,Music
p dwayne chavez dj payback gonna kick th july mix weekend like old time,Music
permission_dance vote,Music
relaxing music_video meditation music_video calm music stress video please visit youtube channel subscribe,Music
currently number eighteen limang libong tc light mv link bgyo light asap,Music
add album f world spotify powered,Music
seokhwa said really like oneus sunbaenim song baby song really good,Music
watching catch male version great athlete field feel music find rhythm,Music
harry style watermelon sugar official audio x yesssss,Music
notorious big big poppa listen_live wake_morning f_urban talk_news laugh,Music
ft perfect match tonight thank,Music
mistake need apple_music,Music
port harcourt ready home away concert coming th december higi haga along peter odili road time pm carpet pm main event,Music
every cix music_video,Music
permission_dance streaming,Music
permission_dance vote,Music
green yellow green bay packer theme song anthem last time dropped packer anthem super bowl throwin,Music
f move listen wake_morning f_urban talk_news laugh,Music
let go summer walker,Music
x let fly high,Music
kpop mv reach like youtube last kpop mv reach like bts permission_dance,Music
pro pain song day divided stand album absolute power,Music
amount time listened non living thing crazy bless masterpiece album,Music
chris stapleton starting official music_video,Music
tweet rm need permission_dance,Music
permission_dance official mv surpassed view youtube,Music
put mirror album plzz,Music
permission_dance mv surpassed view congratulation,Music
remember came one guy say album wey na sax full inside guy shey see sax blow album reach,Music
jesus light lfcc classic road darkness brightest way,Music
sober reflection dedicated lord jesus christ noble,Music
edward barber sings please stay,Music
check album window listent spoty,Music
music_video everywhere go run guy,Music
unto u like lord reprise israel houghton breed,Music
fresh find discover music hot talent give listen popstar dnb remix doozy listen,Music
cause need permission_dance,Music
pre save album moment time nairo vol spotify powered,Music
haluuuuuu sasagipinkitadarren onasap apple_music youtube spotify,Music
purple disco machine sophie giant hypnotized,Music
watch music_video,Music
wonder call sing imagine olympics,Music
camper show love help u send china style blessed busy authentic dedicated music man also love belief work great trip,Music
love song much emotional im reminded many memory iz one love,Music
surely brought album get week holiday shrink,Music
sunday vibe wait get back play live stay safe snd check streaming service,Music
mad maestro handicap national anthem year miss favorite bet super bowl,Music
really looking forward group talent dream waste time let debut learn mistake already good artist work hard hidden building,Music
ht square copy total ktl copy total hylt copy total album copy total vote,Music
deckchair poet iced bun album always piste christmas playing final track decade finishing laugh,Music
l j reynolds key world,Music
