cleaned_text,topic
inoculation second dose coronavirus vaccine scheduled begin monday april postponed read full story,Health
west coast currently world worst air quality,Health
compare communication cancer scientific communication fieldif communication becomes solid collaborative cancer would make thing easier week,Health
president k museveni teacher get fully vaccinated shall allowed teach communal prayer suspended next day,Health
dear guy pls get together create im social distancing going public type checkin know like marking safe marking home let flatten curve,Health
see light end pandemic tunnel prepare coming challenge writes jagdish rattanani,Health
zahawi second dos pfizer vaccine available,Health
world mental health day business leader vulnerable mental illness fastmoving digital economy,Health
social distancing crucial check simulation well shown washington post,Health
walensky md mph biden im questioning cdc director leadership mask guidance confusing discriminates disabled child go impending doom day im team joe doubt walensky,Health
madeline grant hit nail head telegraph morning slippery slope could result snatching liberty long term quickly could become orwellian without proper scrutiny,Health
covid denialism liverpool acknowledge engage problem medium era difficult impress evidence quality people believe youtube video governmentcontrolled drs scientist echo,Health
enter giveaway national breast cancer awareness month,Health
covid pandemic threatening hardwon gain fight setting world track meeting global un target must continue provide tb care treatment prevention team,Health
extensive social distancing usually work best class journalism washington post,Health
lord sumption news uk people go want continue self isolate nurse key worker risking life selfish prick think stay home soon,Health
meeting fifth since lockdown stop spread coronavirus started march modi,Health
claman said wearing mask choice people want sure go ahead biden administration even know cdc going make announcement,Health
halfway ride remarkably slightly schedule mile circuit really enjoying tailwind quite headwind way back never mind lap go support,Health
functional movement disorder different syndrome discover difference child hospital bonus offer free listener,Health
total number ohio least today reporting death co ohio state penitentiary youngstown incarcerated person prison hospital probable fatality,Health
guess breast cancer appreciating stop using sunday excuse stop acting like ungodly maybe either fallen tiny presentable bra day,Health
could loss smell taste early indicator covid research done san diego health claimed read full article,Health
dr dare trial result think trial move investigation field acute illness hazard risk different think followed future investigation,Health
combined nk cell therapy radiotherapy exhibit longterm therapeutic antimetastatic effect human triple negative breast cancer model ht,Health
athlete de campus closed notice practice weight roomin addition cant show track workout workout group safe healthy update occur hear district state,Health
communication secretary martin andanar encouraged youth leader join fight coronavirus disease covid pandemic,Health
shutting city enough shut airport faa breed schaaf liccardo,Health
ministry health family welfare shortage sign petition org india,Health
tell government right thing requisition private hospital bed boost nh capacity deal get jupp mp sign union petition,Health
super bummed didnt get play kid marathon starting line morning thanks lot guess well plan seeing awesome family runner rescheduled date october,Health
t day cochairs john harrity sandy maxey david jaffe pump u count u one last time start st finish strong,Health
tim iredale looked latest govuk publication health social care make social care funding help pandemic clean tim iredale many careproviders may close,Health
hi supermarket help considered making aisle one way might help people keep,Health
pandemic data v pandemic myth fortunately suicide increase due pandemic second biggest proportional change suicide surprisingly news,Health
pls awareness also raised postrate cancer kill men really large scale breast cancer let join hand eradicate postrate cancer,Health
reason diamond weighed lb bout announced non title arbitrarily khabib abdicated ufc lightweight title second upon retirement know crown dustin champion,Health
seibert citizen proud stepped taken responsibility home abroad fight please keep great effort continue provide funding health organization need grow spahn,Health
chair mets police federation told connell radio officer priority list vaccine warns without police could end superspreaders seek protect rest u,Health
risk level trotros church etc activity social distancing patrick aboagye director general ghana health service,Health
neither forced pm modi indian result amazing keep positive spirit maintain let get india,Health
signed open letter health minister javid outlining quality public looking next ceo add name,Health
pose take picture send people dont know kehlani,Health
sir please come ground level know condition people save life final year student sir india swamy india,Health
regular volunteer martin distribution center nashville lisa joe donated nearly hour time fighting hunger since start pandemic read,Health
library staff univ rcvd forwarded email provost cya message appreciated enthused team colleague like carry georgetown time still open tomorrow,Health
line speaks stand truth adverse condition flood covid justice u begging ironically democracy life listen u india ramesh pokhriyal nishank save u swamy politicise gandhi,Health
crystal guide health wealth happiness prize pk chakras aligned energy flowing stone cleansed limit power harness crystallize,Health
covid vaccine translate bio delayed next year delay development another setback sny addition delay development vaccine along gsk nvax jnj alt,Health
believe get someone better run cdc biden,Health
series nightingale london agile response pandemic professor charles knight chaired presidentelect professor roger kirby free apr register free place,Health
stay safe everyone let pray lang po shairu madrid diaz,Health
dear please stop playing free weight area long beach gym evening seeing horrific bloody ffs,Health
walensky md mph charged office center cdc develop intervention measurable health outcome next year addressing racism respective area made clear priority entire cdc,Health
update please assured communicate news change open soon working alongside provide u official information come hand keep uptodate facebook school app,Health
october breast cancer awareness month cancer warrior receive service month october book appointment,Health
losing make feel like want die sister man died testing positive otay mesa detention center said news san diego,Health
highly recommend washington post piece authored superintendent middleofnowhere arizona he already lost one teacher he worried losing state funding,Health
sweden taken different approach face pandemic allowing people go social distancing guideline develop herd immunity price high time death toll neighbour york time,Health
racing uk k morning due early matinee musical wont good luck runner glad heat gone race good condition pb runner fun,Health
approval fda saliva test virus expected start clia lab coming week welcome news school medicine yale rapid covid saliva test receives fda emergency use authorization,Health
latest moluccan human right weekly thanks,Health
declares national emergency usa fight covid open b state territory introduces sweeping measure american hospital usa covid case news,Health
back tried different tactic year basically ran almost exact time second slower last year personal best thats quite skill yep completed th half marathon pleased,Health
social distancingisolation safaai mantra wipe threatall careful till next day authority noida authority indiafightscorona,Health
jacinda ardern said today government police enforce selfisolation example denmark lady caught flight auckland christchurch tested positive people need sensible ardern national party joke,Health
