cleaned_text,topic
spotify gfriend surpassed stream platform th song full album congratulation girl,Music
check awesome spotify playlist new music inspiration weekend massive thank including new single waitingforrain feat saturdaythoughts newmusic weekendvibes spotify np,Music
fresh find discover new music hot talent give listen diego opty hiphop rap newmusic follow opty listen groovereffect,Music
permission dance really power make people happy instantly thankyoubts,Music
kudos music crew entertainment n cryin aintitstrange,Music
hunter thompson favourite song lou reed bob dylan like spirit sky white rabbit huntersthompson dylan reed rod stewart,Music
nowplaying np prince would die u listen wake vog morning nitm mf urban talk news laugh,Music
watch oklahoma musician release new album christmas light music video home movie happyholidays,Music
jungle open rolled rider stole food bear brought back lion hold court ape gorilla lighter got eye tiger heart fighter wayne weezy f tha mobb lilwayne bar rap,Music
rnzl lemon pepper freestyle debut uk spotify chart stream drake th rick ross th entry chart rick ross highest peaking song uk spotify chart surpassing like,Music
mclassradio nowplaying tru rider fronteng duceydaphatom newmusic trendinghits yycmusic todaysmusic listen live,Music
top lastfm artist tokio hotel harry style bring horizon hawthorne height andrea bocelli weeklymusic,Music
giveon heartbreak anniversary official music video musicpick,Music
gig horizon thequeestreetbrewhouse ithelusionist ironduke free entry one bloodstockopenair metalthemasses hitchin metal mass first round come metal metalessex bloodstock,Music
huge shout phoenixboyschoir nationalanthem raceway amazing keep great work,Music
new music capitol cut puma live studio music,Music
got good time bad one cd signed jonah marais support whydontwemusic,Music
fire fly high high higher fire fly high high higher rebootx hwangholgyeonge ppajin deusi braveforx jeongsini ontong neoppunya uh hanchameul hemaedeon sungan beonjjeogin like thunder lightsaber yeah,Music
random tweet artist decade going artist next decade starboyfest starboyfestlagos wizkidfc,Music
spice sean paul shaggy go deh official music video spice,Music
uvtraveler rooted ground kbradiothp kbindieradio,Music
nowplaying np richie spice brown skin listen wake vog morning nitm mf urban talk news laugh,Music
new album like broke baby heart tho unlessimwithyou wang,Music
nowplaying best mixtape mixed flakesthemixtapemogul extended mix flakesthemixtapemogul feat blueface tyga chris brown drake post malone tory lanez wiley lil baby dababy city girl app,Music
power piano display enjoy high flavour x offering monolithic bumpinthehump stream tracklist,Music
felix spoil album bit straykidscomeback kid,Music
new music fromthe homie countmeout prod platform drop comment feedback skater imdropping sunday slow roll,Music
ghost feat akira prod litlikenoah mxrkus soundcloud new song prod,Music
red hot hot chilipeppers patti smith set participate pathwaytoparis earth day livestream concert see full lineup,Music
really want album bad god give album please hope kind people give hiks x together official tomorrowxtogether txtmagic,Music
solid presave spotify apple music checking teaser clip release indie supportmetal rtitbot,Music
ground full cam sb inkigayo ro,Music
come back lord dont wait till late edward iwantasap feel edwardbarber barber,Music
cause ah ah star tonight watch bring fire set night alight btsonhot shiningthroughhot lifeisdynamite,Music
pure poetic utmost passionate never dying tangible forever young selfish desire stopped id never thought wed come gonemvrelease,Music
fresh find discover new music hot talent give listen tictoc mo mint hiphop rap folk newmusic groovereffect follow mo mint listen,Music
purple disco machine sophie giant hypnotized nowplaying,Music
yourfavoritetexaspromoter bornpaident new music video brother bornpaidzeezy untold shot e hoodfame oakcliffamerica bornpaidworldwide dallaswallstreet ripfresh bpl,Music
spotify ww baila conmigo meses dancing devil dia,Music
nowplaying win feat snoop dogg tpain ludacris rick ross dj khaled,Music
mclean asks u u tell u told u tired castle air got dream want world share castle wall lead despair remember talking tapestry album everyone thing talking king,Music
listennow beautiful ambient sound uncharted worldz razaa music dream wishing well nowstreaming platform listen follow like share music lgtwo hunterfoxzac germany chile uk usa,Music
imagine put yeosang part preview album th listen album surprised finally get line cry ateez ateeziscoming ateezcomeback alltoaction,Music
minieeeeeeee lively lovely today stay safe jin hyung jimin jiminie jin bts staysafe,Music
purple disco machine sophie giant hypnotized nowplaying,Music
dance decade away new year mastermix good end way started radio djexeqonwbls listen live tonight pm thank,Music
nowplaying np scott f sicko mode listen live wake vog morning nitm mf urban talk news laugh,Music
excited coming next grateful hanbin dearbi,Music
nowplaying pt kanye west sundayservice,Music
outro cross line sound fancy album preview borderdayonemedley,Music
apple music uk whats next day lemon pepper freestyle ft rnzl want need ft baby peak,Music
hour min blacklovevirtualconcert visit download app playtore io enjoy concert,Music
watch brand new music video chunga short directed produce cc meneja,Music
bestoftwitter nowplaying dj khaled dj khaled rick ross future cardi b nicki minaj drake chris brown feat djkhaledchris brownliltjaycardi bpop smokerick rossjay zroddy ricchtravisscottmigoslil bab app,Music
fresh find discover new music hot talent give listen jabber jaw mocity jones hiphop rap newmusic groovereffect follow mocity jones listen,Music
boy display wide range technical musical ability track strong opener album introduction come themidnightemotion,Music
hi requested live bts conquering world right pls help u celebrate playing makeitright bts feat tonight mostrequestedlive bts,Music
np wrrr falling red storm inside,Music
really love song treatpeoplewithkindness style would really cool play today pleasedddefdcdffc,Music
apple music br dirio top permission dance peak butter peak,Music
satan worship im devil puresteel premier hardrock supporting artist since premier hiq radio,Music
apple music global butter permission dance dynamite bts btsbutter permissiontodance btsdynamite,Music
bts apple music pm kst korea top permission dance butter dynamite life go boy luv ft halsey bts,Music
nowplaying lead dark apple music nowplaying lead dark bandcamp spotify,Music
lost tryna find answer world around going crazy day night time request may please hear makeitright bts feat mostrequestedlive tonight requested live bts,Music
throwback music video song dream quindontarver august april album project quindon produced directed stokes director,Music
george benson give night official music video wdmv radio cause music air lot loving everywhere give night georgebenson,Music
partytrain w woman gone bob marley visit,Music
enjoying sound defected radio house track decade special h record nowplaying,Music
already know style new album sound even better spring song like sunflower vol adore play beautifully degree sunlight fineline,Music
dear love album pack photobooks photocards extra would cool full length lpvinyl record next album plus goody go album thought vinylcollector smoothlikebutter btsbutter,Music
newflorida duval jacksonville seddy hendrinx lowkey official music video,Music
arashi turning rhab remix official music video arashi rhab turninguprhabremix,Music
spotify global permission dance butter dynamite spotify u permission dance butter,Music
dreamcatcher got back onto music show circuit postolympics past week promoting new album much happened sure check weekly recall catch might missed,Music
info permission dance kst genie bug flo melon vibe daily chart new peak chartsk,Music
nowplaying watermelon sugar de harry style em,Music
permission dance vote bts butter army kcamexico,Music
bringing back jam honor olympics tokyo tokyoolympics tokyo hamasaki staff ayumihamasaki,Music
nowplaying never remix miccratesradio download app submit music today,Music
wheres hen thread collab drop hour,Music
nowplaying channel miccratesradio download app submit music today,Music
understand people totally streaming party rapper fandom nowadays rapper many song different genre rock rnb pop dancehall house edm reggaeton many blend got song got,Music
permission dance vote bts butter army kcamexico,Music
icymi live music longer allowed folly beach bar restaurant past pm city council held special emergency meeting thursday morning post courier scene chsnews,Music
nowplaying champion drem tgi listen dremtgi dremstuff,Music
explicit lyric ransom x big ghost ltd heavy head album stream insomniacmagazine mickey factz,Music
di pa rin masyado nag ssink sakin na james release new song soooo excited congratulation daysto soda release jamesreidsoda,Music
fine wherever go stop requesting makeitright bts ft mostrequestedlive army world must hear tonight bts,Music
hii friend lowe would love hear kill new music daily ty wkmonnmd,Music
story behind music deathinparadise new version theme song,Music
bright morning vote unmovable vote bright new song unmovable vote kan goo best thai song vote unmovable sad movie bbrightvc,Music
reminder please post taemins new song taeminbeyondlive please spoil comeback last go hiatus let sabotage shinee onew jonghyun key minho,Music
nowplaying shout devil cre anghami,Music
woman halloween reach new peak apple music worldwide,Music
nowplaying np find mbc voice ad find mbc voice ad listen live wake vog morning nitm mf urban talk news laugh,Music
love seventeen icon wont make sense ok king henggarae win award leftnright win soty bestest boy,Music
nowplaying np khaled f x laurent wish wish listen live wake vog morning nitm mf urban talk news laugh,Music
umusic video wami wokqala lo bafethu please watch subscribe comment share link new music video friend mbzet ndifunawena official music video feat link thank blackcoffee,Music
perfect blend music sport charity hatid ng fm wisholympics,Music
p dwaynechavez dj payback gonna kick th july mix weekend like old time turntup partyup,Music
permission dance vote bts butter army kcamexico,Music
relaxing music video meditation music video calm music stress relaxingmusic meditationmusic sleepingmusic stressreliefmusic video please visit youtube channel subscribe,Music
currently number eighteen limang libong tc light mv link bgyo light asap asaphitback bgyo,Music
add new album f world spotify powered,Music
seokhwa said really like oneus sunbaenim new song baby song really good official wei,Music
im watching strictly catch cracknell male version murray great athlete field cant feel music find rhythm keepdancing,Music
harry style watermelon sugar official audio x harrystyles yesssss,Music
nowplaying np notorious big big poppa listen live wake vog morning nitm mf urban talk news laugh,Music
bts ft perfect match tonight mostrequestedlive thank requested live boywithluv bestmusicvideo iheartawards,Music
mistake need apple music waycrank child,Music
port harcourt ready home away concert coming th december higi haga along peter odili road time pm carpet pm main event homeandaway musicconcerts,Music
every cix music video cixpensive cixtesseract cix,Music
permission dance permissiontodancem permissiontodance bts streaming,Music
permission dance vote bts butter army kcamexico,Music
green yellow green bay packer theme song wayne weezy f new anthem last time dropped packer anthem super bowl throwin gopackgo nflplayoffs superbowl packer newmusicalert,Music
nowplaying np dinero f baby move listen wake vog morning nitm mf urban talk news laugh,Music
nowplaying let go summer walker,Music
x let fly high mamavote x,Music
kpop mv reach like youtube agustd last kpop mv reach like bts permission dance,Music
propain song day divided stand album absolute power propainsotd propainmatters propain propain,Music
amount time listened non living thing nopressure crazybless masterpiece album,Music
chris stapleton starting official music video finsup,Music
tweet rm need permission dance rm rm namjoon bts,Music
permission dance official mv surpassed view youtube bts permissiontodance,Music
put mirror album plzz wonho shownu minhyuk jooheon im kihyun hyungwon monbebe x,Music
permission dance mv surpassed view congratulation permissiontodance permissiontodancem,Music
remember mil came one guy say album wey na sax full inside guy shey see sax blow album reach,Music
nowplaying jesus light walker lfcc classic he road darkness brightest way,Music
nowplaying sober reflection dedicated lord jesus christ noble,Music
edward barber sings please stay maywardmyxemojicharades barber,Music
check new album window audio audius listent spoty spotify ep lofihiphop lofi chilledvibes,Music
new music video everywhere go run guy hiphopvideo,Music
nowplaying apradiouk unto uswho like lord reprise israel houghton new breed houghton,Music
fresh find discover new music hot talent give listen popstar dnb remix doozy hiphop rap newmusic groovereffect listen,Music
cause need permission dance permissiontodance,Music
presave new album moment time dnairo vol spotify powered,Music
haluuuuuu sasagipinkitadarren onasap darrenespanto apple music youtube spotify,Music
purple disco machine sophie giant hypnotized nowplaying,Music
watch new music video heavenangel driver era,Music
tokyo mayer wonder didnt call sing imagine olympics,Music
camper show love help u send dj china style blessed busy authentic dedicated music man also love belief work teacher great trip djmilnyc chinaaintready,Music
love song much emotional im reminded many memory izone love welcometoizland izoneoneiricdiary izone,Music
surely brought new album get week holiday shrink zombiesurvivalmode,Music
sunday vibe wait get back play live stay safe snd check streaming service diypunk punkrock,Music
mad maestro handicap national anthem year miss favorite bet super bowl barstoolsportsbook,Music
really looking forward group talent dream waste time let debut learn mistake already good artist family work hard hidden building yglettreasuredebut,Music
ht square copy total ktl copy total hylt copy total album copy total vote howyoulikethat bestmusicvideo iheartawards,Music
deckchair poet iced bun album always piste christmas playing progmill final track decade finishing laugh,Music
nowplaying l j reynolds key world takemebacksundays afternoonking mrhotchocolate sincetweet raregroove,Music
