text,tags
#WritingCommunity some {{USERNAME}} #SundayFunday for you...   Let predictive text complete the rest   I m done with...   Mine  I m done with the head of the day and you ll join our stream of consciousness.,WritingCommunity SundayFunday
Happy #InternationalWomensDay To all the inspirational women out there {{USERNAME}} {{USERNAME}} {@Kelly Klein@} {@Rosemary The Demon Assassin@} {{USERNAME}} {{USERNAME}} {@Floor Jansen@} {{USERNAME}} {@Jessicka Havok@} {@Julie Benz@} {@Kris Statlander@} {@Jennifer Paige@} {{USERNAME}} {{USERNAME}},InternationalWomensDay
“If an angelic being fell from the sky and tried to live in this world of ours I think even they would commit many wrongs {{USERNAME}} HimigSaASAP WithJEREMY #JeremyG,JeremyG
Happy  #internationalwomanday {{USERNAME}} {{USERNAME}} {@Sela Ward@} {@Carrie Preston@} {@Cristina D Avena@} {@Mariska Hargitay@}  The strong women are numberless  how {@Gigi D Alessio@} sing,internationalwomanday
Throwback #twitchclips  This really takes me back. I made a badge for {{USERNAME}} like two summers ago  it gives you the power of love and authenticity  I love and appreciate you sm Sarah ❤️ {{URL}},twitchclips
I did it I finally got Animal Crossing #AnimalCrossingNewHorizons #NintendoSwitch ============================= #GamersUnite {@Twitch@} twitchkittens #Twitch #TwitchKittens #TwitchTV #TwitchTVOnline #TwitchOnline… {{URL}},AnimalCrossingNewHorizons NintendoSwitch GamersUnite Twitch TwitchKittens TwitchTV TwitchTVOnline TwitchOnline
"Montrezl Harrell ( {@Montrezl Harrell@} ) is a trash player.  Patrick Beverley ( {@Patrick Beverley@} ), Paul George ( {@Paul George@} ), and Marcus Morris ( {@Marcus Morris@} ) too. #Clippers are classless trash. Trash players, trash organization. #Mavs #MFFL #WeTheNorth",Clippers Mavs MFFL WeTheNorth
Oh my God! I feel it s special dayyes Rosie it sme You made my dayThank youuuu I hope you had amazing valentine s day! Love you so much( {@Rose Ellen Dix@} {@Roxetera@} ) #cameofameo {{URL}} через {@Cameo@},cameofameo
A lot of the broadcast work for the {{USERNAME}} is hidden behind the scenes. Coming up to 3am and I am still getting overlays and drafts ready for the Saturday broadcast of week 5. Send me some energy! Or cups of tea... Either will do at this point :) #NoRestForTheWicked,NoRestForTheWicked
please if any of my moots have an {@ashe@} follow i would be so thankful if you wanted to rt a few of my tweets onto her tl   #TCOE {@ashe@} Would you maybe want to follow me and a few friends? {{USERNAME}} @_fasiha1 {{USERNAME}} @tpwknadds @91PERXFECT  We love you!,TCOE
Week 4 Rankings are updated! {{URL}} Half PPR is the primary list. Feel free to ask any start/sit questions!   #FantasyFootball #FantasyFootballAdvice {@FantasyPros@},FantasyFootball FantasyFootballAdvice
"#Amsterdam, #Bspa, #Mechanicville, #Schenectady and #Niskayuna are just some of the districts on a 2 Hour delay this morning {@CBS 6 Albany WRGB@} ",Amsterdam Bspa Mechanicville Schenectady Niskayuna
I remember when I first started streaming on YouTube early 2019 u was my first ever dono {{USERNAME}} today I gifted u 3 subs on #twitch to complete ur 50 subs points unlocking the last emote slot! Congrats bro u deserve it n more!,twitch
"11/04/20 #Palestine #Israel {{USERNAME}} {@U S Central Command@} : A Palestinian motorist fired a pistol at Israeli soldiers in the occupied West Bank on Wed., and the motorist was killed by the Israeli soldiers. The dead man was named by Palestinian security official as Bilal Rawajba, a...(1/2)",Palestine Israel
"Hope everyone had a good christmas and got lots of new guitars, pedals and amps!  Making up time from the christmas break, I ve got both benches clear and 2 jobs on the go at once :) {@Fender@} {@Bosch Power Tools NA@} #luthier… {{URL}} ",luthier
#아스트로 #ASTRO #GATEWAY #Knock #널찾아가 #ASTRO_GATEWAY_OPEN {@ASTRO@} So the fact that I’m me and no one else is one of my greatest assets. Emotional hurt is the price a person has to pay in order to be independent.,아스트로 ASTRO GATEWAY Knock 널찾아가 ASTRO_GATEWAY_OPEN
♬ {{USERNAME}} - The Lord s Prayer♬ #NowPlaying on #PraiseworldRadio  Log on to {{URL}} or download the Praiseworld Radio mobile app from your appstore to tune in.,NowPlaying PraiseworldRadio
"Reposted from {{USERNAME}} Happy Mothers day! 《Grandma, mother, daughter, sister, aunty》❤  #mother  #mothersday #mothersday2020 {{URL}} ",mother mothersday mothersday2020
Out with {{USERNAME}} to see the new Star Wars movie. #riseofskywalker #starwars #siblings #christmas @ Carmike Salem Valley 8 {{URL}},riseofskywalker starwars siblings christmas
THERE IS A MAN ON MY BUS WITH A CLIMATE CHANGE SIGN WITH LIZZO ON IT SAYING “TIME TO BE GREAT” !!!!!! I AM LIVING {@ALL THE RUMORS ARE TRUE@} #climatechange,climatechange
"Happy International Women s Day to all good women out there, especially my woman {{USERNAME}} An equal world is an enabled world. #IWD2020  #EachforEqual",IWD2020 EachforEqual
"#HappyWomensDay2020 If there s one thing for you girls and women out there to read/listen to/watch as you are marking this special day, then I very much recommend this {{USERNAME}}  s Facebook post {{URL}} ",HappyWomensDay2020
May the auspicious occasion of Eid bless you with peace and bring joy to your heart and home .  Eid Mubarak #BDARMYEIDWITH_BTS {@BTS_twt@},BDARMYEIDWITH_BTS
The greatest pleasure in life is doing what people say you cannot do. #LouDre {{USERNAME}} {{USERNAME}},LouDre
Imagine if the Green Bay {@Green Bay Packers@} of WISCONSIN all took a knee at practice and refused to continue with the #NFL season until the cops who shot Jacob Blake were arrested! {{URL}},NFL
#InternationalWomensDay #SundayMotivation #SundayThoughts   To all those inspiring and amazing women out there  {{USERNAME}} {{USERNAME}} {{USERNAME}} {{URL}},InternationalWomensDay SundayMotivation SundayThoughts
" 3 men in the box...   Well....actually, no I won t. I ll leave that to {{USERNAME}} #MCYvSYD",MCYvSYD
"While revelers rang in the New Year, parents Megan and George celebrated the birth of their son Charlie at CPMC. {@KRON4 News@} shares more on the 1st #SanFrancisco baby born of the decade. {{URL}}  #HappyNewYear #newborns #TeamSutter {{URL}} ",SanFrancisco HappyNewYear newborns TeamSutter
". {@Rashami Desai@} , who recently got on the streets of Mumbai to do some vegetable shopping. Check out her pictures!  #BiggBoss13 | #RashamiDesai | #COVID19 | #Coronavirus | #CoronaStopKaroNa | #CoronaVirusUpdate {{URL}} ",BiggBoss13 RashamiDesai COVID19 Coronavirus CoronaStopKaroNa CoronaVirusUpdate
"#RoxieJo, #FlintMatthew, and I went and saw the {{USERNAME}} at the #RushCountyFair this evening in the pits before the show starts at 7! Turns out the heat won…. @ Rush County Fair {{URL}} ",RoxieJo FlintMatthew RushCountyFair
First time in 32 year {{USERNAME}} won’t be open  celebrating valentines will miss it but please god be back at it next year if your cooking tonight keep it simple enjoy   Some delicious wine & food wine & some music #StaySafe #valentinesday2021,StaySafe valentinesday2021
I just updated my playlist Cool Tunes for Driving with some fresh new music! Give it a listen! > {{URL}} . . #newmusic #showlove via {{USERNAME}},newmusic showlove
"I ve entered the Thomas J. Henry Family Pizza + Game Night Giveaway, courtesy of {{USERNAME}} ! #tjhgivesback {{URL}} ",tjhgivesback
"Listening to #VPN on {@933 KFM@} this morning, {{USERNAME}} , the host, shared this horrifying statistic; every 40s, someone commits suicide in the World.  Mental health is a big issue that needs critical attention. Check out a friend, relative or neighbor today b se u might be a savior.",VPN
"I think {@FIA@} #f1 should review their penalizing system... Depending on the amount of damage, the offending team should pay the bill. Cos the it s double penalty on victim to not only lose points, but also spend money fixing the car. It might make drivers think twice",f1
The good times become great memories. The bad times become great lessons.  TuloyAngLigaya SaLOUDRE  #LouDre {{USERNAME}} {{USERNAME}},LouDre
Diba year of the rat? Bakit may dog? Haha #iWantLuckyMayWard {@Maymay@} {@Edward Barber@},iWantLuckyMayWard
"I love living here at {{USERNAME}} - here s why we love the house. Has lots of room, big yard, and wooded area, just a beautiful home and a nice community. We really love how everyone in the community looks out for one another. {{URL}} #Community Rewards",Community
"Late start, idk how late I’ll be up.   Let’s get into some {@DayZ@} we have a Base to Protect & Build⚔️  All Live on {@Mixer@} #Mixer #Streamer #DayZ #MyDayZ #Survival #Gamer #SmallStreamersConnect #Discord #MotoFamilyGarage {{URL}} ",Mixer Streamer DayZ MyDayZ Survival Gamer SmallStreamersConnect Discord MotoFamilyGarage
Reason 1179 why I am a clown:   - I went on {@Bumble@} Friends shortly after I started my beauty page to find fellow bloggers and people who love social media as much as I do. But it ended up being all #Arbonne girlies! And that’s how I ended up leaving the app!,Arbonne
Why is {@CNN@} reporting on the projectiles hitting law enforcement but not on the excessive force police officers continue to use on protesters across the country?   #BlackLivesMatter #EndPoliceBrutality,BlackLivesMatter EndPoliceBrutality
"Happy Father’s Day to my main man!!  We love your Jesus-lovin’, hard workin’, mad skillz drummin’ heart! You’re our Superman. We love you, Daddy! {{USERNAME}} #Imwiththedrummer {{URL}} ",Imwiththedrummer
"19.7M  keep going IDs, let’s get that 20M! {{URL}} #BI #HANBIN #비아이 {@shxx131bi131@} ",BI HANBIN 비아이
“Flying into the mist.” Sit down and let it flow. {{USERNAME}} #SCBWISummerSpec,SCBWISummerSpec
The latest The Fire safety Daily! {{URL}} Thanks to {{USERNAME}} {{USERNAME}} #onpoli,onpoli
Check out what I just added to my closet on Poshmark: San Francisco Tote Bag Canvas. {{URL}} via {@Poshmark@} #shopmycloset,shopmycloset
The difference between who you are and who you want to be is what you do  – Unknown #AyOSAngSummerWithRuru RURU MADRID {@Ruru Madrid@} {@All Out Sundays@},AyOSAngSummerWithRuru
"I m really proud of the work we ve done in the last few weeks. {{USERNAME}} was forged at the closing moments of the decade, but we ve already come so far. I m looking forward to where we go from here. #BestOf2019 #NewYear2020",BestOf2019 NewYear2020
"Right when I start showering, you get us with  social distancing.  Thanks a lot. #SubtweetCoronavirus @SubtweetSundays {{USERNAME}} {{USERNAME}} {{USERNAME}} {{USERNAME}} ",SubtweetCoronavirus
Check out what I just added to my closet on Poshmark: Life is good tee live outside the box. {{URL}} via {@Poshmark@} #shopmycloset,shopmycloset
#BecauseOfBlackBirdersWeek I found a bunch of great Black researchers whos work I now follow. I seized the opp to amplify Black voices. I heard important experiences. I m doing earnest research into lifting & engaging my Black students & peers. Thanks {{USERNAME}} !,BecauseOfBlackBirdersWeek
"Starting My New Year off with Dual Citizenship!  AFRICA IM OFFICIAL!!  Momma & Kids Too. The Best Gift of the Decade Award goes to {{USERNAME}} ✊ #thebridges @ Libreville, Gabon {{URL}} ",thebridges
"Yessss! I am now a proud patron of Hunt the Front on {@Patreon@} , and you should be too: #NewPatron {{URL}} ",NewPatron
Kristina Vogel tells {@Chris Hoy@} she is “really happy now” & has built herself a  really nice life  after the training crash that left her paralysed in 2018.  Watch the full interview on BBC Two coverage of #Berlin2020 from 13:45 GMT {{URL}},Berlin2020
Sitting w/the husband having coffee & he sighs  What s up  says I  I miss my family  he says & I look confused  I miss {@Tia Kofi@} and I miss {@Lawrence Chaney@} and I miss {@BIMINI@} too   I am presently trying to clean up the coffee that sprayed out of my nose and mouth. #DragRaceUK,DragRaceUK
"Some stuff I wrote to remember this week including a trip to {{USERNAME}} for Smokefest, cooking a throwback meal and why inconvenience makes me happy. #beecapoftheweek {{URL}} ",beecapoftheweek
"Brothers and sisters, friends and family, Eid Mubarak to you all. From the bottom of my heart, I pray that the Almighty makes our lives beautiful and our struggles meaningful Eid Mubarak  {{USERNAME}} {{USERNAME}} #ElimikaWikiendi",ElimikaWikiendi
Very moving morning singing at the village war memorial in Colerne. Now going to share our songs and stories in {{USERNAME}} at 13:15 outside {@Debenhams@} . We will remember them. #remember #remembrance #poppy… {{URL}},remember remembrance poppy
"Almost 9000 Followers :) Come watch me at {{URL}} #StreamGhouls #Twitch {@Twitch@} Full time streamer, stream every single day. At randoms time but trying to fulfill my stream schedule <3",StreamGhouls Twitch
Check out what I just added to my closet on Poshmark: Breaking Bad T-shirt. {{URL}} via {@Poshmark@} #shopmycloset,shopmycloset
Morning Mme {{USERNAME}} & {@Khaya Mthethwa@} I just woke up listening to lovely and inspired #SecretSpace_show on {@METROFM SABC@} keep up the good work. We love you. Amen,SecretSpace_show
#mothers_day Let s respect women they are our mothers they gave us life without them we nothing I couldn t be here without them you have my bless all the women out there all the mothers out there @mathiasiyaloo A… {{URL}},mothers_day
i feel like giving up on my work. Losing my drive & interests. Can you give me some motivation Nong {@bright@} #talkwithbright,talkwithbright
Read Psalm 1. Check out the 2 ways.  Way 1:  Blessed is the man whose delight is in the law of the Lord is like a tree planted by streams of water.    Way 2:  The wicked are like chaff that the wind drives away.   #1 is like HIGH-SPEED INTERNET. #2 is like DIAL-UP. {{USERNAME}},1 2
Regardless of Mother Nature delaying my flight from #DFW I still would have gotten home THREE hours later than expected due to other UNKNOWN flight delays. {@americanair@} it’s your policy to provide a compensation. #ECB > #SDF  took 12 hours!!!!! #unexcuseable,DFW ECB SDF unexcuseable
HAPPY FATHERS DAY TO EVERY DAD EVERYWHERE BE~CUZZ I CARE ABOUT YOUR WELFARE   #FATHER  #CHILD #PATIENCE #TRUST #TIME #LOVE #PRIDE #JOY  GOD BLESS #OUR CHILDREN EVERYDAY IN EVERY WAY #YAHWEH✝️  BE~ {{USERNAME}} … {{URL}},FATHER CHILD PATIENCE TRUST TIME LOVE PRIDE JOY OUR YAHWEH
#156 Spring Forward &amp; Fall Back {{URL}} via {{USERNAME}},156
"happy #InternationalWomensDay to all the inspiring and powerful women out there. thank you {@Ellen Pompeo@} for teaching us to never be afraid of being ourselves, speaking up, standing up for what we believe is right, and aiming at the best version of ourselves.",InternationalWomensDay
"Hope all the farm women out there have had a good International Women s Day. I m thinking it should be like Nollaig na mBan - lots of tea, cake, wine or gin. I like how {{USERNAME}} has highlighted many farm women today too  #IWD2020",IWD2020
The latest The Blue Reef Daily! {{URL}} Thanks to {{USERNAME}} #fracking #sharkscience,fracking sharkscience
Stay home—social distancing flattens the curve. Don’t go to the ER unless you need emergency care (not because you want a #covid19 test).  My {@The Washington Post@} op-ed on the actions we can all take now to avoid overwhelming our hospitals & save lives. {{URL}},covid19
Reading Harry Potter and the Deathly Hallows puts my inability to find toilet paper in perspective. At least Voldemort isn’t around. {@J K Rowling@} #quarantinereading,quarantinereading
"Sometimes I think that it is impossible to love you more than I already love you. But then at every moment you show me that I am completely wrong, because it is possible #8월의_햇살같은_호영아_생일축하해 #HAPPYHOYOUNGDAY #뷰애기들과_함께하는_호영이의_빛나는_여름 {@VERIVERY@} ",8월의_햇살같은_호영아_생일축하해 HAPPYHOYOUNGDAY 뷰애기들과_함께하는_호영이의_빛나는_여름
At approximately 1240 am this morning the restaurant was broken into by an unknown male. We were alerted by our alarm system and {{USERNAME}} responded. Video footage is being reviewed. Thank you to RPD and RPD K9 for making sure the building was cleared and safe. #ROC,ROC
"Already sold ot!!!! If I can t play this, I m not sure the con will be worth attending!  Nah, this sounds like fun but GaryCon is still going to be great.  Black Magic and Beignets: Disney Princesses in New Orleans {{USERNAME}} .con {{URL}} ##event #convention #boardgames",event convention boardgames
"Rainbows Over Cedarwood by {{USERNAME}} ~ The moment Ashley gave up looking for the right man, he showed up in the form of restaurateur Colt Harrison. Sexy has never looked this good. #pridepublishing {{USERNAME}} #gay #gayromance #kindle #hotread {{URL}} ",pridepublishing gay gayromance kindle hotread
I feel like #Lafayette‘a jump off the table was really fun for {@Daveed Diggs@} to do until the supports in his boots started to wear down,Lafayette
"I’m at my store and I have on my {@Dak Prescott@} jersey and a customer came in said I seen you had on Dak Jersey so I had to let you know he’s my cousin I said oh wow how excited, she said once her husband found out now he’s for the Cowboys #hadtoshare just thought it was pretty cool",hadtoshare
“kasi siguro they will take the country by storm” hahahahahahah omg ms toni i can relate   #IFeelUBGYO {@BGYOPH@},IFeelUBGYO
The bad news is time flies. The good news is you re the pilot  TuloyAngLigaya SaLOUDRE  #LouDre {{USERNAME}} {{USERNAME}},LouDre
#BestOfCapitalSTB  Throwback to 2010 when me and my sister had the best day and travelled down to London for the weekend to see some of the biggest acts :) can’t wait for our live FaceTime version this year in the garden ;) {@Capital@},BestOfCapitalSTB
Some kiddo with the username Megoomine on {@Rainbow Six Siege@} {@Ubisoft Support@} harassed me the entire game for being gay....   Happy Pride Month to me   #rainbow6siege,rainbow6siege
The perfect dirty via {{USERNAME}} at barvonderfels .....: pizzafaceyyc  #martinihour  #dirty @ Bar Von der Fels {{URL}},martinihour dirty
Happy Mother’s Day to all the mommas out there - especially the ones committed to matching with their littles  {{USERNAME}} #Bodenbyme {{URL}} #liketkit {{URL}} {{URL}},Bodenbyme liketkit
GUYSSS GOOD MORNING  Omg I’m so nervous I haven’t seen the video ahhhh I’m going to watch it right more Im soooo excited but NERVOUS {@SF9official@} #SF9   #에스에프나인   #9loryUS   #여름향기가날춤추게해   #SummerBreeze,SF9 에스에프나인 9loryUS 여름향기가날춤추게해 SummerBreeze
"Labor Day Weekend... so odd to drive by {{USERNAME}} and there’s very little activity, where it normally be hustling with our County Fair! 2021 can’t come soon enough!  #signofthetimes #countyfair #statenisland #nyc #LDW",signofthetimes countyfair statenisland nyc LDW
"Happy #IWD to all the women out there, keep being phenomenal. {{USERNAME}} {{USERNAME}} {{USERNAME}} {{USERNAME}} {{USERNAME}} {{USERNAME}} {{USERNAME}} {{USERNAME}} {{USERNAME}} {{USERNAME}} {{USERNAME}} {{USERNAME}} {{USERNAME}} {{USERNAME}} {{USERNAME}} {{USERNAME}} I appreciate you.",IWD
"I m sure God destined me to meet you. I hope I don t just get to know you and see you from TV or the internet, I hope we can meet there are so many things I want to talk about. I hope God can fated us to meet, I really love you guys. I don t know what else to say. {@BTS_twt@} #BTS8",BTS8
HAPPY OBAMA DAY !!!! {@Barack Obama@} Thank you Mr .President for being who you are! We honor you today! We want you back! SALUTE!  #HappyObamaDay  #FavoritePresident #WeNeedObamaBack,HappyObamaDay FavoritePresident WeNeedObamaBack
Another awesome {@Roblox@} live stream with {{USERNAME}} too!! Catch up on all the Bee Swarm hype! {{URL}} #Roblox #BeeSwarm {{USERNAME}},Roblox BeeSwarm
Check out what I just added to my closet on Poshmark: Baby Bad bunny  T-shirt. {{URL}} via {@Poshmark@} #shopmycloset,shopmycloset
I’m felling ❤️❤️. I had 16 students show up to our first Zoom meeting today!  It was so good to see them and hear them and talk to them {{USERNAME}} {{USERNAME}} #room24,room24
The latest The Food truck Daily! {{URL}} Thanks to {{USERNAME}} #rochesterny #roc,rochesterny roc
"I m leaving on a jet plane...Oh wait, I m not. After an hour delay before we could board, I m now stuck on a plane with no power. Anyone have a spare set of booster cables? {@Air Canada@} #DF19",DF19
"the chiefs might have lost, but this grilled cheese board was a winner.  (also, at this point i need {@Target@} to sponsor me for use of this serving tray.)  #amandajadexx @ Society Hill, Philadelphia {{URL}} ",amandajadexx
I m on the last {{USERNAME}} #rapid of the night with about 15 other riders. I am the only woman.    I wanna walk through the park in the dark Women are scared that men will kill them I hold my keys Between my fingers  {@courtney barnett@},rapid
"So blessed to share and bring in #2020 with my beautiful family Maria, Matisse and Miro {{USERNAME}} miro.dali catalinabarandgrill  Happy New Year!! !!! {{URL}} ",2020
Happy Mother’s Day! Truly the most important of jobs! Blessed to have such a great mother myself and very proud to have the absolute BEST mom raising our boys! #love #HappyMothersDay {{USERNAME}},love HappyMothersDay
"Sipping on some {{USERNAME}} w my new espresso machine, watching the masters, ready to flip over to {@Scott Hanson@} in a few. #lifeisgood",lifeisgood
"Hit level 60 in #Shadowlands  in just over 14 hours (including decent breaks every couple of hours), Haven t finished the story yet (just started revendreth); but so far I will say {@Blizzard Entertainment@} has knocked it out of the park! Great job team!",Shadowlands
Classic service from {@Ryanair@} book the early flight to make the most of a weekend in Dublin. 2 hour delay but the next flight is boarding an leaving on time #ryanair #gatwick,ryanair gatwick
Stay safe bb. Pagaling ka {@Maymay@}   MAYWARD JAMPACKED FUNDAY #MayWard,MayWard
#repost {@Shantel VanSanten@} ・・・ 107 degrees before noon?!?!?  Labor day weekend plans are to live in my pool this weekend!! #CanISleepFloatingInThePool #WrinklyFingers {{URL}},repost CanISleepFloatingInThePool WrinklyFingers
Happy #InternationalWomensDay to all the women out there who are breaking through boundaries. This playlist is for you {{URL}} Special shout out to {@Juno Dawson@} {@Liz Carr@} and {{USERNAME}} as the women whose tweets inspire me the most  #IWD2020,InternationalWomensDay IWD2020
Smile!! Someone else love you #RuruXGOTGFinale {@Ruru Madrid@},RuruXGOTGFinale
"#COVIDー19 British borders still open, at a time when border closures are essential, taking back control promoters!! Are doing the opposite. Britain never needed a Churchill more.! Pity {@Boris Johnson@} wasn’t still in that DITCH,",COVIDー19
"So honored and grateful  to celebrate #FathersDay ‍♀️‍♂️ —- what a privilege to honor the beloved, model perfect [husband x human being] father of my children, best friend forever and husband on this upcoming special day. {{USERNAME}} {{URL}} ",FathersDay
Giving up is Not in THALA Fans Bloods ❤  Halwa City I d Again Back to Bang on Twitter. Follow and Support {{USERNAME}} Valimai | #ThalaAjith,ThalaAjith
Enter daily for your chance to #win the {{USERNAME}} $25 Million Dollar #Sweepstakes! Winners will be selected to receive a $500 drink certificate in the Airtab app! {{URL}},win Sweepstakes
#htownrush {@Chita Craft@} {@Xavier Walton@} {@Stephanie Simmons@} {@BrandiKHOU@} Good Tuesday morning. Laura not looking good for us and LA. Have a great day today and be safe. Be prepared. Think of others. WEAR THE MASK .,htownrush
I miss my teddy bear. Would you sleep with me? {{USERNAME}} BeMyValentine JEREMY #ASAPisLOVE,ASAPisLOVE
"#delhihighcourt  J. Hari Shankar: Can t make the head and tail of what the matter is, the matter runs into 277 pages. Synopsis is insufficient.   Order: petitioner to put on record a synopsis of not more than 5 pages. {@Bar Bench@} ",delhihighcourt
The only thing I’m looking forward to this year is my insurance rate going down. {@GEICO@} #2020goals,2020goals
" {{USERNAME}} & {{USERNAME}} & tell them let me hop on the “Lemon Pepper Freestyle” remix !!!!!! {@Boi 1da@}  !  #RestEasyBro ✨ #RestEasyAuntie ✨ #RestEasyZo ✨ @ Los Angeles, California {{URL}} ",RestEasyBro RestEasyAuntie RestEasyZo
The LINE you will not cross will determine the LINE God will take you ABOVE. Your DEPTH determines your HEIGHT. ~ {{USERNAME}} {{USERNAME}} #SundayMotivation #sundaythoughts  #BeXceptional #IYLConference2019,SundayMotivation sundaythoughts BeXceptional IYLConference2019
The pandemic has certainly taken a toll on the well being of several students. Board exams will definitely act as a fuel to the fire. Please cancel all the Board Exams #cancelclass12thboardexams2021  #CANCELBOARDEXAM  #CancelAllExams  #CBSE {@Dr Ramesh Pokhriyal Nishank@},cancelclass12thboardexams2021 CANCELBOARDEXAM CancelAllExams CBSE
“Common looking people are the best in the world: that is the reason the Lord makes so many of them.”-Abraham Lincoln {{USERNAME}} #abrahamlincoln #abrahamlincolnquotes #usa #usapresident #president… {{URL}},abrahamlincoln abrahamlincolnquotes usa usapresident president
Dr. #Fauci says we are in the  bottom of the 6th  when it comes to where we are in the pandemic. I hope to Christ they don t call in the {@Philadelphia Phillies@} bullpen to finish it. {{USERNAME}} {{USERNAME}} #pandemic,Fauci pandemic
"I can relate to this. I ve gotten those comments saying  This looks good, what engine did you use?  The engine is important but it won t magically make your game look good. That s on the developer  {{URL}} Fully agree with {{USERNAME}} here #gamedev #indiedev",gamedev indiedev
