text,tags
Shout out to the {@Richmond FC@} social media & comms teams. You must be exhausted. The job you’ve done - not just this week but this year - has been fantastic  #gotiges,gotiges
Entering the decade with a dress that makes me feel  . . . Dress  {{USERNAME}} . . . Shoes  {@ShoeDazzle@} . . . Photo  credit - {{USERNAME}} . . . I wrote out #newyearsresolutions then deleted them because… {{URL}},newyearsresolutions
Our son with Santa at my jobs  children xmas party. The {{USERNAME}} was amazing and lost of fun. . . . . . . . . . . . . . #turkeyhillexperience #turkeyhill #turkeyhillicecream #Christmas #christmasspirit… {{URL}},turkeyhillexperience turkeyhill turkeyhillicecream Christmas christmasspirit
Via   {{USERNAME}} No man of mine answered his cell phone during a romantic interlude. Just because there was a category 5 hurricane looming was no excuse for him to run off to work and leave me panting on the kitchen table.  #romance #RomanceReaders {{URL}},romance RomanceReaders
The Lord Is My Shepherd  - {@The Tabernacle Choir@} #Sunday #Choir #Music #Sabbath #Peace {{URL}},Sunday Choir Music Sabbath Peace
Praying for everyone in New Orleans.   I’m thankful that my niece’s university evacuated a couple days ago.  Stay safe y’all! {@Tulane University@} #HurricaneIda,HurricaneIda
"I want to sleep for four years then wake up with a degree, 6 million dollars and a happy life........  #mood #mood2020  @BaigNafisa {{USERNAME}} {{USERNAME}} ",mood mood2020
Charge the cops who shot Jacob Blake - Sign the Petition! #unarmedvictim #DemandJusticeForJacobBlake {{URL}} via {@Change org@},unarmedvictim DemandJusticeForJacobBlake
#IWD2021 This year s Theme: ‘Women in leadership: Achieving an equal future in a COVID-19 world shall be marked as we #ChooseToChallenge on International Women Day #IWD2021. {{USERNAME}} shall tomorrow join the main event hosted by multi-stakeholders in Mombasa.,IWD2021 ChooseToChallenge IWD2021
"⚪ 1 John 4:8 If you tinker with water you get wet, if you tinker with God, you get loved! ⚪ When God raised Christ, it s not only the head that raised but the body as well! The church is the body of Christ! You are the body of Christ! (Eph 1:22-23)  ~ {{USERNAME}} #RECALIBRATE",RECALIBRATE
"hoyyy my twitter is acting up, if ever I unfollowed you please message me and I’ll follow back. Dont leave me moots huhu  TREASURE WORLD DOMINATION {@TREASURE MAKER@} #TREASURE",TREASURE
#COVIDー19: Quite interesting simulations for virus spread with social distancing. Great article {@Harry Stevens@} . {{URL}},COVIDー19
JOOHEON S SMILE LIT UP THE FIRE OF HOPE IN ME EVEN MORE. GOOD THINGS WILL COME. GREAT THINGS WILL COME.  #몬베베_원호_응원해  #몬베베는_몬엑을_믿어요 {@MONSTA X@},몬베베_원호_응원해 몬베베는_몬엑을_믿어요
"I know y’all saw that video of the white girl spray painting #BlackLivesMatter on the {@Starbucks Coffee@} building. So, they get to vandalize property, but we get blamed for it? Wow. #protests2020 #PROTESTING",BlackLivesMatter protests2020 PROTESTING
"Happy Mother s Day to all the mothers out there! Especially to your mom, {{USERNAME}} #MicoleDy",MicoleDy
I was just thinking that the {@NHL@} should change the Stanley Cup to the Stanley Cap in honour of the cheating {@Tampa Bay Lightning@} #Bettman,Bettman
"I was rooting for {@Bubba Wallace@} , hope he can get back out there and find a way to the front.   Anything can happen! #NASCARPlayoffs",NASCARPlayoffs
bless {{USERNAME}} for wearing the mask on commentary #HOSS2021,HOSS2021
"The ability of the seed to multiply is when it is buried in the ground. Because God has put some things in the ground to enable the seed produce   | {{USERNAME}} | Principles of Fruitfulness  | Shalom Temple, Amasaman   #ShalomAt24 #SundaysAtICGC #YearOfFruitfulness",ShalomAt24 SundaysAtICGC YearOfFruitfulness
#CESC is taking the full amount for 4 months & thus the payment being made in the highest slab which increases the bills by 20-30%. Thats clear theft & daylight robbery. While people don’t have money to eat 2 meals a day . This is so cheap!! #Electricity_Scam {{USERNAME}},CESC Electricity_Scam
I entered this {@SuperM@} #sweepstakes on #tunespeak. Follow the link below to enter & help me win. {{URL}},sweepstakes tunespeak
"Had a lovely MD. Happy to have my husband home for it, and to be able to chat with my mum and sister in WA online. Missing my SIL - we were supposed to watch our kids grow up together. Have donated to both her foundation and {@Ovarian Cancer Aust@} in her honour this #mothersday2020",mothersday2020
Many thanks to {{USERNAME}} for flying the pride flag!!!  Happy pride to all!!! #seohrainbows #athenspridefest #athenspride #prideinquarantine {{URL}},seohrainbows athenspridefest athenspride prideinquarantine
Strange how the government is allocating 1 trillion in response to the Coronavirus but Google keeps sending notifications on my phone asking for donations. {@Google@} needs to quit trying to scam people in the name of a virus.  #coronapocolypse,coronapocolypse
bro I dead lost my phone at rolling loud when gunna was performing :( #RollingLoudNYC {@Rolling Loud@},RollingLoudNYC
I was born in Lachin where it was occupied by {{USERNAME}} armed forces 28 years ago today.  I was just 6 when first saw an soldier with a gun.  Today millions of  citizens are deprived of the right to live in their lands as a result of #Armenianagression. {@UN Human Rights@},Armenianagression
YESS GUYS 15M!!! Let’s keep going!! {@SEVENTEEN@} #SEVENTEEN  #Ready_to_love #Your_Choice #AlwaysReadyToLove_SVT #ForeverOurChoice_SVT,SEVENTEEN Ready_to_love Your_Choice AlwaysReadyToLove_SVT ForeverOurChoice_SVT
"Happy Women’s Day to all the women out there.U all are supremely talented, equivalent & strong enough. Stay Strong & Be Happy. I would like to mention few powerful women {@Shereen Bhan@} {@Sonia Shenoy@} {@Sweta Singh@} their contributions in journalism is unbelievable! #WomensDay2020",WomensDay2020
I’m streaming. Come watch me play on {@Twitch@} {{URL}} #twitch,twitch
"Friends, thank you so much for your love for my fundraiser for {@American Foundation for Suicide Prevention@} . Overwhelmed by the support you have shown by donating and sharing. If you would to help the link is below. Thank you all once again. I truly love you all.#ReleaseTheSnyderCut ❤️ {{URL}} ",ReleaseTheSnyderCut
"A sweet Easter Sunday afternoon. It’s dinner here in Winnipeg. Housemates cooked Easter dinner all afternoon while I got to listen to records. Lucky me. Much love to you all. Have a lovely sleep, Brits. Thank you {@Tim Burgess@} , {@Pulp@} {{USERNAME}} #timstwitterlisteningparty",timstwitterlisteningparty
