text,tags
....And the countdown begins ️  ....  ..........Ògbenin íjà............    7 Days to go! #Ogbeninija  #Oluwatosindoz  celestial_hymns {{USERNAME}} celestial_evangelism… {{URL}},Ogbeninija Oluwatosindoz
"#OTD On this day at 5am a year ago, the Easter Vigil. {{URL}} {@The Church of England@} #Chiswick",OTD Chiswick
#submarineschool #submarine #seabees #usn #usnavy #navy #military #maga  Check out Vintage United States Naval Submarine School Large Mug Clear Glass USN Navy US {{URL}} via {{USERNAME}},submarineschool submarine seabees usn usnavy navy military maga
Check out 1958 Topps Baseball Card TCG #263 Eddie Bressoud San Francisco Giants VG #sfgiants {{URL}} via {{USERNAME}},263 sfgiants
"Dear {{USERNAME}} , If you think an hour away s too close for comfort to Gary, try living 15 minutes from the place. #immaturethoughtstour",immaturethoughtstour
Earning #cryptocurrency for selling my stuff on {@Listia@} ! Join me using code  BYLCJS  for an extra 100 XNK. I just listed this: Mystery Envelope Recipes for Dog Treats {{URL}},cryptocurrency
Huge huge HUGE thank you to {{USERNAME}} for hosting a #Slammiversary watch along! And everyone in their chat for being so hype and also so nice to each other! Hoping it’s the start of another awesome Impact community ♥️ #InsidersPodcast,Slammiversary InsidersPodcast
"Happy Friday Morning!  Walk in unisons with the Lord Saviour JESUS!  Then you will understand righteousness&justice and equity,every good path; for wisdom will come into your heart,knowledge will be pleasant to your soul; Proverbs 2:9-10 #HappyFriday #Harmony&Joy {{USERNAME}} ",HappyFriday Harmony
#SundayFunday on {{USERNAME}} kayaking and then a much needed lunch at #Hanks. Mask up #DC and stay outside when you can!,SundayFunday Hanks DC
"Luke 9:62 JESUS replied,No one who puts a hand to the plough and looks back is fit for service in the Kingdom of GOD.   There is no turning back once you accept JESUS CHRIST lest you face HIS wrath which is eternal fire in hell {{USERNAME}} {{USERNAME}} #MegaGlobalService",MegaGlobalService
The 4th of July OUTDOOR Day Party #RepublicGARDENS 3pm-11pm SATURDAY July 4th {{USERNAME}} {{USERNAME}} belloatl  michaelgidewon {{USERNAME}} {{USERNAME}} {{USERNAME}} zute_ent {{USERNAME}} {{URL}},RepublicGARDENS
"Made it home just in time for the start of the {{USERNAME}} Jackbox panel, and I had a whole lot of FUF in the panel! Many thanks to {{USERNAME}} {{USERNAME}} {{USERNAME}} {{USERNAME}} {{USERNAME}} {{USERNAME}} {{USERNAME}} {{USERNAME}} for all the FUF! #TrotConOnline",TrotConOnline
The city is safe again thanks to these guys  #escape #enigma #sheffieldissuper #doncasterisgreat #enigmadoncaster {{USERNAME}} @ Enigma Live Escape Rooms Doncaster {{URL}},escape enigma sheffieldissuper doncasterisgreat enigmadoncaster
"The power of God has not reduced, the preaching about God has reduced #abundantharvest {{USERNAME}} {{USERNAME}} ",abundantharvest
A kingdom service worker is a defender of the kingdom of God. He puts his life on the line to defend the kingdom. He is like the armour bearer. #TheChurchWorker #WBASundayService {{USERNAME}},TheChurchWorker WBASundayService
Implementing Dark Mode in iOS 13 {{URL}} via {{USERNAME}} #ux,ux
#Glamberts {{USERNAME}} {{USERNAME}} {{USERNAME}} {{USERNAME}} {{USERNAME}} {{USERNAME}} {{USERNAME}} {{USERNAME}} {{USERNAME}} {{USERNAME}} {{USERNAME}} {{USERNAME}} {{USERNAME}} {{USERNAME}} New Video coming later.....,Glamberts
" {{URL}} Could not join in the first day, second day was excellent  Hope to catch up with what I missed & read Machinehood {{USERNAME}} {{USERNAME}} {{USERNAME}} , {@Patrick French@} , {{USERNAME}} #AI,#AIIndia,#ScienceFiction,#AInarratives",AI AIIndia ScienceFiction AInarratives
Oh yeah that s {{USERNAME}} I #asked Jo back in {{USERNAME}} which is many #yrs {{USERNAME}} #now was he {{USERNAME}} #too {{USERNAME}} and he #replied with {{USERNAME}} . Oh yeah and I #had {{USERNAME}} #other {{USERNAME}} with the {@RED@} #hair and {{USERNAME}} he used to #make a {{USERNAME}} which you just #rode on the {{USERNAME}} bck in #94 i {{USERNAME}} .,asked yrs now too replied had other hair make rode 94
I m a pleasure of the Lord I m a subject of His will His entertainment if it pleases I m an object of His majesty  Oh oh oh oh oh oh Oh oh oh oh oh oh.  {{USERNAME}} #SeasonOfTheSpirit #NLWCSOS21,SeasonOfTheSpirit NLWCSOS21
"The Hutchinson Overide may be better suited to tamer paths and pavement, per {{USERNAME}} See why on {{USERNAME}}  At The Finish  review here: {{URL}} #tarvelbygravel #graveltravel",tarvelbygravel graveltravel
Maybe there are some that we dont like how you guys treat us but thankyou so much for bringing them here ! Such a great night ! ThankYou ! {{USERNAME}} #TerimaKasihIMEfromMYICs,TerimaKasihIMEfromMYICs
“I’m trying to get a hub going for next year too” - {@Max Gawn@}  #BrownlowMedal #Brownlow2020,BrownlowMedal Brownlow2020
